,Unnamed: 0,Title,Paragraph Text,Page No
244,244,SECTIONS,and manner of application and amount of fee payable to the registrar under subsection of section the manner in which name will be reserve by the registrar under sub section of section the manner in which an application may be make by an entity under sub section of section the form and manner of notice of change of name of limited liability partnership and the amount of fee payable under section the form and manner of the limited liability partnership agreement and the change made therein and the,25
245,245,SECTIONS,amount of fee payable under sub section of section the form of notice the amount of fee payable and the manner of authentication of the statement under clause a b and c of sub section of section the manner of accounting and disclosure of monetary value of con tri but ion of a partner under subsection of section the book of account and the period of their maintenance under sub section of section the form of statement of account and solvency under sub section of section,25
246,246,SECTIONS,the form manner fee and time of filing of statement of account and solvency under subsection of section the audit of account of a limited liability partnership under sub section of section the form and manner of annual return and fee payable under sub section of section the manner and amount of fee payable for inspection of incorporation document name and change make therein statement of account and solvency and annual return under section the destruction of document by registrar,25
247,247,SECTIONS,in any form under section the amount require a security under clause a of sub section of section the amount of security to be give under section the fee payable for furnish a copy under clause b of sub section of section the manner of authentication of report of inspector under section the form and manner of particular about conversion under the proviso to sub section of section in relation to establishment of place of business and carry on business in by,25
248,248,SECTIONS,foreign limited liability partnership and regulatory mechanism and composition under section the manner of call hold and conduct meeting under sub section of se in relation to wind up and dissolution of limited liability partnership under section the manner and condition for filing document electronic ally under sub section of section the manner for strike off the name of limited liability partnership from the register under section the form and manner of statement,25
249,249,SECTIONS,contain particular and amount of fee payable under subparagraph a of para graph of the second the form and manner of par ticul ar about conversion under the proviso to para graph of the second the form and manner of the statement and the amount of fee payable under sub paragraph a of paragraph of the third the form and manner of particular t conversion under the proviso to paragraph of the third the form and manner of the statement and amount of fee payable under,25
250,250,SECTIONS,sub paragraph a of paragraph of the fourth schedule the form and manner of particular about conversion under the proviso to paragraph of the fourth every rule make under this act by the central government shall be laid a soon a may be after it is make before each house of parliament while it be in session for a total period of thirty day which may be comprise in one session or in two or more successive session and if before the expiry of the session immediately follow the session or the successive,25
251,251,SECTIONS,session aforesaid both ho us agree in making any modification in the rule or both house agree that the rule should not be make the rule shall thereafter have effect only in such modify form or be of no effect a the case may be so however that any such modification or annulment shall be without prejudice to the validity of anything previously done under that rule,25
252,252,SECTIONS,power to remove if any difficulty ar is es in give effect to the provision of this act the central government may by order publish in the official gazette make such provision snot inconsistent with the provision of this act a may appear to it to be necessary for remove the difficulty provided that no such order shall be make under this section after the expiry of a period of o the commencement of this every order make under this section shall be laid a soon a may be after it be make before each house of parliament,27
253,253,SECTIONS,transitional provision until the tribunal and the appellate tribunal be con st it ut under the pro vis ion of the company act of the provision of this act shall have effect subject to the modification namely a for the word tribunal occur in clause b of sub section of section clause a of subsection of section and section the word company law board have be for the word tribunal occur in section and in section to the word high court,27
254,254,SECTIONS,have be for the word appellate tribunal occur in sub section of section the word hi have be first schedule see section regard matter relate to mutual right and duty of partner and limited liability partnership and i t partner applicable in the absence of any agreement on such matter,27
255,255,SECTIONS,the mutual right and duty of the partner and the mutual right and duty of the limited liability partnership and it partner shall be determine subject to the term of any l imi ted liability partnership agreement or in the absence of any such agreement on any matter by t he provision in this schedule,28
256,256,SECTIONS,all the partner of a limited liability partnership be entitle to share equally in the capital profit sand loss of the limited liability partnership,28
257,257,SECTIONS,the limited liability partnership shall indemnify each partner in respect of payment make and personal incur by him a in the ordinary and proper conduct of the business of the li mi ted liability partner hip orb in or about anything necessarily do for the preservation of the business or property of the limited liability partnership,28
258,258,SECTIONS,every partner shall indemnify the limited liability partnership for any loss cause to it by his fraud in the t of the business of the limited liability partnership,28
259,259,SECTIONS,every partner may take part in the management of the limited liability partnership,28
260,260,SECTIONS,no partner shall be entitle to remuneration for act in the business or management of the limited liability partnership,28
261,261,SECTIONS,no person may be introduce a a partner without the con sen t of all the exist partner,28
262,262,SECTIONS,any matter or issue relate to the limited liability partnership shall be decide by a by a majority in number of the partner and for this purpose each partner shall have one vote however no change may be make in the nature of business of the limited liability partnership without the consent of all the partner,28
263,263,SECTIONS,every limited liability partnership shall ensure tha t decision take by it be record in the minute swith in thirty day of take such decision and be kept and maintain at the register office of the limited liability partnership,28
264,264,SECTIONS,each partner shall render true account and full information of a thing affect the limited liability partnership to any part ne r or his legal representative,28
265,265,SECTIONS,if a partner without the consent of the limited liability partnership carry on any business of the same nature a and compete with the limited li a b partnership he must account for and pay over to the limited liability partnership all profit s make by him in that business,28
266,266,SECTIONS,every partner shall account to the limited liability partnership for any benefit derive by him without the consent of th e limited liability partnership from any transaction concern the limited liability partnership or from any use by him of the property name or any business connection of the limited liability partnership,28
267,267,SECTIONS,no majority of the partner can expel any p unless a power to do so have be by express agreement between the partner,28
268,268,SECTIONS,all dispute between the partner arise out of the limited liability partnership agreement which cannot be resolve in term of such agreement shall be refer red for arbitration a per the provision of th ear bit ra ti on and conciliation act of second schedule see section from firm into limited liability partnership,28
269,269,SECTIONS,interpretation in this schedule unless t he context otherwise require a firm mean a firm a define in section of the in dian partnership act of b convert in relation to a firm convert into a limited liability partnership mean a transfer of the property asset interest right privilege liability obligation and the undertaking of the firm to the limited liability partnership in accordance with this schedule,29
270,270,SECTIONS,conversion from firm into limited liability partnership a firm may convert into a limited liability partnership by comply with the requirement a to the set out in this upon such conversion the partner of the firm shall be bound by the provision of this let hat be applicable to them,29
271,271,SECTIONS,eligibility for conversion a firm may apply to convert into a limited liability partnership inaccordance with this schedule if and only if the partner of the limited liability partnership into which the firm be to be convert comprise all the partner of the firm and no one el e,29
272,272,SECTIONS,statement to be file a firm may apply to convert into a limited liability partner sh by filing with the registrar a a statement by all of it partner in such form and manner and accompany by such fee a the central government may prescribe contain the follow particular namely i the name and registration number if applicable of the firm the date on which the firm be register under the in dian partnership act or under an y other law if applicable incorporation document and statement refer to in section,29
273,273,SECTIONS,registration of conversion on receive the document refer to in paragraph the registrar shall subject to the provision of this act register the document and issue a of registration in such form a the registrar may determine state that the limited liability partnership be on and from the date specify in the certificate register under this act provided that the limited liability partnership shall with in fifteen day of the date of registration inform the concerned registrar of firm with which it be,29
274,274,SECTIONS,register under the provision of the in dian partnership act of about the conversion and of the particular of the limited liability partnership in such form and manner a the central government may prescribe,29
275,275,SECTIONS,may refuse to register nothing in this schedule shall be construe a to require the registrar to register any limited liability partnership if he be not satisfied with the particular or other information furnish under the provision of this act provided that an appeal may be make before the tribunal in case of refusal of registration by the registrar may in any particular case require the d refer to in paragraph to in such manner a he of registration,29
276,276,SECTIONS,on and from the date of registration specify in the certificate at ion issue under paragraph a there shall be a limited li a b partnership by the name specify in the certificate of registration register under this all tangible movable and immovable property a well a intangible property in the firm all asset interest right privilege s obligation relate to the firm and the whole undertaking of the firm shall be transfer to and shall vest in the limited liability,29
277,277,SECTIONS,partnership without her assurance act or deed the firm shall be deem to be dissolve and if ear lier register under the in dian partnership act of remove from the record maintain under that act,29
278,278,SECTIONS,re gist ra ti on in relation to property if any property to which sub paragraph b of paragraph be register with any a u th the limited liability partnership shall a soon a practicable after the date of registration take all necessary step a require by the relevant authority to notify the authority of the conversion and of the particular of the limited liability partnership in such medium and form a the authority may specify,30
279,279,SECTIONS,pending proceeding all proceeding by or against the firm which be pending in any court or tribunal or before any authority on the date of registration may be continued complete and enforce by or against the limited liability of convict io n ruling order or judgment any conviction ruling order or judgment of any court tribunal or other authority in of or against the firm may be enforce by or against the limited liability partnership,30
280,280,SECTIONS,exist agreement every agreement to which the firm be a party immediately before the date of registration whether or not of such nature that the right and liability thereunder could be assigned shall have effect a from that date a if a the limited liability partnership be a party to such an instead of the firm for any reference to the firm there be substitute in respect of anything to be do on or after the date of reg is tra ti on a reference to the limited liability partnership,30
281,281,SECTIONS,exist contract all deed contract scheme bond agreement and arrangement subsist immediately before the date of registration relate to the firm or to which the firm be a party shall continue in force on and after that date a if they relate to the limited liability partnership and shall be enforceable by or against the limited liability partnership a if the limited liability partnership be nam therein or be a par thereto instead of the firm,30
282,282,SECTIONS,continuance of employment every contract of employment to which paragraph or paragraph a p plies shall continue to be in force on or after the date of registration a if the limited liability partnership be the employer thereunder instead of the firm,30
283,283,SECTIONS,exist ointment authority or power every appointment of the firm in any role or capacity which be in force immediately before the date of registration shall take effect and operate from that date a if the limited partnership be any a ut ho or power on the firm which be in force immediately before the date of registration shall take effect and operate from that date a if it be on the limited liability partnership,30
284,284,SECTIONS,cation of paragraph to the provision of paragraph to both inclusive shall apply to any approval permit or issue to the firm under any other act which be in force immediately before the date of registration of the limited liability partnership subject to the sion of such other act under which such approval per or have be issue,30
285,285,SECTIONS,partner liable for liability and n of firm before conversion notwithstanding anything in paragraph to both inclusive every partner of a firm that have convert into a limited liability partnership shall continue to be personally liable jointly and severally with the limited liability partnership for and obligation of the firm which be incur prior to the conversion or which arose from any contract en te re d into prior to the if any such partner discharge any liability or,30
286,286,SECTIONS,obligation refer to in sub paragraph he shall be entitle subject to any agreement with the limited liability partnership to the c to be by the limited liability partnership in respect of such l or,30
287,287,SECTIONS,notice of conversion in correspondence the limited liability partnership shall ensure that for a period of twelve month commence n later than fourteen day after the date of registration every official correspondence of the limited liability p bear the follow in ga a statement that it be a from the date of registration convert from a firm into a limited liability partnership the name and registration number if applicable of the firm from which it be any limited liability partnership,31
288,288,SECTIONS,which the provision of sub paragraph shall be punishable with fine which shall n be less than ten thousand rupee but which may extend to one and with a far fine which shall not be less than fifty rupee but which may extend to five hundred rupee for every day after the first day after which the default third schedule see section from private company into limited liability in this schedule unless t he context otherwise require a company,31
289,289,SECTIONS,mean a private company a define in clause of sub section of section the company act of b convert in relation to a private company convert into a limited liability a transfer of the property asset interest right privilege liability obligation and the undertaking of the private company to the limited liability partnership in accordance with this schedule,31
290,290,SECTIONS,eligibility for conversion of private company into l imi ted liability partnership a company may convert into a limited liability part by comply with the requirement a to the conversion set out in this a company may apply to convert into a limited liability partnership in accordance with this schedule if and only if a there be no security interest in it asset subsist or in force at the time of application the partner of the limited liability partnership to which it convert comprise all,32
291,291,SECTIONS,the share hold ers of the company and no one upon such conversion the company it shareholder the limited liability partnership into which the company have convert and the partner of that limited liability partnership shall be bound by of this schedule that be applicable to them,32
292,292,SECTIONS,statement to be file a company may apply to convert into a limited liability partnership by filing with the registrar a a statement by all it shareholder in such form and manner to be accompany by such fee as the central government may prescribe contain the follow particular namely i the name and st ration number of the the date on which the company be incorporate incorporation document and statement refer to in section,32
293,293,SECTIONS,registration of conversion on receive the document refer to in par a graph the registrar shall subject to the provision of this act and the rule make thereunder register the document and certificate of registration in such form a the registrar may determine state that the limited liability partnership be on and from the date specify in the certificate register under this act provided that the limited liability partnership shall within fifteen day of the date of registration inform the concerned registrar of,32
294,294,SECTIONS,company with which it be register under the provision of act of about the conversion and of the particular of the limited liability partnership in such form and manner a the central government may prescribe,32
295,295,SECTIONS,may refuse to register nothing in this schedule shall be construe a to require the registrar to register any limited liability partnership if he be not satisfied with the particular or other information furnish under the provision of this act provided that an appeal may be make b the tribunal in case of refusal of registration by the registrar may in any particular case require the document refer to in paragraph to in such manner a he,32
296,296,SECTIONS,effect of registration on and f the date of registration specify in the certificate of re gist ration issue under paragraph a there shall be a limited liability partnership by the name specify in the certificate of registration register under this all tangible able or immovable and intangible property in the company all right privilege liability obligation relate to the company and the whole of the undertaking of the company shall be transfer to and shall vest in the li mi,33
297,297,SECTIONS,ted liability partnership without far assurance act or deed the company shall be deem to be dissolve and remove from the record of the registrar of company,33
298,298,SECTIONS,re gist ra ti on in relation to property if any property to which clause b of paragraph a p plies is register with any authority the limited liability partnership shall a soon a practicable after the date of registration take all necessary step a require by the relevant authority to notify the authority of on and of the particular of the limited liability partnership in such form and manner a the authority may determine,33
299,299,SECTIONS,pending proceeding all proceeding by or against the company which be pending before any court tribunal or other authority on the date of registration may be continued complete and enforced by or against the limited liability partnership,33
300,300,SECTIONS,continuance of convict ion ruling order or judgment any conviction ruling order or judgment of any court tribunal or other authority in f avo ur of or against the company may be enforced by or against the limited liability agreement every agreement to which the company be a party immediately before the date of registration ether or not of such nature that the right and liability thereunder could be assigned shall have effect a from that date a the limited liability partnership be a party to,33
301,301,SECTIONS,such an agreement instead of the company for any reference to the company there be sub st it ut in respect of anything to be do on or after the date of registration a reference to the limited liability partnership,33
302,302,SECTIONS,exist contract all deed contract scheme bond agreement and arrangement subsist immediately before the date of registration relate to the company or to which the company be a party shall continue in force on and after that date a if they relate to the limited liability partnership and shall be enforceable by or against the limited liability partnership as if the limited liability partnership be name therein or be a party thereto instead of the company,33
303,303,SECTIONS,continuance of employment every contract of employment to which paragraph or paragraph a p plies shall continue in on or after the date of registration a if the limited liability partnership be the employer thereunder instead of the company,33
304,304,SECTIONS,exist ointment authority or power every appointment of the company in any role or capacity which be in force immediately before the date of registration shall take effect and operate from that date a if the limited liability partnership be any authority or power on the company which be in force immediately before the date of st ration shall take effect and operate from that date a if it be on the limited liability partnership,33
305,305,SECTIONS,cation of paragraph to the provision of paragraph to both inclusive shall apply to any approval permit or issue to the company under any other act which be in force immediately before the date of registration of the limited liability partnership subject to the provision of such other act under which such approval permit or have be,33
306,306,SECTIONS,notice of conversion in correspondence the limited liability partnership shall ensure that for a period of twelve month commence not later than fourteen day after the date of registration every official correspondence of the limited liability partner sh bear the follow namely a a statement that it be a from the date of registration convert from a company into a limited liability partnership the name and registration number of the company from which it be any limited liability partnership,34
307,307,SECTIONS,which the provision of sub paragraph shall be punishable with fine which shall not be less than ten thousand rupee but which may extend to one and with a far fine which shall not be less than fifty rupee but which may extend to five hundred rupee for every day after the first day after which the default fourth schedule see section from unlisted public company into limited liability partnership,34
308,308,SECTIONS,interpret at ion in this schedule unless t he context otherwise require a company me an an unlisted public convert in relation to a company convert into a limited liability partnership mean a transfer of the property asset interest right privilege liability obligation and the undertaking of the company to the limited liability partnership in accordance with the provision of this list company mean a list company a define in the security hange board disclosure,35
309,309,SECTIONS,and investor protection guideline issue by the security and exchange board of under section of the security and exchange board of act d unlisted public company mean a which be not a list company,35
310,310,SECTIONS,conversion of company into a l imi ted liability partnership a company may convert into a limited liability partnership by comply with the requirement a to the set out in upon such conversion the company it shareholder the limited liability partnership into which the company have convert and the partner of that limited liability partnership shall be bound by of this that be applicable to them,35
311,311,SECTIONS,eligibility for conversion a company may apply to convert into a limited liability partnership in accordance with the provision of this schedule if and only if a there be no security interest in it asset subsist or in force at the time of application the partner of the limited liability partnership to which it convert comprise all the share hold ers of the company and no one else,35
312,312,SECTIONS,statement to be file a company may apply to convert into a limited liability partner sh by filing with the registrar a a statement by all it shareholder in such form and manner to be accompany by such fee a the central government may prescribe contain the follow particular namely i the name and st ration number of the the date on which the company be incorporate incorporation document and state refer to in section,35
