,Unnamed: 0,Title,Paragraph Text,Page No
0,0,SECTIONS,short title extent and commencement,1
1,1,SECTIONS,de fi ni ti ons chapter of limited liability partnership,1
2,2,SECTIONS,limit liability partnership to be body corporate,1
3,3,SECTIONS,non applicability of the in dian partnership act,1
4,4,SECTIONS,partner,1
5,5,SECTIONS,minimum number of partner,1
6,6,SECTIONS,designate partner,1
7,7,SECTIONS,liability of designate partner,1
8,8,SECTIONS,change in designate partner,1
9,9,SECTIONS,punishment for contravention of section and of limited liability partnership and matter incidental thereto,1
10,10,SECTIONS,incorporation document,1
11,11,SECTIONS,incorporation by registration,1
12,12,SECTIONS,register office of limited liability partnership and change therein,1
13,13,SECTIONS,effect of reg is tra ti on,1
14,14,SECTIONS,name,1
15,15,SECTIONS,reservation of name,1
16,16,SECTIONS,change of name of limited liability partnership,1
17,17,SECTIONS,application for direction to change name in certain circumstance,1
18,18,SECTIONS,change of register name,1
19,19,SECTIONS,penalty for improper use of word limited liability partnership or,1
20,20,SECTIONS,publication of name and limited and their relation,1
21,21,SECTIONS,eligibility to be partner,2
22,22,SECTIONS,relationship of partner,2
23,23,SECTIONS,cessation of partnership interest,2
24,24,SECTIONS,registration of change in vex tent and limitation of liability of limited liability partnership and partner,2
25,25,SECTIONS,partner a agent,2
26,26,SECTIONS,extent of liability of limited liability partnership,2
27,27,SECTIONS,extent of liability of partner,2
28,28,SECTIONS,hold out,2
29,29,SECTIONS,unlimited liability in case of fraud,2
30,30,SECTIONS,whistle blowing chapter,2
31,31,SECTIONS,form of contribution,2
32,32,SECTIONS,obligation to contribute chapter disclosure,2
33,33,SECTIONS,maintenance of book of account other record and audit,2
34,34,SECTIONS,annual return,2
35,35,SECTIONS,inspection of document kept by registrar,2
36,36,SECTIONS,penalty for false statement,2
37,37,SECTIONS,power of registrar to obtain information,2
38,38,SECTIONS,compound of of fence,2
39,39,SECTIONS,destruction of old record,2
40,40,SECTIONS,enforcement of duty to make return and transfer of partnership right,2
41,41,SECTIONS,partner transferable,2
42,42,SECTIONS,investigation of the affair of limited liability partnership,3
43,43,SECTIONS,application by partner for investigation,3
44,44,SECTIONS,firm body corporate or association not to be appoint a inspector,3
45,45,SECTIONS,power of inspector to carry out investigation into affair of related entity,3
46,46,SECTIONS,production of document and evidence,3
47,47,SECTIONS,seizure of document by inspector,3
48,48,SECTIONS,inspector report,3
49,49,SECTIONS,prosecution,3
50,50,SECTIONS,application for wind up of limited liability partnership,3
51,51,SECTIONS,proceeding for recovery of damage or property,3
52,52,SECTIONS,expense of investigation,3
53,53,SECTIONS,inspect or report to be evidence chapter into limited liability partnership,3
54,54,SECTIONS,conversion from firm into limited liability partnership,3
55,55,SECTIONS,conversion from private company into limited liability partnership,3
56,56,SECTIONS,conversion from unlisted public company into l imi ted liability partnership,3
57,57,SECTIONS,registration and effect of conversion chapter xi foreign limited liability partnership,3
58,58,SECTIONS,foreign limited liability arrangement or of limited liability partnership,3
59,59,SECTIONS,compromise or arrangement of limited liability partnership,3
60,60,SECTIONS,power of tribunal to enforce compromise or arrangement,3
61,61,SECTIONS,provision for facilitate reconstruction or amalgamation of limited liability up and dissolution,3
62,62,SECTIONS,wind up and dissolution,3
63,63,SECTIONS,circumstance in which limited liability partnership may be wound up by tribunal,3
64,64,SECTIONS,rule for wind up and,3
65,65,SECTIONS,business transaction of partner with limited liability partnership,4
66,66,SECTIONS,application of the provision of the company act,4
67,67,SECTIONS,electronic filing of document,4
68,68,SECTIONS,payment of additional fee,4
69,69,SECTIONS,enhance punishment,4
70,70,SECTIONS,application of other law not bar,4
71,71,SECTIONS,jurisdiction of tri bu and appellate tribunal,4
72,72,SECTIONS,penalty on non compliance of any or de r pass by tribunal,4
73,73,SECTIONS,general penalty,4
74,74,SECTIONS,power of registrar to strike defunct limited liability partnership off register,4
75,75,SECTIONS,of fence to limited liability partnership,4
76,76,SECTIONS,jurisdiction or court,4
77,77,SECTIONS,power to alter schedule,4
78,78,SECTIONS,power to make rule,4
79,79,SECTIONS,power to remove,4
80,80,SECTIONS,transitional provision st he first schedule the second schedule the third schedule the fourth limited liability partnership act of act to make provision for the formation and regulation of limited liability partnership and for matter connect therewith or incidental there tobe it enact by parliament in the fifty ninth year of the republic of in di a a follow chapter i,4
81,81,SECTIONS,short ti extent and commencement this act may be call the limited liability partnership act it to the whole of it shall come into force on such a the central government may by notification in the official gazette appoint provided that different date may be appoint for different provision of this act and any reference in any such provision to the commencement of this act shall be construe a a reference to the coming into force of that provision,5
82,82,SECTIONS,definition in this act es the context otherwise require a address in relation to a partner of a limit liability partnership mean i if an individual his usual residential address if a body corporate the address of it re gist ere d advocate mean an advocate a define in clause a of sub section of section of t act of c appellate tribunal mean the national company law appellate tribunal constitute under subsection of section of t he,5
83,83,SECTIONS,company act of d body corporate mean a company a define in section of the company act and include i a limited liability partnership register under this a limited liability partnership incorporate outside a company incorporate outside in di abut do not include i a corporation a operative society register under any law for the time be in force any other body corporate not be a company a define in section of the,5
84,84,SECTIONS,of or a limited liability partnership a define in this act which the central government may by notification in the official gazette specify in this business include trade profession service and charter accountant mean a charter accountant a define in clause b of sub section section of the charter accountant act of and who have obtain a certificate of ce under sub section of se of that act,5
85,85,SECTIONS,march notification no so e date march see gazette of extraordinary part company secretary mean a company secretary a define in clause c of sub section of section of the company secretary act of and who have obtain a certificate of practice under sub section of section of that a c th cost accountant mean a cost accountant a define in clause b of sub section of section of the cost and work accountant act,5
86,86,SECTIONS,of and who have obtain a certificate of practice under sub section of section of that a c ti court with respect to any of fence under this act mean the court have jurisdiction a per the provision of section designate partner mean any partner designate a such pursuant to section entity mean any body corporate and include for the purpose of section and a firm setup under the in dian partnership act of l financial year in relation to a limited,5
87,87,SECTIONS,liability partnership mean the period from the day of of a year to the day of march of the follow year provided that in the case of a limited liability partnership incorporate aft er the day of sept ember of a year the financial year may end on the day of march of the year next following that ye arm foreign limited liability partnership mean a limited liability partnership formed incorporated or register outside which establish es a place of business within in dian limited liability partnership,5
88,88,SECTIONS,mean a partnership form and register under this a c to limited liability partnership agreement mean any write agreement between the partner of the li mi ted liability partnership or between the limited liability partnership and it partner which deter mines the mutual right and duty of the partner and their right and duty in relation to that limited liability name in relation t o a partner of a limit liability partnership mean i if an individual his forename middle name and surname if a,5
89,89,SECTIONS,body corporate it register partner in relation to a limited liability partnership mean any person who e a partner in the limited liability partnership in accordance with the limited liability mean by rule make under this act registrar mean a registrar or an additional a joint a deputy or an a the duty of register company under the company act of t schedule mean a schedule to this actu tribunal mean,5
90,90,SECTIONS,the national company law tribunal constitute under sub section of section of the company act of word and expression use and not define in this act but define in the company act shall have the meaning respectively assign to them in that act chapter of limited liability partnership,5
91,91,SECTIONS,limited liability par to be body corporate a limited liability partnership be a body corporate form and incorporate under this act and be a legal entity separate from that of it a limited liability partnership shall have perpetual any change in the partner of a limited liability partnership shall not affect the existence right of the limited liability,6
92,92,SECTIONS,non of th e in dian partnership act save a otherwise provide of the in dian partnership act of shall not apply to a limited liability partnership,7
93,93,SECTIONS,partner any individual or body corporate may be a partner in a limited liability partnership provided that an i shall not be capable of become a partner of a li mi ted liability partnership if a he have be found to be of unsound mind by a court of competent jurisdiction and the finding is in he be an undischarged insolvent orc he have apply to be adjudicate a an insolvent and his application be pending,7
94,94,SECTIONS,minimum number of partner every limited liability partnership shall have at least if at any time the number of partner of a limited liability partnership be reduce below two and the limited liability partnership carry on business for more than six month while the number be so reduced the person who be the only partner of the limited liability partnership during the time that it on business after those six month and have the knowledge of the fact that it be carry on business with him alone shall be liable personally for the obligation of the limited liability partnership incur red during that period,7
95,95,SECTIONS,designate partner every li mi ted liability partnership shall have at least two who be individual and at least one of them shall be a resident in in di a provided that in case of a limited liability partnership in which all the partner be body corporate or in w one or more partner be individual and body corporate at least two individual who of such limited liability partnership or nominee of such body corporate shall act a design a ted partner sex planation for the purpose of this,7
96,96,SECTIONS,section the term resident in mean a person who in for a period of not less than one hundred and eighty two day during the immediately preceding one subject to the provision of sub section the incorporation document a who be to be designate partner such person shall be designate partner on incorporation orb state that each of the partner from time to time of limited liability partnership be to be design a ted partner every such er shall be a designate,7
97,97,SECTIONS,any partner may become a designate partner by and in accordance with the limited liability partnership agreement and a partner may cease to be a designate partner in accordance with limited liability partnership an individual shall not become a designate partner in any limited liability partnership unless give his prior consent to act a such to the limited liability partnership in such form and manner as may be every limited liability partnership shall file with the registrar the particular of every,7
98,98,SECTIONS,individual who have give his consent to act a designate partner in such form and manner a may be thirty day of his an in div eligible to be a designate partner shall satisfy such condition and requirement as may be every designate partner of a limited liability partnership shall obtain a designate partner identification number from the central g and the provision of section to inclusive of the company act of shall apply mu tat is mu tan dis for the said purpose,7
99,99,SECTIONS,of designate partner unless expressly provide otherwise in this act ade sig na ted partner shall be a responsible for the do of all act matter and thing a be require to be do by the limited liability partnership in respect of compliance of the provision of this act include filing of any document return statement and the like report pursuant to the provision of this act and a maybe specify in the limited liability partnership agreement liable to all penalty impose on the limited liability partnership for any contravention of those provision,8
100,100,SECTIONS,change in designate partner a limited liability partnership may appoint a design a ted partner within thirty day of a vacancy arise for any reason and provision of sub section and subsection of section shall apply in respect of such new designate partner provided that if no designate partner be appoint or if at any time there be only one design a ted partner each partner shall be deem to be a designate partner,8
101,101,SECTIONS,punishment for con trave of section and if the li mi ted liability the provision of sub section of section the limited liability partnership and it every partner shall be punishable with fine which shall not be less than ten thousand rupee but which may extend to five if the limited liability partnership the provision of sub section and sub section section section or section the limited liability partnership and it every partner shall,8
102,102,SECTIONS,be punishable with fine which shall not be less than ten thousand rupee but which may extend to one of limited liability partnership and matter incidental thereto,8
103,103,SECTIONS,incorporation document for a limited liability partnership to be incorporate a two or more person associate for carry on a lawful business with a view to profit shall subscribe their name to an incorporation the incorporation document shall be file in such manner and with such fee a may with the registrar of the state in which the register office of the limited liability partnership be to be situate there shall be file along with the incorporation document a statement in the,8
104,104,SECTIONS,form made by either an advocate or a company secretary or a charter accountant or a cost accountant who be engage in the formation of the limited liability partnership and by any one his name to the incorporation document that all the requirement of this act and the rule sma de th ere under have be comply with in respect of incorporation and matter precedent and incidental the incorporation document sha be in a form a may be state the name of the limited liability,8
105,105,SECTIONS,state the propose business of the limited liability state the address of the register office of the limited liability state the name and address of each of the person who be to be partner of the limited liability partnership o n state the name and address of the person who be to be designate partner of the limited liability partnership on contain such other information concern the propose limited liability partnership a may if a,8
106,106,SECTIONS,person make a statement under clause c of sub section which he a know to be false orb do not believe to be true shall be punishable with imprisonment for a term which may extend to two year and with fine which shall not b e less than ten thousand rupee but which may extend to five rupee,8
107,107,SECTIONS,incorporation by registration when the requirement impose by clause b and c of subsection of section have be comply with the registrar shall retain the incorporation document and unless the requirement impose by clause a of that sub section have not be he shall within a period of f our teen day a register the incorporation document give a certificate that the limited liability partnership be incorporate by the name the registrar may accept the statement,9
108,108,SECTIONS,deliver under clause c of sub section of section sufficient evidence that the requirement impose by clause a of that sub sect io n have be the certificate issue under clause b of sub section shall be sign by the registrar and authentic a ted by his official the certificate shall be conclusive evidence that the limited liability partnership be incorporate by the name specify therein,9
109,109,SECTIONS,register office of limited liability p and change therein every limited liability partnership shall have a register office to which all communication and notice may bead dressed and where they shall be a document may be serve on a limited liability partnership or a partner or designate partner thereof by send it by post under a certificate of post or by register post or by any other manner as may be at the register office and any other address specifically declare by the,9
110,110,SECTIONS,limited liability partnership for the purpose in such form and manner a may be a limited liability partnership may change the place of it register office and file the notice of such change with the registrar in such form and manner and subject to such condition a may and any such change shall take effect only upon such if the limited liability partnership any provision of th be section the limited liability partnership and it every partner shall be punishable with fine which shall not be less than two thou san drupe es but which may extend to twenty five thousand rupee,9
111,111,SECTIONS,effect of registration on registration a limited liability partnership shall by it name be capable of a sue and be acquire own hold and develop or dispose of property whether movable or immovable tangible or have a common seal if it to have one do and suffer such other act and thing a body corporate may lawfully do and suffer,9
112,112,SECTIONS,name every limited liability partnership shall have either the word limited liability partnership or the acronym a the last word of it no limited liability partnership shall be register by a name which in the opinion of the central government be a undesirable orb identical or too nearly to that of any other partnership firm or limited liability partnership or body corporate or a register trade mark or a trade mark which be the subject matter of an application for registration of any other person under the trade mark act of,9
113,113,SECTIONS,reservation of name a person may apply in such form and manner and accompany by such fee a may be to the registrar for the reservation of a nam e set out i n the application a a the name of a propose limited liability partnership orb the name to which a limited liability partnership prop os es to change it upon receipt of an application under sub section and on payment of the fee the registrar may if he be satisfied subject to the rule by the central government in the,10
114,114,SECTIONS,matter that the name to be reserve be not one which may be reject on any ground refer to in sub section section reserve the na me for a period of three month from the date of intimation by the registrar,10
115,115,SECTIONS,change of name of l imi ted liability partnership notwithstanding anything contain in sec ti ons and where the central government be satisfied that a limited liability partnership have been registered whether through inadvertence or otherwise and whether originally or by a change of name under a name which a be a name refer to in sub section of section orb be identical with or too nearly the name of any other limited liability partnership or body corporate or other name a to be likely to be mistaken,10
116,116,SECTIONS,for it the central government may direct such limited liability partnership to change it name and the limited liability partner hip shall comply with the say direction within three month after the date of the direction or such longer period a the central government may any limited liability partnership which to comply with a direction give under subsection shall be punishable with fine which shall not be less than ten thousand rupee but which may extend to five rupee and the designate partner of such limited liability partnership shall be punishable with fine which shall not be less than ten tho us and rupee but which may extend to one,10
117,117,SECTIONS,application for direction to change n ame in certain circumstance any entity which already have a name similar to the name of a limited liability partnership which have be incorporated subsequently may apply in such manner a may be to the registrar to give a direction to any limited liability partnership on a ground refer to in section to change it the registrar shall not consider any application under to give a direction to a limited liability partnership on the ground refer to in,10
118,118,SECTIONS,clause b of sub section of section unless the registrar the application within twenty four month from the date of registration of the limit liability partnership under that name,10
119,119,SECTIONS,change of register name any limited liability partnership may change it name registered with the registrar by filing with him a notice of such change in such form and manner and on payment of such fee a m ay be,10
120,120,SECTIONS,penalty for improper use of word limited y partnership or if any person or person carry on business under any name or title of which the word limited liability partnership or or any contraction or imitation thereof be or be the last word or word that person or each of those person shall unless duly incorporate a limited liability partnership be punishable with fine which shall not be less than fifty thousand rupee but which may extend to five r,10
121,121,SECTIONS,publication o f name and limited liability every limited liability partnership shall ensure that it invoice official correspondence and public a ti ons bear the follow namely a the name address of it register office and at ion number of the limited liability partnership a statement that it be register with limited any limited liability partnership which the provision of sub section shall be punishable with fine which shall not be less than two thousand rupee but which may extend to twenty five thousand and their relation,11
122,122,SECTIONS,eligibility to be partner on the incorporation of a limited liability partnership the per sons who their name to the incorporation document shall be it partner and any other person may become a partner of the limited liability partnership by and in accordance with the limited liability partnership agreement,11
123,123,SECTIONS,relationship of partner save a otherwise provide by this act the mutual right of the partner of a limited liability partnership and the mutual right and duty of a limited liability partnership and it partner shall be govern by the limited liability partnership agreement between the partner or between the limited liability partnership and it the limited liability partnership agreement and any change if any make therein shall be fi led with the registrar in such form manner and accompany by,11
124,124,SECTIONS,such fee a may be an agreement in write make before the incorporation of a limited liability partnership between the person who subscribe their name to the incorporation document may impose ion on the limited liability partnership provide such agreement be ratify by all the partner after the incorporation of the limited liability in the absence of agreement a to any matter the mutual right and duty of the partner and the mutual right and duty of the limited liability partnership and the partner shall be determine by re la ting to that matter a be set out in the first schedule,11
125,125,SECTIONS,ce at ion of partnership interest a person may cease to be a partner of a limited liability partnership in accordance with an agreement with the other partner or in the absence of agreement with the other partner a to cessation of be a partner by give a notice in write of not less than thirty days to th e other partner of his intention to resign a a person shall cease to be a partner of a limited liability part ne on his death or dissolution of the limited liability partnership orb if he be,11
126,126,SECTIONS,declare to be of unsound mind by a competent court orc if he have apply to be adjudge a an insolvent or declare a an where a person have cease to be a partner of a limited liability partnership hereinafter refer to as former partner the former partner be to be regard in relation to any person deal with the limited liability partnership a still be a partner of the limited li ability partnership unless a the person have notice that the former partner have cease to be a partner of the limited,11
