,Unnamed: 0,Title,Paragraph Text,Page No
184,184,SECTIONS,dealt with or related to the report may if it think fit furnish a copy thereof on request and on payment of the fee to any person or entity related to or affected by the report,18
185,185,SECTIONS,prosecution if from the report under section it appear to the central government that any person in relation to the limited liability partnership or in relation to any other entity whose affair have been investigate have be guilty of any of fence for which he be liable the central government may prosecute such person for the of fence and it shall be the duty of all partner designate partner and other employee a agent of the limited liability partnership or other entity a the case may be to give the central government all assistance in connection with the prosecution which they be reasonably able to give,19
186,186,SECTIONS,application for wind up of l imi ted liability partnership if any such limited liability partnership be liable to be wound up under this act or any other law for the time be in force and to the central government from any such report under section that it be expedient to do so by reason of any such circumstance a be refer to in sub clause i or sub clause of clause c of subsection of section the central government may unless the limited liability partnership is already be wound up by the,19
187,187,SECTIONS,tribunal cause to be present to the tribunal by any person the central government in this behalf a petition for the wind up of the limited liability partnership on the ground that it be just and equitable that it should be wound up,19
188,188,SECTIONS,proceeding for recovery of damage or property if from any report under section to the central government that proceeding ought in the public interest to be brought by the limited liability partnership or any entity whose affair have be investigate da for the recovery of damage in respect of any fraud misfeasance or other misconduct in connection with the promotion or formation or the management of the affair of such limited liability partnership or such other entity orb for the recovery of any property of,19
189,189,SECTIONS,such limited liability partnership or such other entity which have be misapply or wrongfully central government may itself bring proceeding for that purpose,19
190,190,SECTIONS,expense of investigation the e of and incidental to an investigation by an inspector appoint by the central government under this act shall be de frayed in the first instance by the central government but the follow person shall to the extent mention below be liable to reimburse the central government in re of such expense namely a any person who be convict on a prosecution or who be order to pay damage or restore any property in proceeding brought by virtue of section may in the same,19
191,191,SECTIONS,proceed s be ordered to pay the say expense to such extent a may be specify by the court convict such person or order ing him to pay such damage or restore such property a the case may any entity in whose name proceeding be brought a afore sa id shall be liable to the extent of the amount or value of any sum or property recover by it a a result of the proceeding unless a a result of the investigation a prosecution be ted in pursuance of section i any entity a partner or designate partner,19
192,192,SECTIONS,or any other person dealt with by the report of the inspector shall be liable to reimburse the central government in respect of the whole of unless and except in so far a the central government otherwise direct s the applicant for the investigation where the inspector be appoint in pursuance of of clause a of sub section of section shall be liable to such extent if any as the central government may any amount for which a limited liability partnership or other entity be,19
193,193,SECTIONS,liable by virtue of clause sub section shall be a first charge on the sum or property mention in that the amount of expense in respect of which any limited liability pa other entity a partner or designate partner or any other person be liable under sub clause i of clause c of subsection to reimburse the central government shall be recoverable a of land for the purpose of this section any cost or expense incur by the central government or in connection with the proceeding brought by virtue of section shall be treat a expense of the investigation give rise to the proceeding,19
194,194,SECTIONS,report to be evidence a copy of any report of any inspector or inspector sap pointed under the provision of this act authenticate in such manner if any a may be be admissible in any legal proceed a evidence in relation to any matter contain in the report chapter into limited liability partnership,20
195,195,SECTIONS,conversion from firm into l imi ted liability partnership a firm may convert into a limited liability partnership in accordance with the provision of this chapter and the second schedule,20
196,196,SECTIONS,conversion from private company into lim liability partnership a private company may convert into a limited liability partnership in accordance with the provision of this chapter and the third schedule,20
197,197,SECTIONS,conversion from unlisted public company into l imi ted liability partnership an unlisted public company may convert into a limited liability partnership in accordance with the provision of this chapter and the fourth schedule,20
198,198,SECTIONS,re gist rat ion and effect of conversion the registrar on satisfy that a firm private company or an unlisted public company a the case may be have comply with the provision of the second schedule the third schedule or the fourth schedule a the case may be shall subject to of this act and the rule make thereunder register the document submit under such schedule and issue a certificate of registration in such form a the registrar may determine state that the limited liability partnership be on and from,20
199,199,SECTIONS,the d ate specify in the certificate register under this act provided that the limited liability partnership shall within fifteen day of the date of registration inform the concerned registrar of firm or registrar of company a the case may be wit h which it was registered under the provision of the in dian partnership act of or the company of a the case may be about the conversion and of the particular of the limited liability partnership in such form and er a may be upon,20
200,200,SECTIONS,such conversion the partner of the firm the shareholder of private company or unlisted public company a the case may be the limited liability partnership to which such firm or such convert and the par of the limited liability partnership shall be bound by the provision of the second schedule the third schedule or the fourth schedule a the c ase may be applicable to upon such conversion on and from the date of certificate of re gist ra ti on the effect of the conversion shall be such a specify in the,20
201,201,SECTIONS,second schedule the third schedule or the fourth schedule as the case may notwithstanding anything contain in any other law for the time be in force on and from the date of registration specify in the certificate of registration issue under the second schedule the third schedule or the fourth schedule a the case may be a there shall be a limited liability partnership by the name specify in the certificate of registration register under this all tangible movable or immovable and intangible property in,20
202,202,SECTIONS,the firm or the company a the case may be all asset interest right privilege liability obligation relate to the firm or the company a the case may be and the whole of the undertaking of the firm or a the case may be shall be transfer to and shall vest in the limited liability partnership without far assurance act or deed the firm or the company a the case may be shall be deem to be dissolve and removed from the record of the registrar of firm or registrar of company a the case may be chapt er xi foreign limited liability partnership,20
203,203,SECTIONS,foreign li mi ted liability partnership the central government may make rule in relation to establishment of place of business by foreign limited liability partnership and carry on their business therein by apply or incorporate with such modification as appear appropriate the provision of the company act of or such regulatory mechanism with such composition a may be arrangement or reconstruction of limited liability partnership,21
204,204,SECTIONS,compromise or arrangement of li mi ted liability partnership where a mise or arrangement be propose a between a limited liability partnership and it creditor orb between a limited liability partnership and it partner st he tribunal may on the application of the limited liability partnership or of any creditor or partner of the limited liability partnership or in the case of a limited liability be be wound up of the liquidator order a meeting of the creditor or of the partner a the case may,21
205,205,SECTIONS,be to be call and con ducted in such manner a may be or a the tribunal if a majority represent three fourth in value of the creditor or partner a the case may be at the meeting agree to any compromise or arrangement the compromise or arrangement shall by the tribunal by order be binding on all th e creditor or all the partner a the case may be and also on the limited liability partnership or in the case of a limited liability partnership which be being wound up on the liquidator,21
206,206,SECTIONS,and of the limited liability that no order sanction any compromise or arrangement shall be make by the tribunal unless the tribunal be satisfied that the limited liability partnership or any other person by whom an application have be make under sub section have disclose t o the tribunal by affidavit or otherwise all material fact relate to the limited liability partnership include the late financial position of the limited liability partnership and the pendency of any investigation,21
207,207,SECTIONS,proceeding in relation to the l imi ted liability an order make by the tribunal under sub section shall be file by the limited liability partnership with the registrar within thirty day after make such an order and shall have effect only after it be so if default be make in comply with sub section the limited liability partnership and every design a ted partner of the limited liability partnership shall be punishable with fine which may extend to one the tribunal may at any e after,21
208,208,SECTIONS,an application have be make to it under this section stay the commencement or continuation of any suit or proceed against the limited liability partnership on a the tribunal think fit until the application be finally dispose of,21
209,209,SECTIONS,power of tribunal to en for ce compromise or arrangement where the tribunal make an order under section sanction a compromise or an arrangement in respect of a li mi ted liability partnership it a shall have power to supervise the carry out of the compromise or an arrangement may at the time of make such order or at any time thereafter give such direction in regard to any matter or make such modification in the compromise or arrangement a it may consider necessary for the proper work of the compromise or,21
210,210,SECTIONS,if the tribunal aforesaid be satisfied that a compromise or an arrangement sanction under section cannot be work satisfactorily with or without modification it may either on it own motion or on the application of any person interested in the affair of the limited liability partnership make an order for wind up the limited liability partnership and such an order shall be deem to be an order made under section of this act,21
211,211,SECTIONS,pro vis io n for facilitate reconstruction or amalgamation of li mi ted where an application be make to the tribunal under section for sanction of a compromise or arrangement propose between a limited liability partnership and any such person a in that section and i t be show to the tribunal that a compromise or arrangement have be propose for the purpose of or in connection with a scheme for the reconstruction of any limited liability partnership or limited liability partnership,22
212,212,SECTIONS,or the amalgamation of any two or more li mi ted liability partnership under the scheme the whole or any part of the undertaking property or liability of any limited liability partnership concerned in the scheme in this section refer to a a transferor limited liability partnership be to be transfer to another limited liability partnership in this section refer to a the transferee limited liability partnership the tribunal may either by the order sanct ion ing the compromise or arrangement or by a subsequent order,22
213,213,SECTIONS,make provision for all or any of the follow matter namely i the transfer to the transferee limited liability partnership of the whole or any part of the undertaking property or li ti es of any transferor limited liability the continuation by or against the transferee limited liability partnership of any pending by or against any transferor limited liability the dissolution wit ho ut wind up of any transferor limited liability the provision to be make for,22
214,214,SECTIONS,any person who within such time and in such manner a the tribunal dissent from the compromise or arrangement such incidental consequential and supplemental matter a be necessary to secure that the reconstruction or amalgamation shall be fully and effectively carry out provided that no compromise or arrangement propose for the purpose of or in connection with a scheme f or the amalgamation of a limited liability partnership which be be wound upwith any other limited liability partnership or limited liability,22
215,215,SECTIONS,partnership shall be sanction by the tribunal unless the tribunal have receive a report from the re gist ra r that the affair of the limited liability partnership have not be conduct in a manner prejudicial to the interest of or to public interest provided far that no order for the dissolution of any transferor limited liability partner sh clause shall be make by the tribunal unless the official liquidator have on scrutiny of the book and paper of the limited liability partnership make a report to the,22
216,216,SECTIONS,tribunal that of the limited liability partnership have not b conduct in a manner prejudicial to of it partner or to public where an order under this section provide for the transfer of any property or liability then by virtue of the order that property shall be transfer t o and vest in and those liability shall be transferred to and become the liability of the transferee limited liability partnership and in the case of any property if the order so freed from any charge which,22
217,217,SECTIONS,be by virtue of the compromise or arrangement to cease to have within thirty day after the make of an order under this section every limited liability partnership in relation to which the order be make shall cause a certify copy thereof to be file with the registrar for if default be make in comply with the provision of sub section the limited liability partnership every designate partner of the limited liability partnership shall be punishable with fine which may extend to fifty thousand,22
218,218,SECTIONS,rupee sex planation in this section property include property right and power of every description and liability include duty of every description chapter up and dissolution,22
219,219,SECTIONS,wind up and dissolution the wind up of a limited liability partnership may be either voluntary or by the tribunal and limited liability partnership so wound up may be dissolve,23
220,220,SECTIONS,circumstance in which limited liability partnership may be wound up by tribunal a limited liability partnership may be wound up by the tribunal a if the limited liability partnership that limited liability partnership be wound up by the tribunal b if for a period of more than six month the number of partner of the limited liability partnership be reduce below if the limited liability partnership have act against the interest of the sovereignty and integrity of the security of the state or public,23
221,221,SECTIONS,or dere if the limited liability partnership have make a default in filing w the registrar the statement of account and solvency or annual return for any five consecutive financial year orf if the tribunal be of the opinion that it be just and equitable that the limited liability partnership be wound up,23
222,222,SECTIONS,rule for wind ing up and dissolution the central government may make rule for in relation to wind up and dissolution of limited liability,23
223,223,SECTIONS,business transaction of partner with limited liability partnership a partner may lend money to and transact other business with the limited liability partnership and have the same right an dob li ga ti ons with respect to the loan or other transaction a a person who be not a partner,23
224,224,SECTIONS,application of the provision of th e company act the central government may by notification in the official gazette direct that any of the provision of the company act specify in the notification a shall apply to any limited liability partnership orb shall apply to any limited liability partnership with such exception modification and adaptation a may be specify in the a copy of every notification propose to be issue under sub section shall be laid in draft before each ho,23
225,225,SECTIONS,use of parliament while it be in session for a total period of thirty day which may be comprised in one session or in two or more successive session and if before the expiry of the session immediately follow the session or the successive session aforesaid both house agree in di sap proving the issue of the notification or both house agree in make any modification in the notification the notification shall not be issue or a the case may be shall be issue only in form a may b e agree upon by both the house,23
226,226,SECTIONS,electronic filing of document any document require to be file record or registered under this act may be file record or register in such manner and subject to such condition a maybe,23
227,227,SECTIONS,clause c omit by act of s and the tenth schedule a copy of or an extract from any document electronic ally file with or submit to the registrar which be supply or issue by the registrar and certify through affix digital signature a per the information technology act of to be a true copy of or extract from such document shall in any proceeding be admissible in evidence a of equal validity with the original any information supply by the registrar,23
228,228,SECTIONS,that be certify by the registrar through affix ing digital si gnat ure to be a true extract from any document file with or submit to the registrar shall in any proceeding be admissible in evidence and be presume unless evidence to the contrary be be a true extract from such document,23
229,229,SECTIONS,payment o f additional fee any document or return require to be file or register under this act with the registrar if be not file or register in time provide therein may be file or registered after that time up to a period of three hundred day from the date within which it should have be file don payment of additional fee of one hundred rupee for every day of such delay in addition to any fee a sis payable for filing of such document or return provided that such document or return may without dice to any other action or liability under this act also be file after such period of three hundred day on payment of fee and additional in this section,24
230,230,SECTIONS,enhance punishment in case a limited liability partnership or any partner or d of such limited liability partnership any of fence the limited liability partnership or any partner or designate partner shall for the second or subsequent of fence be punishable with imprisonment a provide but in case of off for which fine be either along with or exclusive of imprisonment with fine which shall be twice the amount of fine for such of fence,24
231,231,SECTIONS,application of other law not bar the provision of this act shall be in addition to and not in derogation of the provision of any other law for the time be in force,24
232,232,SECTIONS,jurisdiction of tribunal and appellate tribunal the tribunal shall exercise such power sand perform such function a be or may be on it by or under this act or any other law for the time be in any person aggrieve by an order or decision of tribunal may prefer an appeal to the appellate tribunal and the provision of section and of the of shall be applicable in respect of such appeal,24
233,233,SECTIONS,penalty on non compliance of any order pass by tribunal whoever to comply with any order make by the tribunal under any provision of this act shall be punishable with imprisonment which may extend to six month and shall also be liable to a fine which shall not be less than fifty thousand rupee,24
234,234,SECTIONS,general penalty any person guilty of an of fence under this act for which no punishment is expressly provide shall be liable to a fine which may extend to five rupee but which shall not be less than five thousand rupee and with a far fine which may extend to fifty rupee for every day after the first day after which the default continue,24
235,235,SECTIONS,power of registrar to strike defunct lim liability partnership off register where the registrar have reasonable cause to believe that a limited liability partnership be not carry on business or its operation in accordance with the provision of this act the name of limited liability par maybe struck off the register of limited liability partnership in such manner a may be that the registrar shall before strike off the name of any limited liability partnership under this section give such limited partnership a reasonable opportunity of be,24
236,236,SECTIONS,of fence to li mi ted liability partnership where an of fence under this act commit by a limited liability partnership be prove a to have be commit with the consent or connivance of a partner or partner or design a ted partner or designate partner of the limited liability partnership to be attributable to any neglect on the part of the partner or partner or desi gnat partner or design a ted partner of that limited liability partnership the partner or partner or designate partner or designate partner of the limited,24
237,237,SECTIONS,liability partnership as the case may be a well a that limited liability partnership shall be guilty of the of fence and shall be liable to be proceed against and punish accordingly,24
238,238,SECTIONS,jurisdiction of court notwithstanding any provision to the contrary in any act for the time being in force the judicial magistrate of the first class or a t he case may be the metropolitan magistrate shall have jurisdiction to try any of fence under this act and shall have power to impose punishment in respect of say of fence,25
239,239,SECTIONS,power to alter schedule the central government may by notification in the official gazette alter any of the provision contain in any of the schedule to this any alteration notify under sub section shall have effect a if enact in the act and shall come into force on the date of the notification unless th e notification otherwise every alteration make by the central government under sub section shall be laid a soon as may be after it be make before each house of parliament while it be in,25
240,240,SECTIONS,session for a total period of thirty days which may be comprise in one session or in two or more successive session and if before the expiry of the session immediately follow the session or the successive session aforesaid both house sa gree in make any modification in the alteration or both house agree that the alteration should not be made the alteration shall thereafter have effect only in such modify form or be of no effect a the case may be so however that any such modification or annulment shall be without prejudice to the of anything previously do in pursuance of that alteration,25
241,241,SECTIONS,power to make rule the central government may by notification in the official gazette make rule for carry out the provision of this in particular and without to the generality of the forego power such rule may provide for all or any of the follow matter namely a form and manner of prior consent to be give by designate partner under sub section of section the form and manner of p of every individual agree to act a designate partner of limited liability partnership,25
242,242,SECTIONS,under sub section of section the condition and requirement relate to the eligibility of an individual to become a design a ted partner under subsection of section the manner of filing the incorporation document and payment of fee payable thereof under clause b of sub section of section the form of statement to be file under clause c of sub section of section f the form of incorporation document under clause a of sub section of section the information to be contain in,25
243,243,SECTIONS,the incorporation document concern the liability partnership under clause g of sub section of section the manner of serve the document on a limited liability partnership or a partner or a design a ted partner and the form and manner in which any other address may be declare by the limited liability partnership under sub section of sec ti on the form and manner of notice to the registrar and the condition in respect of change of registered office under sub section of section the form,25
