,Unnamed: 0,Title,Paragraph Text,Page No
0,0,SECTIONS,short title extent application and commencement,1
1,1,SECTIONS,de fi ni ti ons chapter for nuclear damage,1
2,2,SECTIONS,atomic energy regulatory board to notify nuclear incident,1
3,3,SECTIONS,liability of operator,1
4,4,SECTIONS,operator not liable in certain circumstance,1
5,5,SECTIONS,limit of liability,1
6,6,SECTIONS,liability of central government,1
7,7,SECTIONS,operator to maintain insurance or financial commissioner,1
8,8,SECTIONS,on for nuclear damage and it adjudication,1
9,9,SECTIONS,qualification for appointment a claim commissioner,1
10,10,SECTIONS,salary allowance and other term and condition of service of claim commissioner,1
11,11,SECTIONS,adjudication procedure and power of claim commissioner chapter and award,1
12,12,SECTIONS,invite application for claim by claim commissioner,1
13,13,SECTIONS,person entitle to make application for nuclear damage,1
14,14,SECTIONS,procedure for make application before claim commissioner,1
15,15,SECTIONS,award by claim commissioner,1
16,16,SECTIONS,operator right of recourse,1
17,17,SECTIONS,extinct ion of right to claim chapter damage claim commission,1
18,18,SECTIONS,establishment of nuclear damage claim commission,1
19,19,SECTIONS,composition of commission,1
20,20,SECTIONS,term of office,1
21,21,SECTIONS,salary allowance and other term and condition of service of chair person and member,1
22,22,SECTIONS,fill in g up of vacancy,1
23,23,SECTIONS,resignation and,1
24,24,SECTIONS,chair person or member deem to retire from service,2
25,25,SECTIONS,suspension of pension,2
26,26,SECTIONS,prohibition of act a arbitrator,2
27,27,SECTIONS,prohibition of practice,2
28,28,SECTIONS,power of chair person,2
29,29,SECTIONS,officer and other employee of commission,2
30,30,SECTIONS,application for compensation before commission,2
31,31,SECTIONS,adjudication procedure and power of commission,2
32,32,SECTIONS,transfer of pending case to commission,2
33,33,SECTIONS,proceeding before claim commissioner or commission to be judicial proceeding,2
34,34,SECTIONS,exclusion of jurisdiction of civil court,2
35,35,SECTIONS,enforcement of award,2
36,36,SECTIONS,annual report,2
37,37,SECTIONS,dissolution of commission in certain and penalty,2
38,38,SECTIONS,of fence and penalty,2
39,39,SECTIONS,of fence by company,2
40,40,SECTIONS,of fence by government department,2
41,41,SECTIONS,cognizance of,2
42,42,SECTIONS,power to give direction,2
43,43,SECTIONS,power to call for information,2
44,44,SECTIONS,exemption from application of this act,2
45,45,SECTIONS,act to be in addition to any other law,2
46,46,SECTIONS,protection of action take in good faith,2
47,47,SECTIONS,power to make rule,2
48,48,SECTIONS,power to remove civil for nuclear damage act no of sept ember act to provide for civil liability for nuclear damage and prompt compensation to the a nuclear incident through a no fault liability regime channel liability to the operator appointment of claim commissioner establishment of nuclear damage and for matter connect therewith or incidental there tobe it enact by parliament in the sixty first year of the republic of a follow chap te r i,2
49,49,SECTIONS,short title extent application and commencement this act may be call the civil liability for nuclear damage act it to the whole of it also lie to nuclear damage suffer a in or over the time area beyond the territorial water of in di a b in or over the exclusive economic zone of a refer to in section of the territorial wat ers continental shelf exclusive economic zone and other maritime zone act c on board or by a ship register in under section,3
50,50,SECTIONS,of the merchant shipping act of or under any other law for the time be in force on board or by an aircraft register in under clause d of sub section of section of the aircraft act of or under any other law for the time be in for cee on or by an artificial island installation or structure under the jurisdiction of it a p plies only to the nuclear installation own or control by the central government either by itself or through any authority or corporation,3
51,51,SECTIONS,establish by it or a government company explanation for the purpose of this sub section government company shall have the same meaning a assign to it in clause of sub section of section of the atomic energy act of it shall come into force on such date a the central government may by notification appoint and different date may be appoint for different provision of this act and any reference in any such provision to the commencement of this act shall be construe a a reference to the come into force of that provision,3
52,52,SECTIONS,definition in this act unless the context otherwise require a chair person mean the chair person o f the commission appoint under sub section of section claim commissioner mean the claim commissioner appoint under sub section of section commission mean the nuclear damage claim commission establish under section environment shall have the same meaning a assign to it in clause a of section of the environment protection act of member mean a member of,3
53,53,SECTIONS,the commission appoint under sub section of section no ti fi ca ti on mean a notification publish in the official gazette and the term notify shall be construe nuclear damage mean i loss of life or personal injury include immediate and long term health impact to a person loss of or damage to property ca used by or arise out of a nuclear incident and include each of the follow to the extent notified by the central any economic loss arise from the loss or damage,3
54,54,SECTIONS,refer to in i or not include in the claim make under those if incur by a person entitle to claim such loss or cost of measure of reinstatement of imp ai red environment cause by a nuclear incident unless such impairment be in sig nific an t if such measure be actually take or to be take and not included in the claim make under sub clause loss of income derive from an economic interest in any use or enjoyment of the environment incur a a result of a significant,3
55,55,SECTIONS,impair me of that environment cause by a nuclear incident and not include in the claim under sub clause the cost of preventive measure and far loss or damage cause by such any other economic loss other than the one cause b y impairment of the environment refer red to in sub clause and v in so far a it be permit by the general law on civil liability in force in and not under any such la win the case of sub clause i to v and above to the extent the loss or,3
56,56,SECTIONS,damage ar is es out of or ionize radiation emit by any source of radiation inside a nuclear installation or emit from nuclear fuel or radioactive product or waste in or of nuclear material come from origin a tin g in or sent to a nuclear installation whether so arise from the radioactive property of such matter or from a combination of radioactive property with toxic explosive or other hazardous property of such nuclear fuel mean any ma te rial which be capable of produce energy by a self,3
57,57,SECTIONS,sustain chain process of nuclear nuclear incident mean any occurrence or series of occurrence have the same origin which ca us es nuclear damage or but only with respect to measure creat es a grave and imminent threat of cause such nuclear installation mean a any nuclear reactor other than one with which a mean of transport be equip for use a a source of power whether for propulsion thereof or r any other any facility use nuclear fuel for the production of nuclear,3
58,58,SECTIONS,material or any facility for the process ing of nuclear material include re process ing of irradiate nuclear fuel any facility where nuclear material be st other than storage incidental to the carriage of such material explanation for the purpose of this clause several nuclear installation of one operator which are loca ted at the same site shall be consider a a single nuclear nuclear material mean and include i nuclear fuel other than natural uranium or deplete uranium capable of produce,3
59,59,SECTIONS,energy self sustain chain process of nuclear fission outside a nuclear reactor either by itself or in combination with so me other material radioactive product or wastel nuclear reactor mean any structure contain nuclear fuel in such an arrangement that a self sustain chain process of nuclear fission can occur therein without an additional source of ne operator in relation to a nuclear installation mean the central government or any authority or corporation establish by it or a government,3
60,60,SECTIONS,company who have be grant a pursuant to the atomic energy act of for th e operation of that mean by rule make under this a c to preventive measure mean any reasonable measure take by a person after a nuclear incide nth as occur to prevent or mi ni mise damage refer to in s i to v and of clause to the approval of the central radioactive product or waste mean any radioactive material produce in or any material,3
61,61,SECTIONS,made radioactive by exposure to the radiation incidental to t he production or of nuclear fuel but does not include radioisotope which have reach the final stage of fabrication so a to be usable for any scientific medical agricultural commercial or industrial special draw right mean special draw right a determine by the international monetary fund chapter for nuclear damage,3
62,62,SECTIONS,atomic energy regulatory board to notify nuclear incident the atomic energy regulatory board constitute under the atomic energy act of shall within a period of fifteen day from the date of occurrence of a nuclear incident notify such nuclear incident provided that where the atomic energy regulatory board be satisfied that the gravity of threat an drisk involve in a nuclear incident be insignificant it shall not be require to notify such nuclear the atomic energy regulatory board shall immediately,5
63,63,SECTIONS,after the notification under sub be issue cause wide publicity to be give to the of such nuclear incident in such manner as it may deem fit,5
64,64,SECTIONS,liability of operator the operator of the nuclear installation shall be liable for nuclear damage cause by a nuclear incident a in that nuclear installation orb involve nuclear material come from or originate in that nuclear installation and occur ring before i the liability for nuclear incident involve such nuclear material have be assumed pursuant to a write agreement by another operator another operator have take charge of such nuclear material the person duly a ut ho rise to operate a nuclear,5
65,65,SECTIONS,reactor have take charge of the nuclear material intend to be use in that reactor with which mean of transport be equip for use a a source of power whether for propulsion thereof or for any other purpose such nuclear material have be unloaded from the mean of transport by which it be sent to a person within the territory of a foreign state orc involve nuclear material sen t to that nuclear installation and occur after i the liability for nuclear incident involve such nuclear material have be transfer,5
66,66,SECTIONS,to that operator pursuant to a write agreement by the operator of another nuclear installation that operator have take charge of such nuclear material that operator have take charge of such nuclear material from a person operating a nuclear reactor with which a mean of transport be equip for use a a source of power whether n thereof or for any other purpose such nuclear material have be load with the write consent of that operator on of transport by which it be to be carry from,5
67,67,SECTIONS,the territory of a foreign where more than one operator be liable for nuclear damage the liability of the operator so involved shall in so far a the damage attributable to each operator be not separable be joint and several provided that the total liability of such operator shall not exceed the extent of li ability spec if ie dunder sub section of section where several nuclear installation of one and the same operator be involve in a nuclear incident such operator shall in respect of each such nuclear installation,5
68,68,SECTIONS,be liable to the extent of under sub section of section the liability of the operator of the nuclear installation shall be strict and shall be base on the principle of no fault liability explanation for the purpose of this section a ere nuclear damage be cause by a nuclear incident occur in a nuclear installation on account of temporary storage of material in transit in such installation the person responsible for transit of such material shall be deem to be the ope rat orb where a ear,5
69,69,SECTIONS,damage be cause a a result of nuclear incident during the transportation of nuclear material the consignor shall be deem to be the opera torc where any write agreement have be enter into between the consignor and the consignee or a the case may be the consignor and the carrier of nuclear material the person liable for any nuclear damage under such agreement shall be deem to be the where both nuclear damage and damage other than nuclear damage have be cause by a nuclear incident or jointly by a nuclear incident,5
70,70,SECTIONS,and one or more other occurrence such other damage shall to the extent it be not separable from the nuclear damage be deem to be a nuclear damage cause by such nuclear incident,5
71,71,SECTIONS,operator not liable i n certain circumstance an operator shall not be liable for any nuclear damage where such damage be cause by a nuclear incident directly due to i a grave natural disaster of an exceptional character an act of arm conflict hostility civil war insurrection or an operator shall not be liable for any nuclear damage cause to i the nuclear installation itself and any other nuclear installation include a nuclear installation under construction on the site where such i be,6
72,72,SECTIONS,locate to any property on the same site which be use or to be use in connection with any such installation to the mean of transport upon which the nuclear material involve be carry at the time of nuclear incident provided that any compensation liable to be pa id by an operator for a nuclear damage shall no thave the effect of reduce the amount of his liability in respect of any other claim for damage under any other law for the time be in where any nuclear damage be suffer by a person on account of his own negligence or from hi sown act of commission or omission the operator shall not be liable to such person,6
73,73,SECTIONS,limit of liability the maximum amount of liability in respect of each nuclear incident shall be the rupee equivalent of three hundred million special draw right or such high amount a the central government may specify by notification provided that the central government may take additional measure where necessary if the compensation to be award under this act the amount specify under this sub the liability of an operator for each nuclear incident shall be a in respect of nuclear reactor have,7
74,74,SECTIONS,thermal power equal to or above ten rupee one thousand five hundred in respect of spent fuel reprocess plant rupee three hundred in respect of the research reactor have thermal power below ten fuel cycle than spent fuel reprocess plant and spor tat ion of nuclear material rupee one that the central government may review the amount of operator liability from time to time and specify by notification a high amount under this sub section provided far that the amount of liability shall not include any interest or cost of proceeding,7
75,75,SECTIONS,liability of central government the central government shall be liable for nuclear dama gein respect of a nuclear incident a where the liability the amount of l of an operator specify under sub of section to the extent such liability such liability of the ope rat orb occur in a nuclear installation own by it occur on account of cause specify in clause i and of sub section of section that the central government may by notification assume,7
76,76,SECTIONS,full liability for a nuclear installation not operate by it if it be of the opinion that it be necessary in public for the purpose of meeting part of it liability under clause a or clause c of sub section the central government may establish a fund to be call the nuclear liability fund by charge such amount of levy from the operator in such manner a may be,7
77,77,SECTIONS,operator to maintain insurance or financial security the operator shall before he begin sope ration of his nuclear installation take out insurance policy or such other financial security or combination of both cover his liability under sub section of section in such manner a may the operator shall from time to time renew the insurance policy or other financial security refer red to in sub section before the expiry of the period of validity the sion of sub section and,7
78,78,SECTIONS,shall not apply to a nuclear installation own by the central government explanation for the purpose of this section financial security mean a contract of indemnity or guarantee or share or bond or such a may be or any combination thereof chapter commissioner,7
79,79,SECTIONS,compensation for nuclear damage and it adjudication whoever suff ers nuclear damage shall be entitle to claim compensation in accordance with the provision of s for the purpose of adjudicate upon claim for compensation in respect of nuclear damage the central government shall by notification appoint one or more claim commissioner for such area as may be specify in that notification,8
80,80,SECTIONS,for appointment a claim commissioner a person shall not be qualify for appointment a a claim commissioner unless he a be or have be a district judge orb in the service of the central government and have the post not below th e rank of additional secretary to the government of or any other equivalent post in the central government,8
81,81,SECTIONS,salary allowance and other term and condition of service of claim commissioner the salary and allowance payable to and other term and condition of service of claim commissioner shall be such a may be,8
82,82,SECTIONS,adjudication procedure and power of claim commissioner for the purpose of adjudication of claim under this act the claim commissioner shall follow such a may for the purpose of hold inquiry the claim commissioner may associate with him such per sons have ex per ti se in the nuclear field or such other person and in such manner a may where any person be a under sub section he shall be pa id such remuneration fee or allowance a may be the claim,8
83,83,SECTIONS,commissioner shall for the purpose of discharge his function under this act have the same power a be in a civil court under the code of civil procedure of while try a suit in respect of the follow matter namely a summon and enforce the attendance of any person and examine him on the discovery and production of receive evidence on requisition any public record or copy thereof from any court or of fi cee issue of commission for the examination,8
84,84,SECTIONS,of any any other matter which may be the claim commissioner shall be deem to be a civil court for the purpose of section and chapter of the code of criminal procedure of and award,8
85,85,SECTIONS,invite application for claim by claim commissioner after the notification of nuclear incident under sub section of section the claim commissioner have jurisdiction over the area shall cause wide publicity to be give in such manner a he fit for invite application for claim ing compensation for nuclear damage,9
86,86,SECTIONS,entitle to make application for nuclear damage an application for compensation before the claim commissioner or the commission a the case may be in respect of nuclear damage may be make by a a person who have sustain injury orb the ow ne r of the property to which damage have be cause orc the legal representative of the decease any agent duly a ut ho rise by such person or owner or legal representative,9
87,87,SECTIONS,procedure for make application before claim commissioner every application for compensation before the claim commissioner for nuclear damage shall be make in such form contain ing such particular and accompany by such document a may be subject to the provision of section every a p plica ti on under sub section shall be made within a period of three year from the date of knowledge of nuclear damage by the person suffer such damage,9
88,88,SECTIONS,award by claim commissioner on receipt of an application under sub section of section the claim commissioner shall after give notice of such application to the operator and afford ing an opportunity of be to the party dispose of the application within a period of from the date of such receipt and make an award a c while make an award under this section the claim commissioner shall not take into consideration any benefit reimbursement or amount receive by the applicant in pursuance,9
89,89,SECTIONS,of contract of insurance take by him or for member of his fa mil y or where an operator be likely to remove or dispose of his property with the object of by him of the amount of the award the claim commissioner may in accordance with of rule to of order of the first schedule to the code of civil procedure grant a temporary injunction to restrain such the claim commissioner shall arrange to deliver copy of the award to the party within a period of fifteen day from the date of th e every award make under sub section shall be final,9
90,90,SECTIONS,operator right of recourse the operator of the nuclear installation after pay the compensation for nuclear damage in accordance with section shall have a right of recourse er ea such right be expressly provide for in a contract in the nuclear incident have result a a consequence of an act of supplier or his employee supply of equipment or material with patent or latent defect or sub st anda the nuclear incident have result from the act of commission or omission of an individual done with the intent to cause nuclear,9
91,91,SECTIONS,extinction of right to claim the right to claim compensation for nuclear damage shall extinguish if such claim be not make within a period of a ten year in the case of damage to twenty year in the case of personal injury to any person from the date of occurrence of the incident notify under sub section of section that where a nuclear damage be cause by a nuclear incident involve nuclear material which prior to such nuclear incident have be steal lose jettison or abandon the say,10
92,92,SECTIONS,period of shall be compute from the date of such nuclear i but in no case it shall exceed a period of twenty year from the date of such theft loss jettison or abandonment chapter damage claim commission,10
93,93,SECTIONS,establishment of nuclear damage claim commission where the central govern me nth a v ing regard to the injury or damage cause by a nuclear incident be of the opinion that it be expedient in public interest that such claim for such damage be adjudicate by the commission instead of a it may by notification a commission for the purpose of this act,10
94,94,SECTIONS,composition of commission the commission shall consist of a chair person and such not exceed six a the central government may by notification the chair person and other member of the commission shall be appoint on the recommendation of a selection committee consist of three expert from amongst the person have at least thirty year of experience in nuclear science and a retire supreme court a person shall not be qualify for appointment a the chair person of the commission unless,10
95,95,SECTIONS,attain the age of fifty five year and be or have be or qualify to be a judge of a high court provided that no appointment of a sit judge shall be make after consultation with the chief justice of a person shall not be qualify for appointment a a member unless he have attain the age of fifty five year and a have or be hold or qualify to hold the post of additional secre tar y to the government of or any other equivalent post in the central government and posse special knowledge inlaw relate to nuclear liability arise out of nuclear incident orb have be a claim commissioner for five year,10
96,96,SECTIONS,term of of fi ce the chair person or a member a the case may be shall hold office a such for a term of three year from the date on which he upon his office and shall be eligible for re appointment for another term of three that no person sha hold office a such chair person or member after he have attain the age of sixty seven year,10
97,97,SECTIONS,salary allowance and other term and condition of service of chair person and member the salary and allowance payable to and other term and condition s of service include pension gratuity and other retirement benefit of the chair person and other member shall be such a may that no salary allowance and other term and condition of service of the chair person or other er shall be varied to his disadvantage after his,10
98,98,SECTIONS,fill up of vacancy if for reason other than temporary absence any vacancy in the office of the chair person or member a the case may be the central government shall a p po in t another person in accordance with the provision of this act to fill such vacancy and the proceeding may be continued before the commission from the stage at which it be before the vacancy be fill,11
99,99,SECTIONS,resignation and removal the chair person or a member may by a notice in write under his hand address to the central government resign his office provided that the chair person or the member shall unless he be permit by the central government to relinquish his office sooner continue to ho office until the expiry of three month from the date of receipt of such notice or until a person duly appoint a his successor upon his office or until the expiry of his term of office whichever be the central,11
