,Unnamed: 0,Title,Paragraph Text,Page No
723,723,SECTIONS,transport any taxable good without the cover of document a may be specify in suppress es his turnover lead to evasion of tax under this to keep maintain or retain book of account and other document in accordance with the provision of this act or the rule make to furnish information or document call for by an officer in accordance with of this a c t or the rule make thereunder or furnish es false information or any proceeding under this,79
724,724,SECTIONS,supply transport or store any good which he have reason to believe be liable to confiscation under this issue any i or document by use the registration number of another tamper with or any material evidence or of or tamper with any good that have be detain seize or attach under this act shall be liable to pay a penalty of ten thousand rupee or an amount equivalent to the tax evade or the tax not de ducted under section or short deduct,79
725,725,SECTIONS,or deduct but not pa id to the government or tax not collected under section or short collect o r collect but not pa id to the government or input tax credit avail of on or distribute irregularly or the refund fraudulently whichever be any register person who supply any good or service or both on which any tax have not been pa id or short pa id or erroneously refund or where the input tax credit have be wrongly avail a for any reason other than the reason of fraud or any,79
726,726,SECTIONS,misstatement or suppression to evade tax shall be l to a penalty of ten thousand rupee or ten per cent of the tax due from such person whichever be for reason of fraud or any misstatement or suppression of fact to evade tax shall be liable to a penalty equal to ten thousand or the tax due from such person whichever be any person who a aid or any of the of fence specify in clause i to of sub section possession of or in any way concern himself,79
727,727,SECTIONS,in transport remove deposit ing keeping conceal supply or pur chasing or in any other manner deal with any good which or have reason to believe be liable to confiscation under this act or the rule make or be in any way concerned with the supply of or in any other manner deal with any supply of service which he know or have reason to believe be in contravention of any provision of this act or the rule make to appear before the officer of central tax en issue with,79
728,728,SECTIONS,a summons for appearance to give evidence or produce a document in an to issue invoice in accordance with the provision of this act or the rule made thereunder or to account for an invoice in his book of be liable to a penalty which may extend to twenty five thousand rupee,79
729,729,SECTIONS,penalty for failure to furnish information return if a person who be require to furnish an information return under section to do so within the period specify in the notice issue under subsection thereof the proper officer may direct that such person shall be liable to pay a penalty of one hundred rupee for each day of the period during which the failure to furnish such return that the penalty impose under this section shall not exceed five thousand rupee,81
730,730,SECTIONS,fine for failure to furnish statistic if any person require to furnish any information or return under section a without reasonable cause to furnish such information or return a may be require under that section orb furnish es or cause to furnish any information or return which he know to be false he shall be punishable with a fine which may extend to ten thousand rupee and in case of a con ti nu ing of fence to a far fine which may extend to one hundred rupee for each day after the first day during which the of fence continue subject to a maximum limit of twenty five thousand rupee,81
731,731,SECTIONS,general any person who any of the provision of this act or make thereunder for which no penalty be separately provide for in this act shall be liable to a penalty which may extend to twenty five thousand rupee,81
732,732,SECTIONS,general discipline related to penalty no officer under this act shall impose any penalty for minor breach of tax regulation or procedural requirement and in particular any omission or mistake in documentation which be easily rectifiable and make without fraudulent intent or gross negligence explanation for the purpose of this sub section a a breach shall be consider a minor breach if the amount of tax involve be less than five thousand an omission or mistake in documentation sh al l be consider to be,81
733,733,SECTIONS,easily rectifiable if the same be an error apparent on the face of the penalty impose under this act shall depend on the fact and circumstance of each case and shall be commensurate with the degree and severity of the b no penalty shall be impose on any person without give him an opportunity of be the officer under this act shall while impose penalty in an order for a breach of any law regulation or procedural requirement specify the nature of the breach and the applicable law regulation or procedure,81
734,734,SECTIONS,under which the amount of penalty for the breach have be when a person voluntarily to an officer under this act the circumstance of a breach of the tax law regulation or procedural requirement prior to the discovery of the breach by the officer under this act the proper officer may consider this fact a a mitigate factor when quantify a penalty for the provision of this section shall n apply in such case where the penalty specify under this act be either a fix sum or express a a fix percentage,81
735,735,SECTIONS,power to impose penalty in certain case where the proper officer be of the view that a person is liable to a penalty and the same be not cover under any proceeding under section or section or or section or section or section or section he may issue an order levy such penalty after give a reasonable opportunity of be to such person,81
736,736,SECTIONS,power to waive penalty or fee or both the government may by notification waive in part or full any penalty refer to in section or section or section or any late fee refer to in for such class of taxpayer and under s mitigate circumstance a may be specify therein on the recommend a ti ons of the council,81
737,737,SECTIONS,detention seizure and release of good and conveyance in transit notwithstanding anything contain in this act where any person transport any go od or store any good while they be in transit in contravention of the provision of this act or the rule make thereunder all such good and conveyance use a a mean of transport for carry the say good and document relate to such good sand c shall be liable to detention or seizure and after detention or seizure shall be release a on payment of the,82
738,738,SECTIONS,applicable tax and penalty equal to one hundred per cent of the tax payable on such good and in case of exempt good on payment of an amount equal to two per cent of th evalue of good or twenty five thousand rupee whichever be less where the owner of the goods comes forward for payment of such tax and on payment of the applicable tax and penalty equal to the fifty per cent of the value of the goods reduce by the tax amount pa id thereon and in case of exempt good on payment of an amount equal to five per cent of,82
739,739,SECTIONS,the value of good or t five thousand rupee whichever be less where the owner of the good do not come forward for payment of such tax and upon furnish a security equivalent to the amount payable under clause a or clause b in such form and manner a may be that no such good or conveyance shall be detain or seize without serve an order of detention or seizure on the person transport the the provision of sub section of section shall mu tat is mu tan dis apply for,82
740,740,SECTIONS,detention and seizure of good and the proper officer detain or seize good or conveyance shall issue a notice specify the tax and penalty payable and thereafter an order for payment of tax and penalty under clause a or clause b or clause no tax interest or penalty shall be determine under sub section without give the person concerned an opportunity of be on payment of amount refer in sub section all proceeding in respect of the in sub section,82
741,741,SECTIONS,shall be deem to be where the person transport any good or the owner of the good to pay the amount of tax and penalty a provide in sub section within day of such detent ion or seizure shall be initiate in accordance with the provision of section that where the detain or seize good be perishable or hazardous in nature or be likely to depreciate in value with passage of time the s aid period of seven day may be reduce by the proper officer,82
742,742,SECTIONS,confiscation of good or conveyance and levy of penalty notwithstanding in this act if any person i supply or any good in contravention of any of the provision of this act or the rule sma de thereunder with intent to evade payment of tax do not account for any good on which he be liable to pay tax under this act supply any good liable to tax under this act without have lie for registration any of the provision of this act or the rule make,82
743,743,SECTIONS,thereunder with intent to evade payment of tax us any conveyance a a mean of transport for carriage of good in contravention of of th be act or the rule make thereunder unless the owner of the conveyance prof that it,82
744,744,SECTIONS,sub by act of s for seven day so use without the knowledge or connivance of the owner himself his agent if any and the person in charge of the conveyance then all such good or conveyance shall be liable to confiscation and the person shall be liable to penalty under section whenever confiscation of any good or conveyance be a ut ho rise by this act the office rad jud ging it shall give to the owner of the good an option to pay in lieu of confiscation such fine a the said officer,82
745,745,SECTIONS,think fit provided that such fine leviable shall not exceed the market value of the good confiscate s the tax chargeable thereon provided far that the aggregate of such fine and penalty leviable shall not be less than the amount of penalty leviable under sub section of section also that where any such conveyance be use for the car ria ge of the good or passenger for hire the owner of the conveyance shall be give an option to pay in lieu of the confiscation of the conveyance a fine equal to the tax payable on the,82
746,746,SECTIONS,good be transport where any fine in lieu of con fi scat ion of good or conveyance be impose under sub section owner of such good or conveyance or the person refer to in sub section shall in addition be liable to any tax penalty and charge payable in respect of such good or no order for confiscation of good or conveyance or for imposition of penalty shall be give the person an opportunity of be where any good or conveyance be confiscate under this act,82
747,747,SECTIONS,the title of such good yan ce shall thereupon vest in the the proper officer adjudge confiscation shall take and hold possession of the thing confiscate dand every officer of police on the requisition of such proper officer shall assist him in take and hold ing such the proper officer may after satisfy himself that the confiscate good or conveyance be in any other proceeding under this act and after give reasonable time not exceed to pay fine in lieu of c on fi scat ion dispose of such good or conveyance and deposit the sale proceeds thereof with the government,82
748,748,SECTIONS,confiscation or penalty not to interfere with other punishment without prejudice to contain in the code of criminal procedure of no confiscation make or under the provision of this act or the rule make thereunder shall prevent the infliction of any other punishment to which the person affected thereby be liable under the provision of t his act or under any other law for the time be in force,83
749,749,SECTIONS,punishment for certain of fence whoever any of the follow a supply any good or service or both without issue of any invoice in violation of of this act or the rule make thereunder with the intention to evade issue any invoice or bill without supply of good or service or both in violation o f of this act or the rule make thereunder lead to wrongful availment or of input tax credit or refund of avail input tax credit use such,83
750,750,SECTIONS,invoice or bill refer to in clause collect any amount a tax b ut to pay the same to the government beyond a period of from the date on which such payment becomes tax fraudulently avail input tax credit or fraudulently refund and where such of fence be not cover under s a to or substitute financial record or produce fake account or document or furnish es any false information with an intention to evade payment of tax due under this or,83
751,751,SECTIONS,any officer in the discharge of his duty under this a c th possession of or in any way concern himself in transport remove deposit ing keeping conceal supply or pur chasing or in any other manner deal with any good which or have reason to e be liable to confiscation under this act or the rule make or be in any way concerned with the supply of or in any other manner deal with any supply of service which he know or have reason to believe be in contravention of,83
752,752,SECTIONS,any provision of this act or the rule make tamper with or any material evidence or to supply any information which he be require to supply under this act or the rule made thereunder or unless with a rea so nable belief the burden of prove which shall be upon him that the information supply by him be true supply false information attempt to commit or the commission of any of the of fence mention in clause a of this section shall be punishable i in case where,83
753,753,SECTIONS,the amount of tax evade or the amount of input tax credit wrongly avail or the amount of refund wrongly take five hundred rupee with imprisonment for a term which may extend to five year and with in case where the amount of tax evade or the amount of input tax credit wrongly avail or the amount of refund wrongly take two hundred rupee but do not exceed five hundred rupee with imprisonment for a term which may extend to three year and with in the case of,83
754,754,SECTIONS,any other of fence where the amount of tax evade or the amount of input tax credit wrongly avail or or the amount of refund wrongly take one rupee but does not exceed two hundred rupee with imprisonment for a term which may extend to one year and with in case where he or the commission of an of fence specify in clause f or clause g or clause j he shall be punishable with imprisonment for a term which may extend to or with fine or with where any person,83
755,755,SECTIONS,convict of an of fence under this section be again convict of an of fence under this section then he shall be pu ni shab for the second and for every subsequent of fence with imprisonment for a term which may extend to five year and with the imprisonment refer to in clause i and of sub section and sub section in the absence of and adequate reason to the contrary to be record in the judgment of the court be for a term not less than six notwithstanding anything contain,83
756,756,SECTIONS,in the code of criminal procedure of under this act except the of fence refer to in sub section shall be non cognizable the of fence specify in clause a or clause b or clause c or clause d of sub section and punishable under clause i of that sub section shall be cognizable and non a person shall not be prosecute for any of fence under this section except with the previous sanction of the commissioner explanation for the purpose of this section the,83
757,757,SECTIONS,term tax shall include the amount of tax evade or the a mo of input tax credit wrongly avail or or refund wrongly take under the provision of this act the state good and service tax act the integrate good and service tax act or the good and service tax act and ce levy under the good and service tax compensation tost ates act,83
758,758,SECTIONS,liability of officer and certain other person where any person engage in connection with the collection of statistic under section or compilation or computer is at ion thereof or if any officer of central tax have access to information specify under sub section of section or if any person engage in connection with the provision of service on the common portal or the agent of common portal any or the content of any return furnish under this act or rule sma de thereunder otherwise,85
759,759,SECTIONS,than in execution of his duty under the say section or for the purpose of prosecution for an of fence under this act or under any other act for the time b in force he shall be punishable with imprisonment for a term which may extend to six month or with fine which may extend to twenty five thousand rupee or with any person a who be a government servant shall not be prosecute for any of fence under this section except with the previous sanction of the who be not a government servant shall not be prosecute for any of fence under this section except with the previous sanction of the commissioner,85
760,760,SECTIONS,cognizance of of fence no court shall take cognizance of any of fence punishable under this act or the rule make thereunder except with the previous sanction of the commissioner and no court inferior to that of a magistrate of the first class shall try any such of fence,85
761,761,SECTIONS,presumption of culpable mental state in any prosecution for an of fence under this act which require a culpable mental state on the part of the accuse the court shall presume the existence of such mental state but it shall be a defence for the accuse t o prove the fact that he have no such mental state with respect to the act charge a an of fence in that prosecution explanation for the purpose of this section i the expression culpable mental state include intention motive knowledge of a fact and belief in or reason to,85
762,762,SECTIONS,believe a a fact be say to be prove only when the court believe it to exist beyond reasonable doubt and not merely when it existence be establish by a preponderance of probability,85
763,763,SECTIONS,relevancy of statement s under certain circumstance a statement make and sign by a person on appearance in response to any summons issue under section during the course of any inquiry or proceeding under this act shall be relevant for the purpose of prove in any pro se cut ion for an of fence under this act the truth of the fact which it a when the person who make the statement be dead or cannot be found or be incapable of giving evidence or be kept out of the way by the adverse party or whose presence cannot be,85
764,764,SECTIONS,an amount of delay or expense which under the circumstance of the case the unreasonable orb when the person who make the statement be examine a a witness in the case before the court and the court be of the opinion that have regard to the circumstance of the case the statement should be admitted in evidence in the interest of justice,85
765,765,SECTIONS,of fence by company where an of fence commit by a person under this act be a company every person who at the time the of fence be commit be in charge of and be responsible to the company for the conduct of business of the company a well a the company shall be deem to be guilty of the of fence and shall be liable to be proceed against and pun notwithstanding anything contain in sub section where an of fence under this act have been commit ted by a company and it be prove that the of fence,85
766,766,SECTIONS,have be commit with the consent or connivance of or be attributable to any negligence on the part of any director manager secretary or of the company such director manager secretary or other officer shall also be deem to be guilty of that of fence and shall be liable to be proceed against and punish a c cor where an of fence under this act have be commit by a taxable person be a partnership fir mor a limited liability partnership or a undivided family or a trust the partner or or man aging,85
767,767,SECTIONS,trustee shall be deem to be guilty of that of fence and shall be liable to be proceed againstand punish accordingly and the provision of sub section shall mu tat is mu tan dis apply to nothing contain in this section shall render any such person liable to any provide din this act if he prof that the of fence be commit without his knowledge or that he have exercise all due diligence to prevent the commission of such of fence explanation for the purpose of this section i company mean a body c or po rate and include a firm or other association of director in relation to a firm mean a partner in the firm,85
768,768,SECTIONS,compound of of fence any of fence under this act may either before or after the institution of prosecution be compound by the commissioner on payment by the person accuse of the of fence to the central government or the state government a the case may be of such compounding amount in such manner a may be that nothing in this section shall apply to a a person who have be allow to compound once in respect of any of the of fence spec if ie din clause a to f of sub section of,86
769,769,SECTIONS,section and the of fence specify in clause l which are relatable to of fence specify in clause a to f of the say sub a person who have be allow to compound once in respect of any of fence other than those in clause a under this act or under the provision of any state good and service tax act o r the union territory good and service tax act or the integrate good and service tax act in respect of supply of value exceed one crore a person who have be accuse of commit an of fence,86
770,770,SECTIONS,under this act which be also an of fence er any other law for the time be in force a person who have be convict for an of fence under this act by a a person who have be accuse of commit an of fence specify in clause g or clause clause k of sub section of section any other class of person or of fence a may be far that any compound allow under the provision of this section shall not affect the proceeding if any institute under any other law provided,86
771,771,SECTIONS,also th at compound shall be allow only after make payment of tax interest and penalty involve in such the amount for compound of of fence under this section shall be such a may be to the minimum amount not be less than ten thousand rupee or fifty per cent of the tax involved whichever be high and the maximum amount not be less than thirty thousand rupee or one hundred and fifty per cent of the tax whichever be on payment of such compound amount a may be determine by,86
772,772,SECTIONS,the commissioner no shall be initiate under this act against the accuse person in respect of the same of fence and any criminal proceeding if already initiate in respect of the say of fence shall provision,86
773,773,SECTIONS,migration of exist taxpayer on and from the appoint day every person registered under any of the exist law and have a valid permanent account number shall be issue a certificate of registration on provisional basis subject to such condition and in such form and manner a may which unless replace by a final certificate of registration under sub section shall be liable to be cancel if the condition so bed be not comply the final certificate of registration shall be grant in,87
774,774,SECTIONS,such form and manner and subject to such con di ti ons a may be the certificate of registration issue to a person under sub section shall be deem to have not been issue if the say registration be cancel in pursuance of an application file by such person that he was not liable to registration under section or section,87
775,775,SECTIONS,transitional arrangement for input tax credit a register p er son other than a person opt ing to pay tax under section shall be entitle to take in his electronic credit ledger the amount credit eligible duty carry forward in the return relate to the period end with the y precede the appoint day furnish by him under the exist law in such manner a may that the register person shall not be allow to take credit in the namely,87
776,776,SECTIONS,i where the say amount of credit be not admissible a input tax credit under this act where he have not furnish all the return require under the exist law for the period of immediately precede the appoint date here the say amount of credit rel ates to good manufacture and clear under such exemption notification a be notify by the a register person other than a person opt to pay tax under section shall be entitle to take in his electronic credit ledger credit of the,87
777,777,SECTIONS,unavailed credit in respect of capital good snot carry forward in a return furnish under the exist law by him for the period end with the day immediately precede the appoint day in such manner a may be that the register person shall not be allow to take credit unless the say credit be admissible as credit under the exist law and be also admissible a input tax credit under this act explanation for the purpose of this sub section the expression unavailed the,87
778,778,SECTIONS,amount that remains after subtract the amount of credit already avail in respect of capital good by the taxable person under the exist law from the aggregate amount of to which th e say person be entitle in respect of the say capital good under the exist a register person who be not liable to be register under the exist law or who be engage din the manufacture of exempt good or provision of exempt se or who be provide works contract service and be avail of the benefit of,87
