,Unnamed: 0,Title,Paragraph Text,Page No
170,170,SECTIONS,authority under sub section of section the demographic information and biometric information under clause a and the manner of their collection under clause b of sub section of section the manner of maintain and update the information of individual in the central id en titi es data repository under clause f of sub section of section the manner of omit and deactivate an aa dha ar number and information relate thereto under clause g of sub section of section the manner of use,18
171,171,SECTIONS,of aa dha ar number for the purpose of provide or avail of various sub sidi es benefit service and other purpose for which aa dha ar number may be use under of sub section of section the term and condition for appointment of registrar enrol agency and other and the revocation of thereof under clause i of sub section of section the manner of share information of aa dha ar number holder under clause k of subsection of section various process,18
172,172,SECTIONS,relate to data management se cur protocol and other under clause m of sub section of section the procedure for issuance of new aa dha ar number to exist aa dha ar number holder under clause n of sub section of section manner of a ut ho rise registrar enrol agency or other service provider to collect such fe es for service provide by them under clause o of sub section of section policy and practice to be follow by the registrar enrol agency and o th er,18
173,173,SECTIONS,under clause r of sub section of section the manner of access the identity information by the aa dha ar number holder under the proviso to sub section of section the manner of share the identity inform a ti on other than core biometric information collected or create under this act under sub section of section the manner of alteration of demographic information under sub section and biometric information under sub section of section the manner of and the time for,18
174,174,SECTIONS,maintain the request for authentication and the response thereon under sub section and the manner of obtain by the aa dha ar number holder the authentication record under sub section of section any other matter which be require to be or may be specify or in respect of which provision is to be or may be make by regulation,18
175,175,SECTIONS,lay of rule and regulation before parliament every rule and every regulation made under this act shall be la id a soon a may be after it be make before each house of parliament while it is in session for a total period of thirty day which may be comprise in one session or in two or more successive session and if before the expiry of the session te ly follow the session or the successive session aforesaid both house agree in make any modification in the rule or regulation or both the house agree that the rule,19
176,176,SECTIONS,or regulation should not be make the rule or regulation shall thereafter have e only in such modify form or be of no effect a the case may be so however that any such modification or annulment shall be without prejudice to the validity of anything previously do under that rule or regulation,19
177,177,SECTIONS,application of other law not bar the provision of this act shall be in addition to and not in derogation of any other l aw for the time be in force,19
178,178,SECTIONS,act not to prevent use of aa dha ar number for other purpose under law in this act shall the use of aa dha ar number for establish the identity of an individual for any purpose whether by the state or any body corporate or person pursuant to any law for the time be in force or any contract to this effect provided that the use of aa dha ar number under this section shall be subject to the procedure an dob li ga ti ons under section and chapter,19
179,179,SECTIONS,power to remove difficulty if any difficulty ar is es in give effect to the provision of this act the central government may by order publish in the official gazette make such provision snot inconsistent with the provision of this act a may appear to be necessary for remove the difficulty provided that no such order shall be make under this section after the expiry of t year from the commencement of this every order make under this section shall be laid a soon a may be after it be make b each house of parliament,19
180,180,SECTIONS,saving anything do or any action take by the central government under the re of the government of commission bearing notification number ad min id a ted the or by the department of electronics and information technology under the cabinet secretariat notification bearing no ti fi cation number so e date the a the case may be shall be deem to have be y do or take under this act,19
