,Unnamed: 0,Title,Paragraph Text,Page No
0,0,SECTIONS,short title extent and commencement,1
1,1,SECTIONS,definition chapter,1
2,2,SECTIONS,officer under this act,1
3,3,SECTIONS,appointment of officer,1
4,4,SECTIONS,power of officer,1
5,5,SECTIONS,author is at ion of officer of state tax or union territory tax a proper officer in and collection of tax,1
6,6,SECTIONS,scope of supply,1
7,7,SECTIONS,tax liability on composite and mixed supply,1
8,8,SECTIONS,levy and collection,1
9,9,SECTIONS,composition levy,1
10,10,SECTIONS,power to grant exemption from tax chapter and value of supply,1
11,11,SECTIONS,time of supply of good,1
12,12,SECTIONS,time of supply of service,1
13,13,SECTIONS,change in rate of tax in respect of supply of good or service,1
14,14,SECTIONS,value of taxable supply chapter tax credit,1
15,15,SECTIONS,eligibility and condition for take input tax credit,1
16,16,SECTIONS,apportionment of credit and block credit,1
17,17,SECTIONS,availability of credit in special circumstance,1
18,18,SECTIONS,take input tax credit in respect of input and capital good sent for job work,1
19,19,SECTIONS,manner of di st rib ut ion of credit by input service section,1
20,20,SECTIONS,manner of recovery of credit distribute in excess chapter,2
21,21,SECTIONS,person liable for registration,2
22,22,SECTIONS,person not liable for registration,2
23,23,SECTIONS,compulsory registration in certain case,2
24,24,SECTIONS,procedure for registration,2
25,25,SECTIONS,deem registration,2
26,26,SECTIONS,special provision relate to casual taxable person and non resident taxable person,2
27,27,SECTIONS,amendment of registration,2
28,28,SECTIONS,cancellation or suspension of registration,2
29,29,SECTIONS,revocation of cancellation of registration chapter invoice credit and debit note,2
30,30,SECTIONS,tax invoice,2
31,31,SECTIONS,prohibition of collection of tax,2
32,32,SECTIONS,amount of tax to be indicate in tax invoice and other document,2
33,33,SECTIONS,credit and debit not es chapter and record,2
34,34,SECTIONS,account and other record,2
35,35,SECTIONS,period of retention of,2
36,36,SECTIONS,furnish detail of outward supply,2
37,37,SECTIONS,furnish detail of inward supply,2
38,38,SECTIONS,furnish of return,2
39,39,SECTIONS,first return,2
40,40,SECTIONS,claim of input tax credit and provisional acceptance thereof,2
41,41,SECTIONS,match reversal and reclaim of input tax credit,2
42,42,SECTIONS,match reversal and reclaim of reduction in output tax liability,2
43,43,SECTIONS,annual return,2
44,44,SECTIONS,final return,2
45,45,SECTIONS,notice to return defaulter,2
46,46,SECTIONS,levy of late fee,2
47,47,SECTIONS,good and service tax chapter of tax,2
48,48,SECTIONS,payment of tax in te rest penalty and other amount of input tax credit subject to certain order of of input tax credit,3
49,49,SECTIONS,interest on de la yed payment of tax,3
50,50,SECTIONS,tax deduction at source,3
51,51,SECTIONS,collection of tax at store,3
52,52,SECTIONS,transfer of input tax credit chapter xi,3
53,53,SECTIONS,refund of tax,3
54,54,SECTIONS,refund in certain case,3
55,55,SECTIONS,interest on de la yed refund,3
56,56,SECTIONS,consumer welfare fund,3
57,57,SECTIONS,of fund chapter,3
58,58,SECTIONS,self assessment,3
59,59,SECTIONS,provisional assessment,3
60,60,SECTIONS,scrutiny of return,3
61,61,SECTIONS,assessment of non filer of return,3
62,62,SECTIONS,assessment of unregistered person,3
63,63,SECTIONS,summary assessment in certain special,3
64,64,SECTIONS,audit by tax authority,3
65,65,SECTIONS,special audit chapter search seizure and arrest,3
66,66,SECTIONS,power of inspection search and seizure,3
67,67,SECTIONS,in spec ti on of good in movement,3
68,68,SECTIONS,power to arrest,3
69,69,SECTIONS,power to summon person to give evidence and produce document,3
70,70,SECTIONS,access to business premise,3
71,71,SECTIONS,officer to assist proper chapter and recovery,3
72,72,SECTIONS,determination of tax not pa id or short pa id or erroneously refund or input tax credit wrongly a v ai led or for any reason other than fraud or any misstatement or suppression,4
73,73,SECTIONS,determination of tax not pa id or short pa id or erroneous ly refund or input tax credit wrongly a v ai led or by reason of fraud or any misstatement or suppression of fact,4
74,74,SECTIONS,general provision relate to determination of tax,4
75,75,SECTIONS,tax collect but not pa id to government,4
76,76,SECTIONS,tax wrongfully collect and p aid to central government or state government,4
77,77,SECTIONS,initiation of recovery proceeding,4
78,78,SECTIONS,recovery of tax,4
79,79,SECTIONS,payment of tax and other amount in,4
80,80,SECTIONS,transfer of property to be void in certain case,4
81,81,SECTIONS,tax to be first charge on property,4
82,82,SECTIONS,provisional attachment to protect revenue in certain case,4
83,83,SECTIONS,continuation and validation of certain recovery to pay in certain case,4
84,84,SECTIONS,liability in case of transfer of business,4
85,85,SECTIONS,liability of agent and principal,4
86,86,SECTIONS,liability in case of amalgamation or merger of company,4
87,87,SECTIONS,liability in case of company in liquidation,4
88,88,SECTIONS,liability of director of private company,4
89,89,SECTIONS,liability of partner of firm to pay tax,4
90,90,SECTIONS,liability of guardian trustee,4
91,91,SECTIONS,liability of court of ward,4
92,92,SECTIONS,special provision regard liability to pay tax interest or penalty in certain case,4
93,93,SECTIONS,liability in other ruling,4
94,94,SECTIONS,definition,4
95,95,SECTIONS,authority for advance ruling,4
96,96,SECTIONS,application for advance ruling,4
97,97,SECTIONS,procedure on receipt of application,4
98,98,SECTIONS,appellate authority for e section,4
99,99,SECTIONS,appeal to appellate authority,5
100,100,SECTIONS,order s of appellate authority,5
101,101,SECTIONS,rectification of advance ruling,5
102,102,SECTIONS,applicability of advance ruling,5
103,103,SECTIONS,advance ruling to be void in certain circumstance,5
104,104,SECTIONS,power of authority and appellate authority,5
105,105,SECTIONS,procedure of authority and appellate authority chapter and revision,5
106,106,SECTIONS,appeal to appellate authority,5
107,107,SECTIONS,power of revisional authority,5
108,108,SECTIONS,constitution of appellate tribunal and bench thereof,5
109,109,SECTIONS,president and member of appellate tribunal their qualification appointment condition of service,5
110,110,SECTIONS,procedure before appellate tribunal,5
111,111,SECTIONS,appeal to appellate tribunal,5
112,112,SECTIONS,order of appellate tribunal,5
113,113,SECTIONS,financial and administrative power of president,5
114,114,SECTIONS,interest on refund of amount pa id for admission of appeal,5
115,115,SECTIONS,a p pea ra by a ut ho rise representative,5
116,116,SECTIONS,appeal to high court,5
117,117,SECTIONS,appeal to supreme court,5
118,118,SECTIONS,sum due to be pa id notwithstanding appeal,5
119,119,SECTIONS,appeal not to be file in certain case,5
120,120,SECTIONS,nonappealable decision and and pen alit is,5
121,121,SECTIONS,penalty for certain of fence,5
122,122,SECTIONS,penalty for failure to furnish information return,5
123,123,SECTIONS,fine for failure to furnish statistic,5
124,124,SECTIONS,general penalty,5
125,125,SECTIONS,general discipline related to penalty,5
126,126,SECTIONS,power to impose penalty in certain case,5
127,127,SECTIONS,power to waive penalty or fee or both,5
128,128,SECTIONS,detention seizure and release of good and conveyance in section,5
129,129,SECTIONS,confiscation of good or conveyance and levy of penalty,6
130,130,SECTIONS,confiscation or penalty not to interfere with other punishment,6
131,131,SECTIONS,punishment for certain of fence,6
132,132,SECTIONS,liability of officer and certain other person,6
133,133,SECTIONS,cognizance of of fence,6
134,134,SECTIONS,presumption of culpable mental state,6
135,135,SECTIONS,relevancy of statement under certain circumstance,6
136,136,SECTIONS,of fence by company,6
137,137,SECTIONS,compound of provision,6
138,138,SECTIONS,migration of exist taxpayer,6
139,139,SECTIONS,transitional arrangement for input tax credit,6
140,140,SECTIONS,transitional provision relate to job work,6
141,141,SECTIONS,miscellaneous transitional,6
142,142,SECTIONS,job work procedure,6
143,143,SECTIONS,presumption a to document in certain case,6
144,144,SECTIONS,of micro film facsimile copy of document and computer print out and a evidence,6
145,145,SECTIONS,common portal,6
146,146,SECTIONS,deem export,6
147,147,SECTIONS,special procedure for certain process,6
148,148,SECTIONS,good and service tax compliance rating,6
149,149,SECTIONS,obligation to furnish information return,6
150,150,SECTIONS,power to collect statistic,6
151,151,SECTIONS,bar on disclosure of information,6
152,152,SECTIONS,take assistance from an expert,6
153,153,SECTIONS,power to take sample,6
154,154,SECTIONS,burden of proof,6
155,155,SECTIONS,person deem to be public servant,6
156,156,SECTIONS,protection of action take under this act,6
157,157,SECTIONS,disclosure of information by a public servant,6
158,158,SECTIONS,publication of information in respect of person in certain section,6
159,159,SECTIONS,assessment proceeding not to be invalid on certain ground,7
160,160,SECTIONS,rectification of error apparent on the face of record,7
161,161,SECTIONS,bar on jurisdiction of civil court,7
162,162,SECTIONS,levy of fee,7
163,163,SECTIONS,power of government to make rule,7
164,164,SECTIONS,power to make regulation,7
165,165,SECTIONS,lay of rule regulation and notification,7
166,166,SECTIONS,delegation of power,7
167,167,SECTIONS,power to issue instruction or direction,7
168,168,SECTIONS,service of notice in certain circumstance,7
169,169,SECTIONS,round off of tax,7
170,170,SECTIONS,antiprofiteering measure,7
171,171,SECTIONS,removal of difficulty,7
172,172,SECTIONS,amendment of act of,7
173,173,SECTIONS,repeal and saving schedule central good and service tax act no of act to make a provision for levy and collection of tax on in tra state supply of good or both by the central government and for matter connect therewith o r incidental there tobe it enact by parliament in the sixty eighth year of the republic of a follow chapter i,7
174,174,SECTIONS,short title extent and commencement this act may be call the central good tax act it to the whole of it shall come into force on such a the central government may by notification in the official gazette appoint provided that different date may be appoint for different provision of this act and any re fe any such provision to the commencement of this act shall be construe a a reference to the coming into force of that provision,8
175,175,SECTIONS,definition in this act unless the context otherwise require actionable claim shall have the same meaning a assign to it in section of the transfer of property act of address of delivery mean the address of the recipient of good or service or both indicate don the tax invoice issue by a reg is te red person for delivery of such good or service or address on record mean the address of the recipient a available in the record of adjudicate authority mean any,8
176,176,SECTIONS,authority appoint or a ut ho rise to any order o r decision under this act but do not include the board of indirect tax and custom the revisional authority the authority for advance ruling the appellate authority for advance ruling appellate authority the appellate tribunal and the authority refer to in sub section of section agent mean a person include a factor broker commission agent an auctioneer or any other mercantile agent by whatever name call,8
177,177,SECTIONS,who carry on the business of supply or receipt of good or service or both on behalf of aggregate turnover mean the aggregate value of all taxable supply exclude the value of inward supply on which tax be payable by a person on reverse charge basis exempt supply export of goods or service or both and inter state supply of person have the same permanent account number tobe compute on all basis but central tax state tax union territory tax integrate tax and ce,8
178,178,SECTIONS,the word except the state of jam mu and ka sh mir omit by act of s,8
179,179,SECTIONS,june for section and notification no e date the june see gazette of extraordinary part sec for section to to to except the proviso to sub section of section except the proviso to sub section of section to to to to to notification no e date the june see gazette of extraordinary part sec i,8
180,180,SECTIONS,sub by act of s for central board of excise and custom,8
181,181,SECTIONS,sub by s ibid for the appellate authority and the appellate tribunal agriculturist mean an individual or a undivided family who cultivation of land a by own labour orb by the labour of family orc by servant on wage payable in cash or kind or by hire labour under personal supervision or the personal supervision of any member of the appellate authority mean an authority appoint or a ut ho rise to hear appeal a refer red to in section appellate tribunal,8
182,182,SECTIONS,mean the good and service t ax appellate tribunal constitute under section appoint day mean the date on which the provision of this act shall come into assessment mean determination of tax liability under this act and include self assessment re ass provisional assessment summary assessment and best associate enterprise shall have the same meaning a assign to it in section of the income tax act of audit mean the examination of re cor d,8
183,183,SECTIONS,return and other document maintain or furnished by the register person under this act or the rule make thereunder or under any other law for the time be in force to verify the correctness of turnover declare tax pa id refund and input tax credit avail and to ass his compliance with the provision of this act or the rule a ut ho rise bank shall mean a bank or a branch of a bank a ut ho rise by the government to collect the tax or any other amount payable under this a ut ho rise representative,8
184,184,SECTIONS,mean the representative a refer to in section board mean the board of indirect tax and custom constitute under the central board of revenue act of bus in ess include a any trade commerce manufacture profession vocation adventure wager or any other similar activity whether or not it be for a pecuniary any activity or transaction in connection with or incidental or ancillary to sub clause a c any activity or transaction in the nature of sub clause a,8
185,185,SECTIONS,whether or not there be volume frequency continuity or regularity of such supply or acquisition of good include capital good and service in connection with commencement or closure of bu sin es se provision by a club association society or any such body for a subscription or any other consideration of the facility or be nef it to it admission for a consideration of person to any service supply by a person a the holder of an office which have be accepted by him in the course or,8
186,186,SECTIONS,furtherance of his trade profession or activity of a race club include by way of to tali sa tor or a license to book maker of a book maker in such club and,8
187,187,SECTIONS,sub by act of s for central board of excise and custom,9
188,188,SECTIONS,sub by act of s any activity or transaction under taken by the central government a state government or any local authority in which they be engage a public capital good mean good the value of which be ca pi tali se in the book of account of the person claim the input tax credit and which be use or intend to be use in the course or furtherance of casual taxable,9
189,189,SECTIONS,person mean a per so n who occasionally transaction of good or service or both in the course or furtherance of business whether a principal agen tor in any other capacity in a state or a union territory where he have no fix place of business central tax mean the central good and service tax levy under section ce shall have the same meaning a assign to it in the good and service tax compensation to state charter accountant mean a charter a define in,9
190,190,SECTIONS,clause b of subsection of section of the charter accountant act of commissioner mean the commissioner of central tax and include the principal commissioner of central tax appoint under section and the commissioner of integrate tax a p pointed under the integrate good and service tax commissioner in the board mean the commissioner refer to in section common portal mean the common good and service tax electronic portal refer to insection common work day,9
191,191,SECTIONS,in respect of a state or union territory shall mean such day in succession which be not declare a gazette holiday by the central government or the concerned state or union territory company secretary mean a company secretary a define in clause c of sub section section of the company secretary act of competent authority mean s such authority a may be notify by the composite supply mean a supply make by a taxable person to a recipient consist of two or more,9
192,192,SECTIONS,taxable supply of good or service or both or any combination thereof which be naturally bund led and supply in conjunction with each other in the ordinary course of business one of which is a principal supply illustration where good be pac ked and transport with insurance the supply of good spack ing material transport and insurance be a composite supply and supply of good be a consideration in relation to the supply of good or service or both include a any payment make or to be make whether in,9
193,193,SECTIONS,money or otherwise in respect of in response to or r the inducement of the supply of good or service or both whether by the recipient or by any other person but shall not include any subsidy give by the central government or a state the monetary value of any act or forbearance in resp of in response to or for the inducement of the supply of good or service or both whether by the recipient or by any other person but shall not include any subsidy give by the central government or a state government,9
194,194,SECTIONS,clause omit by s ibid that a deposit give n in respect of the supply of good or service or both shall not be considered a payment make for such supply unless the supplier a p plies such deposit a consideration for the say continuous supply of good mean a supply of good which i s provide or agree to be provided continuously or on recurrent basis under a contract whether or not by mean of a wi recable pipeline or other conduit and for which the supplier invoice the,10
195,195,SECTIONS,recipient on a regular or periodic basis and include s up ply of such good a the government may subject to such con di ti ons as it may by notification continuous supply of service mean a supply of service which be provide or agree tobe provide continuously or on recurrent basis er a contract for a period exceed three month swith periodic payment obligation and include supply of such service a the government may subject to such condition a it may by notification conveyance include a,10
196,196,SECTIONS,vessel an aircraft and a cost accountant mean a cost accountant a define in b of sub section of section of the cost and work accountant act of council mean the good and service tax council establish under article of credit note mean a document issue by a register person under sub section of section debit note mean a document issue by a register person under sub section of section deem export mean such,10
197,197,SECTIONS,supply of good a may be notify under section designate authority mean such authority a may be notify by the document include write or print record of any sort and electronic record a define in clause t of section of the information technology act of drawback in relation to any good manufacture in and export mean the rebate of duty tax or ce chargeable on any import in pu t or on any domestic input or input service use din the manufacture of such,10
198,198,SECTIONS,electronic cash ledger mean the electronic cash ledger refer to in sub section of section electronic commerce mean the supply of good or ice or both include over digital or electronic electronic commerce operator mean any person who own ope rat es or ma nag es digital or electronic facility or platform for electronic electronic credit er mean the electronic credit ledger refer to in sub section of section exempt supply mean supply of any,10
199,199,SECTIONS,good or service or both which nil rate of taxor which may be wholly exempt from tax under section or under section of the integrate good sand service tax act and include non taxable exist law mean any law notification order rule or regulation relate to levy and collection of duty or tax on good or service or both pass or make before t he commencement of this act by parliament or any authority or person have the power to make such law notification order rule or regulation,10
200,200,SECTIONS,sub by act of by s for clause c family mean i the spouse and child of the person the parent grand parent brother and sister of the person if they be wholly or mainly dependent on the say fix establishment mean a place other than the register place of business which by a sufficient degree of p er man en ce and suitable structure in term of human and technical resource to supply service or to receive and use service for it own,11
201,201,SECTIONS,fund mean the consumer welfare fund establish under section good mean every kind of property other than money and security but include sac ti on able claim grow crop grass and thing attach to or form part of the land which are agreed to be sever before supply or under a contract of government mean the cent good and service tax compensation to state act mean the good and service tax compensation to state act of good and,11
202,202,SECTIONS,service tax practitioner mean any person who have be approve under section to act a such mean the territory of a refer to in article of the constitution it territorial wat ers se abed and sub soil underlie such water continental shelf exclusive economic zone or any other maritime zone a refer to in the territorial water continental shelf exclusive economic zone and other maritime zone act of and the air space above it territory and integrate,11
203,203,SECTIONS,good and service tax act mean the integrate good and service tax of integrate tax mean the integrate good and service tax levy under the in teg rated goods and service tax input mean any good other than capital good use or intend to be use by a supplier in the course or furtherance of input service mean any service use or intend to be use by a supplier in the course or furtherance of input service distributor mean an office of the supplier of goo d,11
204,204,SECTIONS,or service or both which tax invoice issue under section towards the receipt of input service and issue document for the purpose of distribute the credit of central tax state tax integrate taxor union territory tax p aid on the say service to a supplier of taxable good or service or the same permanent account number a that of the say input tax in relation to a register person mean the central tax state tax integrate taxor union territory tax charge on any supply of good,11
205,205,SECTIONS,or service or both make to him and include a the integrate good and service tax charge on import of the tax payable under the provision of sub section and of section the tax payable under the provision of sub section and of section of the in teg rated good and service tax the tax payable under the provision of sub section and of section of the respective state good and service tax act o re the tax payable under the provision of sub section and of,11
206,206,SECTIONS,section of the union territory good and service tax do not include the tax pa id under the composition input tax credit mean the credit of input in tra state supply of good shall have the same meaning a assign to it in section of the integrate good and service tax in tra state supply of service shall have the same meaning a assign to it in section of the integrate good and service tax invoice or tax invoice mean the tax invoice refer to in section,11
207,207,SECTIONS,inward supply in relation to a person shall mean receipt of good or service or both whether by purchase acquisition or any other mean with or without job work mean any treatment or process under taken by a person on good belonging to another register person and the expression job worker shall be construe local authority mean a a panchayat a define in clause d of article of the a municipality a define in clause e of article of the a,11
208,208,SECTIONS,municipal committee a pari shad a district board and any other authority legally en titled to or entrust by the central government or any state government with th e control or management of a municipal or local a cantonment board a define in section of the cantonment act of a regional council or a district council constitute under the sixth schedule to a dev board constitute under article article of the a regional council constitute,11
209,209,SECTIONS,under article of the location of the recipient of service mean a where a supply be receive at a place of business for which the registration have the location of such place of where a supply be receive at a place other than the place of business for which registration have be obtain a fix establishment elsewhere the location of such where a supply be receive at more than one establishment whether the place of business or fix establishment the,11
