,Unnamed: 0,Title,Paragraph Text,Page No
106,106,SECTIONS,the person ex ami and may thereafter be use in evidence against if any person without reasonable cause or refuse a to produce to an investigate authority or any person a ut ho rise by him in this behalf any book register other document or record which it be his duty under sub section or sub section furnish orb to furnish any information which it be his duty under sub section to furnish orc to appear before the investigate authority personally when require to do so under subsection,10
107,107,SECTIONS,or to answer any question which be put to him by the investigate authority in pursuance of that sub section to sign the note of any examination refer to in sub section shall be punishable with imprisonment for a term which may extend to one year or with fine extend to twenty five crore rupee or with both and also with a far fine which may extend to rupee for every day after the fir st day during which the failure or refusal,10
108,108,SECTIONS,search and seizure where the authority in of information in it reason to believe that a any person who have be require under sub section of section to produce or cause tobe produce any book account or other document in his custody or power have omit or fail to produce or cause to be produce such book account or other document orb any person to whom a requisition to produce any book account or other document as aforesaid have be or might be issue will not or,12
109,109,SECTIONS,would not produce or cause to be produce account or other document which will be useful for or relevant to an investigation under subsection of section orc a contravention of any provision of this act have be commit or be likely to be commit ted by an intermediary any claim which be due to be settle by the intermediary have be or be likely to be reject or settled at a figure high er than a reasonable amount ore any claim which be due to be settle by an intermediary have be or be likely to,12
110,110,SECTIONS,be reject or settled at a figure low er than a reasonable amount orf any illegal fee and charge have be transact or be likely to be transact by an intermediary any book account paper receipt voucher survey report or other document belonging to an intermediary be likely to be tamper with falsify or manufacture dit may a ut ho rise any officer of the authority not below the rank equivalent to that of a gazette officer of the government hereafter refer to a the a ut ho rise officer to i enter and,12
111,111,SECTIONS,search any building or place where he have reason to suspect that such or other document or any book or paper relate to any claim rebate or commission or any receipt voucher report o r other document be break open the lock of any box locker safe almirah or other receptacle for exercise the pow ers by clause i where the key thereof be not seize all or any such book account or other document found a a result of such place mark of identification on such,12
112,112,SECTIONS,boo k account or other document or make or cause to be make extract or copy there the a ut ho rise officer may requisition the ce of any p officer or of any officer of the central government or of both to a him for all or any of the purpose specify in sub section it shall be the of every such police officer or officer to comply with such the a ut ho rise officer may where it be not practicable to seize any h book account or other document specify in sub section,12
113,113,SECTIONS,e an order on the person who be in immediate possession or control thereof that he shall not remove part with or otherwise deal with it except with the previous permission of such office r and such officer may take such step a may be necessary for en sur ing compliance with this sub the a ut ho rise officer may during the course of th e search or seizure examine on oath any person who be found to be in possession or control of any book account or other document and any statement make by such person during such examination,12
114,114,SECTIONS,may thereafter be use in evidence in any proceeding under this the book account s paper receipt r report or other document seize under subsection shall not be retain by the a ut ho rise officer for a period exceed one hundred and eighty day from the date of the seizure unless the reason for retain the same be record by him in writing and the approval of the author for such retention be that the authority shall not a ut ho rise the re tention of the book account paper,12
115,115,SECTIONS,receipts vouch ers report or other doc ume for a period exceed thirty day after all the proceeding under this act for which the boo k account paper receipt voucher report or other do cum en t are relevant be the person from whose custody the book t pape r receipt voucher report or be seize under sub section may make copy thereof or take extract there from in the presence of the officer or any other person empower by him in this behalf at such,12
116,116,SECTIONS,place and time a the a ut ho rise officer may appoint in this if a person legally entitle to the book t paper receipt voucher report or seize under sub section object for any reason to the approval give by the authority under sub section he may make an application to the central government state therein the reason for such o and request for the return of the book account paper receipt vouch er report or other on receipt of the application under sub,12
117,117,SECTIONS,section the central government may after give the applicant an opportunity of be pa s such order a it think the provision of the code of criminal pro ce dure of relate to search shall apply so far a may be to ever y search and seizure make under subsection the central government may by notification make rule in relation to any search or seizure under this section and in particular and with out prejudice to the generality of the forego power may,12
118,118,SECTIONS,provide for the procedure to be follow by the a ut ho rise officer i for obtain into such building or place to be search where free thereto is not for ensure safe custody of any book t paper receipt voucher report or other document seize under this of authority to ensure compliance if the authority find after cause an inquiry to be made that any person have violate o r be likely to violate any provision of this act or any rule or regulation make thereunder the authority may an order require such person to cease and desist from commit or cause such violation,12
119,119,SECTIONS,management by administrator if at any time the authority have reason to believe that the central record keeping agency or pension fund be act in a manner likely to be prejudicial to the interest of subscriber it may after give the central record keeping agency or pension fund a the case may bean opportunity of be make a report thereon to the central if the central government after consider the report make under sub section be of the opinion that it be necessary or proper to do so it may,13
120,120,SECTIONS,appoint a n administrator to manage the affair of the central record keeping agency or fund a the case may be under the direction and control of the authority in h manner a may be specify by notification chapter vina ti on al pension system,13
121,121,SECTIONS,national pension system the contributory pension system notify by the government in the ministry of finance notification number f no date shall be deem to be the national pension system with effect from the st day and such national pension system may be amend from time to time by notwithstanding anything contain in the say not the national pension system shall on the commencement of this act have the follow basic,13
122,122,SECTIONS,feature namely a every subscriber shall have an individual pen sion account under the national pension withdrawal not exceed twenty five per ce of the contribution make by the subscriber may be permit from the individual pension account subject to the condition such a purpose frequency and limit a may be specify by the the function of record keeping accounting and switch of option by the subscriber shall by th e central record keeping there shall be a choice,13
123,123,SECTIONS,of multiple pension fund and multiple that a the subscriber shall have an option of invest up to hundred per cent of his fund in government security the subscriber seek minimum assure d return shall have an option to invest his fund sin such scheme provide minimum assure return a may be notify by the author it ye there shall be portability of individual n account in case of change of collection and transmission of contribution an d instruction shall be through point,13
124,124,SECTIONS,of presence to the central record keeping agen there shall not be any implicit or explicit assurance of benefit except market base guarantee mechanism to be purchase by the a subscriber shall not exit from the national pension system except a may be specify by the re gul at io n an di at exit the subscriber shall purchase an an nu it y from a life insurance company in accordance with the in addition to the individual pension account mention in clause a of sub section a subscriber may also at,13
125,125,SECTIONS,his option have an additional account under the national pension system feature men ti one d in clause c to g of sub section and also have the additional feature that the subscriber sh all be free to withdraw part or all of his money at any time from the additional account,13
126,126,SECTIONS,central record keeping agency the authority shall by grant a certificate of registration under sub section of section appoint a central record keeping agency provided that the authority may in public interest appoint more than one central the central record keeping y shall be responsible for receive instruction from the point of presence transmit such instruction to pension fund effect receive from subscriber and discharge such other,14
127,127,SECTIONS,duty and function a may be assigned to it under the certificate of registration or a may be determine by all the asset and property own lease or de velo ped by the central record keeping agency shall constitute regulate asset and upon expiry of certificate of registration or ear lier revocation thereof the authority shall be entitle to appropriate and take over the regulate asset either by itself or through an administrator or a person nominate by it in this behalf provided that the central record keeping agency,14
128,128,SECTIONS,shall be entitle to be compensate the fair value tobe ascertain by the authority of such regulate asset a may be determine by regula ti ons provided far that where the ear lier revocation of the certificate of re gist ratio n be base on violation of the condition in the certificate of registration or the provision of this act or regulation sunless otherwise determine by the authority the central record keeping agency shall not be entitle to claim any compensation in re of such regulate,14
129,129,SECTIONS,po of presence the authority may by grant a certificate of registration under subsection of section permit one or more person to act a a point of presence for the purpose contribution and instruction transmit them to the trustee bank or the central record keeping agency a the case may be and pay out benefit s to subscriber in accordance with the regula ti ons make by the authority from time to time in th be a point of presence shall function in accordance with the term of it,15
130,130,SECTIONS,certificate of registration and the regulation make under this fund the authority may by grant a certificate of registration under subsection of section permit one or more person to act a a pension fund for the purpose contribution accumulate them and make pay to the subscriber in such manner as may be specify by the number of pension fund shall be determine b y regulation and the authority may in public interest the number of pension funds provided that,15
131,131,SECTIONS,at least one of the pension fund shall be a government company explanation for the purpose of this sub section the expression government company shall have the meaning assign to it in section of the company act of the pension fund shall function in accordance with the term of it certificate of registration and the regulation make under this the pension fund shall manage the scheme in a with the regulation,15
132,132,SECTIONS,certain restriction on foreign company or individual or association of person the aggregate hold of equity share by a foreign either by itself or through it or it nominee or by an individual or by an association of person whether register or no tunder any law of a country outside take in aggregate in the pension fund shall not exceed twenty six per cent of the pa id up capital of such fund or such percentage a may be approve for an in dian insurance company under the provision the,15
133,133,SECTIONS,insurance act of whichever be higher explanation for the purpose of this section the foreign company shall have the meaning assign to it in clause of section of the income tax act of,15
134,134,SECTIONS,prohibition of investment of fund of subscriber outside no pension fund shall directly or indirectly outside the fund of subscriber,15
135,135,SECTIONS,eligibility norm of the central record keeping agency the central record keeping agency point of presence and pension fun d shall satisfy the eligibility norm a may be specify by the regulation include minimum capital requirement past track record include the ability to return cost and fee geographical reach customer base information tec capability human resource and such other of intermediary,15
136,136,SECTIONS,registration of central record keep agency pension fund point of presence no intermediary include a pension fund or a point of presence to the extent regulate under this act shall commence a activity relate to a pension fund except under and in accordance with the condition of a certificate of registration grant by the authority in accordance with the provision of this act and that any intermediary g any point of presence who have be associate with a pension scheme and,15
137,137,SECTIONS,appoint to act a s by the interim pension fund regulatory and development authority immediately before the establishment of the authority under this act for which no re gist rat ion certificate be prior to such establishment and may continue to do so for a period of from s establishment or if he have make an application for such registration within the said period of six month till the disposal of such every application for grant of a certificate of re gist ra ti on under this act shall be in such,15
138,138,SECTIONS,form and manner and shall be accompany by fee a may be determine by the authority may after consider the n and subject to such term s and condition a it may specify grant a certificate of re gist ra ti on a a central record keeping agency point of presence pension fund or such other in a the case may the authority may by order suspend or cancel a certificate of r grant under subsection in such manner a ma y be determine by regula ti ons provided that no order,15
139,139,SECTIONS,under this sub section shall be m ade unless the person concerned have been given a reasonable port unity of be and adjudication,15
140,140,SECTIONS,penalty for failure by an intermediary or any other person to comply with provision or this act rule regulation and direction any person who be require under this act or any rule or regula ti ons make thereunder a to obtain a certificate of registration from th e authority for carry on any activity under this act carry on such activity wi thou t obtain such certificate of registration he shall be liable to a penal of one r for each day during which the failure continue or one crore,16
141,141,SECTIONS,be to comply with the term and condition of a certificate of reg ist ration to do so he shall be liable to a penalty of one rupee s for each day during which the failure continue or one c whichever be to furnish any information document book re tu or report to the authority to furnish the same within the time specify by the a he shall be liable to a penalty which may extend to one crore rupee or f time the amount of profit make or s avoid whichever be,16
142,142,SECTIONS,high erd to maintain book of account or record to maintain the same he shall be liable to a penalty of one rupee for each day during which the failure continue or five time the amount of prof its make or loss avoid whichever be if any person who be require under this act o r any rule or regulation make thereunder to enter into an agreement with his client to en te r into such agreement he shall be liable to a penalty of rupee for each day ing which the failure continue or five time,16
143,143,SECTIONS,the amount of profit make or loss es avoid whichever be if any in register with the authority a have be call upon by the authority in write to redress the grievance of sub scriber to redress such grievance within the time stipula ted by the authority he sh al l be liable to a penalty of not more than one crore rupee or five times the amount of profit make or loss avoid whichever be if any person who be register under this act a an i to segregate money,16
144,144,SECTIONS,of the client or client or us the money o f a client or client for self or for an y other client he shall be liable to a penalty not exceed one crore rupee or five time the amount of profit make or s a voided whichever be whoever to comply with any provision of this a the rule or the regulation make or the di recti ons issue by the authority under the of this act for which no separate penalty have he shall be liable to a penalty which may extend to one crore rupee or five time the amount of prof its make or loss avoid whichever be high,16
145,145,SECTIONS,credit sum rea li se by way of penalty to subscriber education and protection fund all sum rea li se by way of penalty under th be act shall be credit to the subscriber education and protection fund establish under sub section of section,17
146,146,SECTIONS,power to adjudicate for the purpose of adjudge under section the author it y shall appoint any of it officer not below the rank specify by regulation to be an adjudicate officer for holding an inquiry a may be determine by regulation a f give the person concerned a reasonable opportunity of be for the purpose of impose any while hold an inquiry the adjudicate officer shall have the pow er to summon and enforce the attendance of any person acquaint with the fact and circumstance of,17
147,147,SECTIONS,the case to give evidence or to produce any document which in the opinion of the adjudicate officer may be useful for or relevant to the matter of the inquiry and if on such inquiry he be satisfied that the person have d to comply with the provision of section he may recommend such penalty a he th ink fit in accordance with the provision of that section to the member in charge of investigation and the penalty shall be impose by a member er than the member in charge of investigation,17
148,148,SECTIONS,and surveillance provided that while adjudge the quantum of penal under section the member shall have due regard to the low factor namely a amount of disproportionate gain or unfair ad vantage wherever quantifiable make a a result of the amount of loss cause to a er or group of subscriber the repetitive nature of the default,17
149,149,SECTIONS,attachment of asset and super sess io n of management of intermediary any person aggrieved may apply to the a u th for an interim measure of protection in respect of any of the following matter namely a the retention preservation interim tody o r sale of any asset or property which be regulated by the provision of this secure any pension fund money and her asset and property own by or under t he control of the pension interim injunction or appointment of an in is tra tor such other,17
150,150,SECTIONS,interim measure a may appear to the authority to be just and necessary and the authority shall have power to make such order ding an order for attachment of asset of the pension fund a it fit in this where on a complaint receive by the authority or mo tu the authority after conduct an inquiry come to a conclusion that the board or board of director by whatever name call or the person in control of any intermediary to th e extent regulate under this act be indulge in any activity which,17
151,151,SECTIONS,be in contravention of the provision of this act or regulation it may supersede the governing board or board of director or management of the intermediary in accordance with of the in case the govern board or board of director o r management of an intermediary be supersede dunder sub section the authority may appoint an administrator to manage the affair of the intermediary in accordance with t he provision contain in the regulation,17
152,152,SECTIONS,of fence without prejudice to any award of penalty by th e member under this act if any person or attempt to contravene or the contravention of the provision of this act or e or regulation make er he shall be punishable with imprisonment for a term which may extend to ten year or with fine which may extend to twenty five crore rupee or with if any person to pay the penalty impose by the member or t o comply with any of the di recti ons or order issue by the member,17
153,153,SECTIONS,he shall be punishable with imprisonment for a term which shall not be less than one month but ich may extend to ten year or with fine which may extend to twenty five crore rupee or with both,17
154,154,SECTIONS,power to grant immunity the central government may on the by the authority if satisfied that any person who be allege to have violate an y of the provision of this act or the rule or the regulation make thereunder have make a full and disclosure in respect of grant to such person subject to such a it may think fit to impose immunity from prosecution for any of fence under this act or the rule or the regulation make thereunder and also from the imposition of any penalty,18
155,155,SECTIONS,under this act with respect to the allege violation provided that no such immunity shall be grant by the central government in case where for the prosecution for any such of fe have be institute before the date of receipt ion for grant of such immunity provided far that the recommendation of the a under this sub section shall not be bin di the central an immunity grant to a person under sub section may at any time be withdrawn by the central government if it be,18
156,156,SECTIONS,satisfied that such p er son have in the course of the proceeding not the condition on which the immunity be grant or have give false evidence and thereupon such person may be try for the of fence with respect to which the immunity be grant or for any other of fence of which he appear to have be guilty in connection with the contravention and shall also become liable to the imposition of any penalty under this act to which such person d have been liable have no such immunity be grant,18
157,157,SECTIONS,exemption from tax on wealth income profit and gain notwithstanding in i the wealth tax act of the income tax act of any other enactment for the time be in f or ce relate to tax on wealth income profit or gains the authority shall not be liable to pay wealth tax income tax or any other tax in respect of it wealth income profit or gain derive,18
158,158,SECTIONS,cognizance of of fence by court no court shall take cognizance of any of fence p this act or any rule or regulation make thereunder save on a complaint make by the no court inferior to that of a court of session s hall try any of fence punishable under this to security appellate tribunal any person aggrieve by an order make by the authority or by an adjudicate officer under this act may prefer an appeal before the se cur it ie sap pellate tribunal which shall e jurisdiction over,18
159,159,SECTIONS,the every appeal under sub section shall be file wit hin a period of forty five day from the date of receipt of the order appeal against and it s hall be in such form and manner and shall be such fee a may be that the security appellate tribunal may enter tain an appeal after the expiry of the said period if it be satisfied that there be sufficient ca us e for not prefer t he appeal within that on receipt of an appeal under sub section the security appellate,18
160,160,SECTIONS,tribunal may after giving the party to the appeal an opportunity o f be such order thereon a it think fit confirming modify or set aside the order appeal a gains the security appellate tribunal shall send a copy o f every order make by it to the authority the par ti es to the appeal and to the a officer the appeal file before the se cur it ie s appellate tribunal under sub section shall be dealt with by it a expeditiously a possible and e shall be make by it to,18
161,161,SECTIONS,dispose of the appeal finally within six month from the date o n which the appeal be present to without prejudice to the provision of section and of the security and exchange board of act of the security a p pell ate tribunal shall deal with an appeal under this section in accordance with such procedure a may be,18
162,162,SECTIONS,civil court not to have jurisdiction no civil court shall have jurisdiction to entertain any s proceed in respect of any matter which an adjudicate officer appoint under s act or appellate tribunal be empower by or unde r this act to determine and no injunction shall beg ran ted by any court or other authority in respect of any action take or to be take in pursuance of any power by or under this act,19
