,Unnamed: 0,Title,Paragraph Text,Page No
110,110,SECTIONS,new aa dha ar number to exist aa dha ar number levy and collect the fee or a ut ho rise the registrar enrol agency or other service provider to collect such fee for the service provide by them under this act in such manner as may be specify by appoint such committee a may be necessar y to assist the authority in discharge of for the purpose of this promote research and development for advancement in biometrics and related usage of aa dha ar number through,10
111,111,SECTIONS,appropriate evolve of and specify by regulation policy and practice for registrar and other service provider set up facilitation cent re and grievance redressal mechanism for redressal of grievance registrar enrol li agency and other service provider st such other power and function a may be the authority may a enter into memorandum of understand or agreement a the case may be with the central government or state government or unio n,10
112,112,SECTIONS,territory or other agency for the purpose of per forming any of the function in relation to collect store secure or process ing of information or delivery of aa dha ar number to individual or perform by notification a p point such number of registrar engage and a ut ho rise such agency to collect store secure process information or do authentication or perform such other function in relation thereto as may be necessary for the purpose of this the authority may engage such consultant advisor and,10
113,113,SECTIONS,other person a may be require for efficient discharge of it function under this act on such allowance or remuneration and term and con di ti ons a s may be specify by contract chapter account and audit and annual report,10
114,114,SECTIONS,grant by central government the central government may after due appropriation made by parliament by law in this behalf make to the authority grant of such sum of money a the central government may think fit for be d for the purpose of this act,11
115,115,SECTIONS,other fee and revenue the fee or revenue collect by the authority shall be credit to the consolidated fund of,11
116,116,SECTIONS,account and audit the authority shall maintain proper account and other and prepare an annual statement of account in such form a may be by the central government in consultation with the comptroller and auditor general of the account of the authority shall be audit annually by the c and auditor genera lof at such interval a may be specify by him and any expenditure incur in connection with such audit shall be payable by the authority to the comptroller and auditor,11
117,117,SECTIONS,the comptroller and auditor genus l of and any person appoint by him in connection with the audit the account of the authority under this act shall have the same right and privilege and authority in connection with such audit a the comptroller and auditor general generally have in connection with the audit of government account and in particular shall have the right to demand production of book account connect voucher and other document and paper and to inspect any of the office of the the,11
118,118,SECTIONS,account of the authority a certify by the comptroller and auditor general of or any other person appoint by him in this behalf together with the audit report thereon shall be for warded annually to the central government by the authority and the central government shall cause the audit report to be laid a soon a may be after it be receive before each house of,11
119,119,SECTIONS,return and annual report the authority shall furnish to the central government at such time and in such form and manner a may be or a the central government may direct such return and statement and particular in regard to any matter under the jurisdiction of the authority as the central government may from time to time the authority sha prepare once in every year and in such form and manner and at such time as may be an annual report give a a description of all the activity of,12
120,120,SECTIONS,the authority for the previous the annual account for the previous year the pro gramme of work for come a copy of the report receive under sub section shall be laid by the central government as soon a may be after it be receive b each house of parliament chapter of information,12
121,121,SECTIONS,security and confidentiality of information the authority shall ensure the security of identity information and authentication record of subject to the provision of this act the authority shall ensure confidentiality of identity information and authentication record of the authority shall take all necessary measure to ensure that the information in the possession or control of the authority include information store in the central identity data repository be secure dand protect against,12
122,122,SECTIONS,access use or disclosure not permit under this act or regulation made thereunder and against accidental or intentional destruction loss or without prejudice to sub section and the authority sh al la adopt and implement appropriate technical and organ is at ion al security ensure that the agency consultant advisor or other person appoint or engage for per forming any function of the authority under this act have in place a p prop ria te technical and organ is at ion al security measure for the,12
123,123,SECTIONS,information ensure that the agreement or arrangement enter into with such agency or other person impose obligation equivalent to those impose on the authority under this act and require such agency consultant advisor and other person to act only on the notwithstanding anything contain in any other law for the time be in force and save as otherwise provide in this act the authority or any of it officer or other employee or any agency the,12
124,124,SECTIONS,central identity data repository shall not whether during his service or thereafter reveal any information store in the central identity data re po si tory or authentication record to anyone provided that an aa dha ar number holder may request the authority to provide access to his identity information exclude his core biometric information in such manner a m ay be specify by regulation,12
125,125,SECTIONS,on share information no core biometric information collect or create dunder this act shall be a share with anyone for any reason whatsoever orb use for any purpose other than generation of aa dha ar number and authentication under the identity information other than core biometric information collect or create under this act may be share only in accordance with the provision of this act and in such manner a may by no identity information available with a,12
126,126,SECTIONS,request entity shall be a use for any purpose other than that specify to the individual at the time of submit any identity information for authentication orb disclose far except with the prior consent of the individual to whom such no aa dha ar number or core biometric information collect or create under this act in respect of an aa dha ar number holder shall be publish displayed or post publicly except for the purpose as may be specify by regulation,12
127,127,SECTIONS,biometric information deem to be sensitive personal information the biometric information collect and store in electronic form in accordance with this act and regulation made thereunder shall be deem to be electronic record and sensitive personal data or information and the provision contain in the information technology act of and the rule made thereunder shall apply to such information in addition to and to the extent not in de rog at ion of of this act explanation for the purpose of,13
128,128,SECTIONS,this section the expression a electronic form shall have the same meaning a assign to it in clause r of sub section section of the information technology act of electronic record shall have the same meaning a assign to it in clause t of subsection of section of the information technology act of sensitive personal data or information shall have the same meaning a assign to it in clause of the explanation to section of the information tec act of,13
129,129,SECTIONS,alteration of demographic information or biometric information in case any demographic information of an aa dha ar number holder be found incorrect or change subsequently the aa dha ar number holder shall request the authority to alter such demographic information in his record in the central identity data repository in such manner a may be specify by in case any biometric information of aa dha ar number holder be lose or change subsequently for any reason the aa dha ar number holder shall request the authority to make,13
130,130,SECTIONS,necessary alteration in his record in the central identity data repository in such manner a may be specify by on receipt of any request under sub section or sub section the authority may if it is satisfied make such alteration a may be require in the record relate to such aa dha ar number holder and intimate such alter at ion to the concerned aa dha ar number no identity information in the central identity data repository shall be alter except in the manner provide in this act or r make in this behalf,13
131,131,SECTIONS,access to own information and record of request for authentication the authority shall maintain authentication record in such manner and for such period a may be specify every aa dha ar number holder shall be entitle to obtain his authentication record in such manner as may be specify by the authority shall not either by itself or through any entity under it control collect keep or maintain any information about the purpose of authentication,13
132,132,SECTIONS,disclosure of information in certain case nothing contain in sub section or subsection of section or sub section of section shall apply in respect of any disclosure of information include identity information or authentication record make pursuant to an or of a court not inferior to that of a district judge provided that no order by the court under this sub section shall be make without give an opportunity of hearing to the nothing contain in sub section or sub section,13
133,133,SECTIONS,of sect ion and clause b of sub sub section or sub section of section shall apply in respect of any disclosure of identity information or authentication record make in the interest of national security an ce of a direction of an officer not below the rank of joint secretary to the government of in di a specially a ut ho rise in this behalf by an order of the central government provided that every direction issue under this sub section shall be review by an oversight committee,13
134,134,SECTIONS,consist of the cabinet secretary and the secretary to the government of in the department of legal affair and the department of electronics and information technology before effect provided far that any direction issue under this sub section shall be valid for a period of from the date of it issue which may be extend for a far period of three month after the review by the oversight committee chapter and penalty,13
135,135,SECTIONS,penalty for impersonation at time of enrolment whoever imp er so nates or attempt to impersonate another person whether dead or alive real or imaginary by provide any false demographic information or biometric information shall be punishable with for a term which may extend to three year or with a fine which may extend to ten thousand rupee or with both,14
136,136,SECTIONS,penalty for impersonation of aa dha ar number holder by change demographic information or biometric information whoever with the intention of cause harm or mischief to a naa dha ar number holder or with the intention of appropriate the identity of an aa dha ar number holder chang es or attempt to change any demographic information or biometric information of an aa dha ar number hold er by impersonate or attempt to impersonate another person dead or alive real or imaginary shall be punishable with imprisonment for a term which may extend to three year and shall also be liable to a fine which may extend to ten thousand rupee,14
137,137,SECTIONS,penalty for impersonation whoever not be a ut ho rise to collect identity information under the provision of this act by word conduct or demean our pretend that he be a ut ho rise to do so shall be punishable with imprisonment for a term which ma y extend to three year or with a fine which may extend to ten thousand rupee or in the case of a company with a fine which may extend t o one or with both,14
138,138,SECTIONS,penalty for disclose identity information whoever intentionally or otherwise dis semi nates any identity information collect in the course of enrolment or authentication to any person not a ut ho rise under this act or regulation make thereunder or in contravention of any agreement or arrangement enter into pursuant to the provision of this act shall be punishable with imprisonment for a term which may extend to three year or with a fine which may extend to ten thousand rupee or in the case of a company with a fine which may extend t o one or with both,14
139,139,SECTIONS,penalty for access to the central identity data repository whoever not being a ut ho rise by the authority intentionally a access or se cur es access to the central identity data copy or extract any data from the central identity data repository or store din any removable storage or cause to be introduce any virus or other computer contaminant in the central id en titi es data damage or c a u to be damage the data in the central identity data,14
140,140,SECTIONS,repositor ye or cause disruption of the access to the central identity data de ni es or cause a denial of access to any person who be a ut ho rise to access the central id en titi es data any information in contravention of sub section of section or share us information in contravention of section or assist any person in any of the a forementioned act sh delete s or alt ers any information store in any removable storage medium or in the central identity data,14
141,141,SECTIONS,repository or diminish es it value or utility or affect it injuriously by steal or alt ers or cause any person to st conceal destroy or alter any computer source code use by the authority with an intention to cause damage shall be punishable with imprisonment for a term which may extend to three year and shall also be liable to a fine which shall not be less than ten rupee sex planation for the purpose of this section the expression computer contaminant computer virus and damage,14
142,142,SECTIONS,shall have the meaning respectively assign to them in the explanation to section of the information technology act of and the expression computer source code shall have the meaning assign to it in the explanation to section of the say act,14
143,143,SECTIONS,penalty for tamper with data in central identity data repository whoever not by the authority us or tamper with the data in the central identity data repository or in any removable storage medium with the intent of modify information relate to aa dha ar number holder or discover any information thereof shall be punishable with imprisonment for a term which may extend to three year and shall also be liable to a fine which may extend to ten thousand rupee,15
144,144,SECTIONS,penalty for use by request entity whoever be a request entity us es the identity information of an individual in contravention of sub section of section shall be punishable with prisonment which may extend to three year or with a fine which may extend to ten thousand rupee or in the case of a company with a fine which may extend t o one rupee or with both,15
145,145,SECTIONS,penalty for non compliance with intimation requirement whoever be an en rolling agency or a request entity to comply with the requirement of sub section of section or subsection of section shall be punishable with imprisonment which may extend to one year or wi tha fine which may extend to ten thousand rupee or in the case of a company with a fine which may extend t o one rupee or with both,15
146,146,SECTIONS,general penalty whoever an of fence under this act or any rule or regulation made thereunder for no specific penalty be provide elsewhere than this section shall be punishable with imprisonment for a term which may extend to one year or with a fine which may extend to twenty five thousand rupee or in the case of a company with a fine which may extend to one rupee or with both,15
147,147,SECTIONS,of fence by company where an of fence under this act have be commit by a company every person who at the time the of fence be commit be in charge of and be responsible to the company for the conduct of the business of the company a well a the company shall be be guilty of the of fence and shall be liable to be proceed against and punish accordingly provided that nothing contain in this sub section shall render any such on liable to any punishment provide in this act if he prof that the of fence,15
148,148,SECTIONS,be commit without his knowledge or that he have exercise all due diligence to prevent the commission of such notwithstanding anything contain in sub section where any of fence under this act have been commit ted by a company and it be prove that the of fence have be commit with the consent or connivance of or be attributable to any neglect on the part of any director manager secretary or other officer of the company such director manager secretary or other officer shall also be deem to be guilty of the of fence,15
149,149,SECTIONS,and shall be liable to be proceed against and punish accordingly explanation for the purpose of this section a company mean any body corporate and include a firm or other association of director in relation to a fir m mean a partner in the,15
150,150,SECTIONS,act to apply for of fence or contravention commit outside subject to of sub section the provision of this act shall apply also to any of fence or contravention commit ted outside by any person irrespective of his for the purpose of sub section the provision of this act shall ly to any of fence or contravention commit outside by any person if the act or conduct constitute the of fence or contravention any data in the central id en titi e data repository,16
151,151,SECTIONS,power to investigate of fence notwithstanding contain in the code of criminal procedure of a police officer not below the rank of inspector of police shall ate any of fence under this act,16
152,152,SECTIONS,penalty not to interfere with other punishment no penalty impose under this act shall prevent the imposition of any other penalty or punishment under any other l aw for the time be in force,16
153,153,SECTIONS,cognizance of of fence no court shall take cognizance of any of fence punishable under this act save on a complaint make by the authority or any officer or person a ut ho rise by no court inferior to that of a chief metropolitan magistrate or a chief judicial magistrate shall try any off en ce punishable under this act chapter,16
154,154,SECTIONS,power of central government to supersede authority if at any time the central government be of the opinion a that on account of circumstance beyond the control of the authority it be unable to discharge the function or perform the duty impose on it by or under the provision of this act orb that the authority have persistently default in comply with any direction give by the central government under this act or in the discharge of the function or performance of the on it by or under the pro vision,16
155,155,SECTIONS,of this act and a a result of such default the financial position of the authority or the administration of the authority have suffer orc that a public emergency exist st he central government may by notification supersede the authority for such period not exceed a may be specify in the notification and appoint a person or person a the president may direct to exercise power and discharge function under this act provided that before issue any such notification the c government shall give a,16
156,156,SECTIONS,reasonable opportunity to the authority to make representation against the propose supersession and shall consider the representation if any of the upon the publication of a notification under sub section supersede the authority a the chair person and other member shall a from the date of supersession vacate a all the power function and duty which may by or under the provision of this act or dis cha by or on behalf of the authority shall until the authority be,16
157,157,SECTIONS,reconstitute dunder sub section be exercise and discharge by the person or person refer to in subsection all property own or control by the authority shall until the authority be reconstitute dunder sub section vest in the central on or before the expiration of the period of supersession specify in the notification issue under subsection the central government shall reconstitute the authority by a fresh appointment of its chair person and other member and in such case any person,16
158,158,SECTIONS,who have vacate his office under clause a of sub section shall not be deem to be disqualify for the centrum l government shall cause a copy of the notification issue under sub section and a full report of any action take under this section and the circumstance lead to such action to be laid before each house of parliament at the early,16
159,159,SECTIONS,member officer to be public servant the chair person member officer and of the authority shall be deem while act or purport to act in pursuance of any of of this act to be public servant within the meaning of section of the in dian penal code of,17
160,160,SECTIONS,power of central government to issue direction without prejudice to the of this act the authority shall in exercise of it power or the performance of it function sunder this act be bound by such direction on question of policy a the central government may give in write to it from time to time provided that the authority shall a far a a c ti cable be give an opportunity to express it any direction be give under this sub section provided far that nothing in this section shall,17
161,161,SECTIONS,empower the central government to issue di recti ons pertain to technical or administrative m under taken by the the decision of the central government whether a question be one of policy or not shall be final,17
162,162,SECTIONS,delegation the authority may by general or special order in write delegate to any member officer of the authority or any other person subject to such condition if any a may in the order such of it power and function under this act except the power under sect io n it may deem necessary,17
163,163,SECTIONS,protection of action take in good faith no suit prosecution or other legal proceed shall lie against the central government or the authority or the chair person or any member or any officer or other employee of the authority for anything which be in good faith do or intend to be do under this act or the rule or regulation make thereunder,17
164,164,SECTIONS,power of central government to make rule the central government may by notification make rule to carry out the provision of this in particular and without prejudice to the generality of the forego power such rule may provide for all or any of the follow matter namely a the form and manner in which and the authority before whom the oath of office and of secrecy is to be by the chair person and member under sub section of section the salary and allowance payable to and other term,17
165,165,SECTIONS,and condition of service of the chair person and the allowance or remuneration payable to member of the authority under subsection of section the other power and function of the chair person of the authority under section the other power and function of the authority under clause t of sub section of section the form of annual statement of to be prepared by authority under sub section of section the form and the manner in which and the time within which return and statement,17
166,166,SECTIONS,be to be furnish under sub section of section the form and the manner and the time at which the authority shall furnish annual report under subsection of section any other matter which be require to be or may be or in respect of which provision be to b e or may be make by,17
167,167,SECTIONS,power o f authority to make regulation the authority may by notification make regula ti ons consistent with this act and the rule make thereunder for carry out the provision of in particular and without prejudice to the generality of the forego power such regulation may provide for all or any of the follow matter namely a the biometric information under clause g and the demographic information under clause the process of collect demographic information and biometric information from,18
168,168,SECTIONS,by enrol agency under clause m of section the manner of verify the demographic information and biometric information for issue of aa dha ar number under sub section of section the con dit ion for accept an aa dha ar number a proof of identity of the aa dha ar number holder under sub section of section the other category of individual under section for whom the authority shall take special me a sures for allotment of aa dha ar n um bere the manner of update biometric information and,18
169,169,SECTIONS,demographic information under section the procedure for authentication of the aa dha ar number under section the other function to be perform by the central id en tit y data repository under section the time and place of meeting of the authority and the procedure for transaction of business to be follow by it include the quorum under sub section of section the salary and allowance payable to and other term and condition of service of the chief executive officer officer and other employee of the,18
