,Unnamed: 0,Title,Paragraph Text,Page No
0,0,SECTIONS,short title extent and commencement,1
1,1,SECTIONS,de fi ni ti ons chapter fund regulatory and authority,1
2,2,SECTIONS,establishment and incorporation of authority,1
3,3,SECTIONS,composition of authority,1
4,4,SECTIONS,term of office and condition of service of chair person and member of authority,1
5,5,SECTIONS,removal of member from office,1
6,6,SECTIONS,restriction on future employment of member,1
7,7,SECTIONS,administrative power of chair person,1
8,8,SECTIONS,meeting of authority,1
9,9,SECTIONS,vacancy not to invalidate proceed s of authority,1
10,10,SECTIONS,officer and employee of authority chapter and application,1
11,11,SECTIONS,extent and application chap te r of asset liability of inter pension fund regulatory and development,1
12,12,SECTIONS,transfer of asset liability of interim pension fund regulatory and development authority chapter power and function of authority,1
13,13,SECTIONS,duty power and function of authority,1
14,14,SECTIONS,power to issue direction,1
15,15,SECTIONS,power of investigation,1
16,16,SECTIONS,search and seizure,1
17,17,SECTIONS,power of authority to ensure,1
18,18,SECTIONS,management by administrator chapter v in at ion al pension system,2
19,19,SECTIONS,national pension system,2
20,20,SECTIONS,central record keeping agency,2
21,21,SECTIONS,point of presence,2
22,22,SECTIONS,pension fund,2
23,23,SECTIONS,certain restriction on foreign company or individual or association of person,2
24,24,SECTIONS,prohibition of investment of fund of subscriber outside,2
25,25,SECTIONS,eligibility norm of the central record keep in g agency of intermediary,2
26,26,SECTIONS,registration of central record keep agency pension fund point of presence and adjudication,2
27,27,SECTIONS,penalty for failure by an intermediary or any other person to comply with provision of this regulation and direction,2
28,28,SECTIONS,credit sum rea lis by way of penalty to subscriber education and protection fund,2
29,29,SECTIONS,power to adjudicate,2
30,30,SECTIONS,attachment of asset and supersession of management of intermediary,2
31,31,SECTIONS,of fence,2
32,32,SECTIONS,power to grant immunity,2
33,33,SECTIONS,exemption from tax on wealth income profit and gain,2
34,34,SECTIONS,cognizance of of fence by court,2
35,35,SECTIONS,appeal to security appellate tribunal,2
36,36,SECTIONS,civil court not to have on,2
37,37,SECTIONS,appeal to supreme court chapter account and audit,2
38,38,SECTIONS,grant by central government,2
39,39,SECTIONS,constitution of pension regulatory and development fund,2
40,40,SECTIONS,constitution of subscriber education and protection fund,2
41,41,SECTIONS,account and x,2
42,42,SECTIONS,power of central government to issue direction,3
43,43,SECTIONS,power of central government to supersede authority,3
44,44,SECTIONS,establishment of pension advisory committee,3
45,45,SECTIONS,furnish of return to central government,3
46,46,SECTIONS,member officer and employee of authority to be public servant,3
47,47,SECTIONS,protection of action take in good faith,3
48,48,SECTIONS,delegation of power,3
49,49,SECTIONS,of fence by company,3
50,50,SECTIONS,power to make rule,3
51,51,SECTIONS,power to make regulation,3
52,52,SECTIONS,rule and regulation to be laid before parliament,3
53,53,SECTIONS,power to remove difficulty,3
54,54,SECTIONS,at ion of other law not bar,3
55,55,SECTIONS,pension fund regulatory and development authority act no of sept ember an act to provide for the establishment of an authority to promote old age income security by establish ing develop and regulate pension fund to protect the interest of scheme of pension fund and for matter connect therewith or incidental there tobe it enact by parliament in the sixty fourth year of the republic of in a follow chapter i,3
56,56,SECTIONS,short title extent and commencement this act may be call the pension fund re gul a tory and development authority act it to the whole of it shall come into force on such a the central government may by notification in the official gazette appoint provided tha t different date may be a p po in ted for different provision of this act and any reference in any such provision to the commencement of this act shall be construe a a reference to the coming into force of that provision,4
57,57,SECTIONS,definition in this act unless the context otherwise require a a mean the pension fund re gul a tory and development authority established under sub section of section central record keeping agency m an agency register under section to perform of record keeping accounting administration and customer ice for subscriber chair person mean th e chair person of the document shall include any matter en express or upon any substance,4
58,58,SECTIONS,of letter figure or mark s or by more than one of those mean in print or in electronic version which be in te to be use or which may be use by the interim pension fund regulator development authority or authority or an intermediary or any other entity conn with the national pension system for the pu of record that matte re individual pension account mean an of a subscriber execute by a contract setting out the term and condition er the national pension interim,4
59,59,SECTIONS,pension fund regulatory and development authority mean the interim pension fund regulatory and development authority set up by the central government through f no date the and f no date the intermediary include pension fund central record keeping agency national pension system trust p en sion fund adviser retirement adviser point of presence and such other person or entity connected with collection management record keeping and distribution of la ti ons,4
60,60,SECTIONS,notification no so e date st see gazette of extraordinary part member mean a member of the author it y and include it chair per so ni national pension system mean the pension system refer to in section contribution from a subscribe r be collect and accumulate in an individual pension account use a system o f point of presence a central record keeping agency and pension fund as may be specify by,4
61,61,SECTIONS,national pension system t mean the board of trustee who hold the asset for their notification mean a notification pub li shed in the official pension fund mean an intermediary which ha s be grant a certificate of registration under sub section of section by the authority a a pension fund for receive contribution sac cum ula ting them and ma kin g payment to the subscriber in the manner a m ay be specify pension regulatory and development fund mean the,4
62,62,SECTIONS,fund constitute under subsection of section point of presence mean an inter me di ar y register with the author it y under sub section section a a point of sence and capable of electronic connectivity with the central record keeping agency r the purpose of receive and transmit fund and instruction and pay out of fund so mean scribe d by rule make under this regulate asset mean the asset an d property both tangible and intangible own lease dor de velo ped by and,4
63,63,SECTIONS,other right b el on ging to the central record keeping regulation mean the re gul at io n make b y the authority under this scheme mean a scheme of pension fund approve by the authority under this act security appellate tribunal mean a security appellate tribunal establish under subsection of section of th e security and exchange board of act of t subscriber include a person who to a scheme of a pension subscriber education and protection fund,4
64,64,SECTIONS,mean the fund constitute under sub section section trustee bank mean a banking a define in the banking regulation act of word and expression use and not define in this act but define in i the insurance act of the company act of the security contra regulation act of an div the security and hange board of act of shall have the meaning respectively assign to them under those fund regulatory and development authority,4
65,65,SECTIONS,establishment and incorporation o f authority effect from such date a the central government may by notification appoint there shall be establish for the purpose of this act an authority to be call the pension fund re gul a tory and development the authority shall be a body corporate by the n ame aforesaid have perpetual succession and a common seal with power subject to the provision of this act to e hold and dispose of property both movable and immovable an d to contract and shall by the,5
66,66,SECTIONS,say name sue or be the head office of the authority shall be in the na ti on al capital region refer to in clause f of section of the national ca pi tal r board act of authority may establish of fice at other place in,5
67,67,SECTIONS,composition of authority the authority shall consist of the follow member namely a a three whole time member three part time be appoint by the central government from amongst of ability integrity and stand knowledge and experience in or finance or law with at least one person from each discipline,6
68,68,SECTIONS,term of office and condition of service of chair person and member of authority the chair person and every whole time member shall hold office for a term of five year from the date on which he upon his office and shall be eligible for reappoint me that no person shall hold office a a er son after he have attain the age of sixty far that no p er son shall hold office a a whole time member after he have attain the age of sixty two a part time member shall hold office a,6
69,69,SECTIONS,such for a m not exceed five year from the date on which he upon his salary and allowance payable to and other term and condition of service of the member sot her than part time member sh al l be such a may be part time member shall receive such a a may be salary allowance and other condition of s er vice of a member shall not be varied to his disadvantage after his notwithstanding anything contain in sub section or sub section a,6
70,70,SECTIONS,member may a relinquish his office by give in write to t he central government a notice of not less than thirty day orb be remove from his office in accordance wi th the provision o f section,6
71,71,SECTIONS,removal of member from office the central government may remove from of fi ce the chair person or any other member whoa be or at any time have be adjudge a insolvent orb have become physically or mentally in ca of act a a member orc have be convict of an of fence which in the opinion of the central govern men t turpitude have acquire such financial or other interest a be likely to affect prejudicially his function a sa member ore have in the opinion of the central govern men t so,6
72,72,SECTIONS,abuse his position a to render his continuance in office detrimental to the public no such chair person or other member shall be remove under clause d or clause e of subsection unless he have be give a e opportunity of be in the,6
73,73,SECTIONS,restriction on future employment of member the chair person and the whole shall not for a period of two year from the date on which they cease to hold office a such except with the previous approval of the central government accept a any employment either under the centrum l government or under any state government orb any appointment in any regulate entity in the pension the chair person and the whole time member of the interim fund regulatory and development authority hold in g the,7
74,74,SECTIONS,office a such before the commencement of this act shall not on and after such commencement accept any appointment in any re gul at entity in the pension sector for a period of two year from t he date on which they cease to hold office a such except wi th the previous approval of the central government,7
75,75,SECTIONS,administrative power of chair per so chair person shall have the power of general superintendence and direction in respect of all matter of the authority,7
76,76,SECTIONS,meeting s of authority the authority shall meet at such time and e and shall observe such rule of procedure in regard to the transaction of business at it s meeting include quorum at a may be provide by the chair person or if for any reason he be un able to attend a meeting of the authority any other member chosen by the member sent from amongst them se at the meeting shall preside at all question which come up before any meeting of the authority shall be decide,7
77,77,SECTIONS,by a majority of vote by the member present and voting and in the event of an equality of vote the chair person or i absence the person preside shall have a second or cast if any member who be a director of a company an d who a such director have any direct or indirect pecuniary interest in any matter come up r consideration at a meeting of the authority he shall as soon a possible after relevant circumstance have come to his knowledge disclose the nature of his interest at such and such disclosure,7
78,78,SECTIONS,shall be record in the proceeding of the authority and the member shall not take part in any deliberation or decision of the authority with respect to that matter,7
79,79,SECTIONS,vacancy not to invalidate proceeding of authority no act or proceed of the authority shall be invalid merely by reason of a any vacancy in or any defect in the constitution of the authority orb any defect in the appointment of a person actin g a a member of the authority orc any irregularity in the procedure of the author not affect the merit of the case,7
80,80,SECTIONS,officer and employee of authority authority may appoint such officer and a it necessary for the efficient discharge of it function under this the term and other condition of service of officer and other employee of the author it yap pointed under sub section shall be such a may be determine by regula ti ons chapter and application,7
81,81,SECTIONS,extent and application this act shall apply to a the national pension any other pension scheme not re gula ted by any other every pension scheme refer to in clause b shall conform to the regulation make by the authority within such time a may be specify in the notwithstanding anything contain in sub section the provision of this act shall not apply toa the scheme or fund under i the coal mine provident fund and miscellaneous provision act of,7
82,82,SECTIONS,the employee provident fund and miscellaneous provision act o f the seaman s provident fund act of the as sam tea plantation provide fund and pension fund scheme act as sam act x of the jam mu and ka sh mir employee provident fund act jam mu and ka sh mir act of b contract refer to in sub section of section of the insurance act of c any other pension scheme which the central g may by notification,7
83,83,SECTIONS,exempt om the application of this act d person appoint before the day of janua to public service in connection with the affair of the union or to all service constitute under section of th e all act of e person appoint to pub service in con with the affair of any state or such a may be specify by notification by the central notwithstanding anything contain in sub section any state government or administrator,7
84,84,SECTIONS,union territory may by notification extend the national pension m to it notwithstanding anything contain in clause c of sub section the central government may by notification extend the application o f this act to any other pen si on scheme include any other pension scheme exempt and notify under clause c of sub section any person govern under any of the scheme or f refer to in sub section may at his option also jo in the national pension system chap of asset liability of interim pension fund regulatory and development authority,7
85,85,SECTIONS,transfer of asset liability of interim pension fund regulatory and development authority on and from the date of establishment of the pension fund regulatory and development authority a all the asset and liability of the in te rim pension fund regulatory and development authority shall stand transfer to and in the authority explanation the asset of the in te rim pen sion fund regulatory and development authority shall be deem to include all rig and power all property whether movable or,8
86,86,SECTIONS,in par ticul ar cash balance deposit and all other interest and right in or arise out of such property a may be in the possession of the interim pension fund regulator y and development authority and all book of account and other document relate to the same and liability shall to include all debt liability an d obligation of whatever without prejudice to the provision of clause a all debt obligation and liability incur red all contract enter into and all m and,8
87,87,SECTIONS,thing engage to be do by with or for the interim pension fund re gul a tory and authority immediately before that day for or in connection with the purpose of the say regulatory authority shall be deem to have be incur re den te red into or engage to be do by with or for the all sum of money due to the in te rim pension fund regulatory and development authority immediately before that day shall be deem to b e due to the authority all suit and other legal proceeding in st or which could,8
88,88,SECTIONS,have be institute by or against the interim pension fund regulatory and development authority immediately before that day may be continued or may be in st it ut by or against the authority chapter power and function of authority,8
89,89,SECTIONS,duty power and function of authority subject to the provision of this act and any other law for the time be in force the authority shall have the duty to regulate promote and ensure orderly grow th of the national pension system and pension scheme to which this act a p plies and to protect the interest of subscriber of such system and without prejudice to the generality of the provision contain in sub section the power of the authority shall include a regulate the national pension,9
90,90,SECTIONS,system a the pension scheme to which this act approve the scheme the term and con di ti ons thereof and lay down norm for the management of the corpus of the pen ion fund include investment guideline under such register and regulate issue to an intermediary on application a certificate of registration and re newing modify ing withdraw suspend or cancel such re gist ratio ne protect the interest of subscriber by i ensure sa fet y of the contribution of,9
91,91,SECTIONS,subscriber to various scheme of pension fund to which this act ensure that the intermediation and her operational cost under the national pension system be economical and establish mechanism for redressal of grievance of subscriber to be determine promote professional or organ is at ion connect with the pension adjudication of dispute between inter media and between e and subscriber si collect data and require the to collect,9
92,92,SECTIONS,such data and undertaking and commission ing s tu di es research and undertaking step for educate subscriber a the general public on issue relate to pension retirement saving and related issue and training of stand ar di se dissemination of inform a ti on about performance of pension fund and performance regulate the regulate levy fee o r other charge for carry out the purpose of this specify by regulation the form and m ann er in which book of account,9
93,93,SECTIONS,shall be main tai ne dand statement of account shall be render by inter media rie so call for information from unde of conduct inquiry include audit of intermediary and other entity or organ is at ion connect with pension exercise such other power and function a may be notwithstanding any thing contain in any other law for the time be in force while power under clause o of sub section the authority shall have the same power,9
94,94,SECTIONS,a be in a civil court under the code of civil procedure of while try a suit in respect of the following matter namely i the discovery and production of book of account and other document at such place and at such time a may be specify by the summon and enforce the attendance of per so n and examine them on inspection of any book register and other document of any person or intermediary refer red to in section at any issue commission for the ex a mina ti on,9
95,95,SECTIONS,of witness or any other er which may be without prejudice to the provision contain in sub section and and section the authority may by order for reason to be re cor in write in the interest of subscriber take any of the follow measure pending investigation or inquiry namely i restrain person from participate in any restrain any office bearer of an in from act a impound and retain the proceeds under the heme in respect of,9
96,96,SECTIONS,any act which is under attach after passing an order on an at ion make for approval by the judicial magistrate of first class have jurisdiction for a period not exceed one month one or more bank account or account of any i or any person associate with the scheme in any manner involve in lation of any of the provision of this act or the rule or the regulation sma de thereunder provided that only the bank account or or any transaction enter therein relate to the proceeds,9
97,97,SECTIONS,actually involve in the lation of any of the provision of this act or the rule or the regulation make th ere under shall be allow to be direct any intermediary or any person a with the scheme in any manner not to dispose of or alienate an asset formin g part of any activity which be under investigation provided that the authority shall either before or after passing such order under this section give to such intermediary or person con ce an opportunity of be,9
98,98,SECTIONS,power to issue direction save a otherwise provide in section if after ma king or causing to be make an inquiry the authority be satisfied that it be necessary i in the interest of subscriber or orderly development of national pension system or a pension scheme to which this act a p plies to prevent the affair of any intermediary or er person or entity refer to insection be conduct in a manner detrimental t o the of subscriber to secure the proper management of any such,10
99,99,SECTIONS,intermediary or person or entity it may issue such direction to such intermediary or en titi e or to any person or class of person refer red to in section or associate with the pension fund a it may deem fit provided that the authority shall either before or aft er passing such order give an opportunity of being to such intermediary entity or person concerned,10
100,100,SECTIONS,power of investigation where the authority have a reasonable ground to believe that a the activity of the pension fund be be conduct in a manner detrimental to the interest of the subscriber any intermediary or any person associate with the scheme of the pension fund have viola ted any of the provision of this act or th e rule or the regulation make or direction issue by the authority thereunder it may at any time by order in write direct any person here a f in this section refer to a the investigating,10
101,101,SECTIONS,authority specify in the order to investigate the affair of such intermediary or per sons associated with the pension fu and to report thereon to the without prejudice to the provision contain in sec ti ons to of the company of it shall be the duty of every manager manage tor officer and other employee of the company in case of a company and every intermediary o r person or entity refer to in section or every person associate wit h the pension fund to preserve and to,10
102,102,SECTIONS,produce to the investigate authority or any person a ut ho rise by him in this behalf all the book register other document and record of or re la ting to the company or a the case may be of or relate to the intermediary or such person hare in their custody or the investigate authority may require any intermediary or any person or entity associate with the pension fund in any manner to furnish such information to or produce such book or or record before him or any person a ut ho rise by him in,10
103,103,SECTIONS,this behalf a he may consider necessary if the furnish of such information or the production of such book or register or or record be relevant or necessary r the purpose of it the investigate authority may keep in it any book register other document and record produce under sub section or sub section for six month and thereafter shall return the same to any intermediary or any p er son associate or entity with the pension fund by whom or on whose behalf the book,10
104,104,SECTIONS,register other document and record be produced provided that the investigate authority may cal l for any book register other document and r they be require again provided far that if the person on whose alf the book register other document and record are produce require certify copy of the book register other document or record produce before the gate authority it shall give certify copy of such book register other document or as the case may be record to such person or on whose,10
105,105,SECTIONS,behalf the book register other document and record be any person direct to make an under sub section may ex amine on oath any intermediary or any person associate with the pension fund in any manner in relation to the affair of his business and may administer a n oath accordingly and for that purpose may require any of th ose person to appear before him personally note of any examination under sub section sha be take down in write and shall be rea dover to or by and sign by,10
