,Unnamed: 0,Title,Paragraph Text,Page No
504,504,SECTIONS,assessment of non filer of return notwithstanding anything to the contrary contain insection or section where a register person to furnish the return under section or section even after the service of a notice under section the proper officer may proceed to ass the tax liability of the say person to the best of his judgment take into account all the relevant material which be available or which he have gather and i an assessment order within a period of five year from the date spec if ie dunder,52
505,505,SECTIONS,section for furnish of the annual return for the financial year to which the tax not pa id where the register person furnish es a valid return within th day of the service of the assessment order under sub section the say assessment order shall be deem to have been withdrawn but the liability for payment of interest under sub section of section or for payment of late fee under section shall continue,52
506,506,SECTIONS,assessment of unregistered person notwithstanding anything to the contrary contain insection or section where a taxable person to obtain registration even though liable to do so or whose registration have be can ce under sub section of section but who be liable to pay tax the proper officer may proceed to ass the tax liability of such taxable person to the best of his judgment for the relevant tax period and issue an assessment order within a period of five year from the under section,52
507,507,SECTIONS,for furnish of the annual return for the financial year to which the tax not pa id rel ates provided that no such assessment order shall be pass without give the person an opportunity of being h,52
508,508,SECTIONS,summary assessment in certain special case the proper officer may on any evidence showing a tax liability of a person come to his notice with the previous permission of additional commissioner or joint commissioner proceed to ass t he tax liability of such person to protect the interest of revenue and issue an assessment order if he have sufficient ground to believe that any delay in doing so may adversely affect the interest of revenue provided that where the taxable person to who m the liability be not ascertainable,52
509,509,SECTIONS,and such liability to supply of good the person in charge of such good shall be deem to be the taxable person liable to be assess and liable to pay tax and any other amount due under this sect io on an application make by the taxable person within thirty day from the date of receipt of under sub section or on his own motion if the additional commissioner or joint commissioner that such order be erroneous he may withdraw such order and follow the procedure laid down in section or section,52
510,510,SECTIONS,audit by tax authority the commissioner or any officer a ut ho rise by him by way of a general or a specific order may undertake audit of any register person for such period at such frequency and in such manner a may be the officer refer to in sub section may conduct audit at the place of bus in ess of the registered person or in their the register person shall be inform by way of a notice not less than fifteen work days prior to the conduct of audit in such manner a may be,52
511,511,SECTIONS,the audit under sub section sh al l be complete within a period of three month from the date of commencement of the audit provided that where the commissioner be satisfied that audit in respect of such register person cannot be complete within three month he may for the reason to be record in write extend the period by a far period not exceed six month sex planation for the purpose of this sub section the expression commencement of audit shall mean the date on which the record and other document,52
512,512,SECTIONS,call for by the tax authority be made available by the register person or the actual institution of audit at the place of business whichever during the course of audit the a ut ho rise officer may require the register person i to afford him t he necessary facility to verify the book of account or other document a he may to furnish such information a he may require and render assistance for timely completion of the on conclusion of audit the proper officer shall wi thin thirty day inform,52
513,513,SECTIONS,the register person whose record be audit about the finding his right and obligation and the reason for such where the audit conduct under sub section result in detection of tax not pa id or short p ai dor erroneously refund or input tax credit wrongly avail or the proper officer may initiate action under section or section,52
514,514,SECTIONS,special audit if at any stage of scrutiny inquiry investigation or any other proceeding before him any officer not below the rank of assistant commissioner have regard to the nature and complexity of the case and the interest of revenue be of the opinion that the value have not be correctly declare or the credit a v ai led be not within the nor mal limit he may with the prior approval of the commissioner direct such registered person by a communication in write to get his record include book of account examine,53
515,515,SECTIONS,and a u di ted by a charter accountant or a cost accountant a may be no mi nat by the the charter accountant or cost accountant so nominate shall within the period of ninety days submit a report of such audit duly sign and certify by him to the say assistant commissioner mention ing therein such other pa a may be that the assistant commissioner may on an application make to him in this behalf by the registered person or the charter accountant or cost accountant or for any material and,53
516,516,SECTIONS,sufficient reason extend the say per by a far period of ninety the provision of sub section shall have effect notwithstanding that the account of the registered person have be audit under any other provision of this act or any other law for the time being in force the register person shall be give an opportunity of be in respect of any material ga the red on the basis of special audit under sub section which be propose to be use in any proceeding sa gainst him under this act or the rule make,53
517,517,SECTIONS,the expense of the examination and audit of record under sub section include the remuneration of such charter accountant or cost accountant shall be determine and pa id by the commissioner and such determination shall be where the special audit conduct under sub section result in detection of tax not pa id or short pa id or erroneously refund or input tax credit wrongly avail or the proper officer may initiate action under section or section search seizure and arrest,53
518,518,SECTIONS,power of inspection search and seizure where the proper officer not below the rank of joint commissioner have reason to believe that a a taxable person have suppress any transaction relate to supply of good or service or both or the stock of good in hand or have input tax credit in excess of his entitlement under this act indulge in contravention of any of the provision of this act or the rule make thereunder to evade tax under this act orb any person engage in the business of transport good or an,53
519,519,SECTIONS,owner or operator of a warehouse or a godown or any other place be keep good which have escape payment of tax kept his account or good in such a manner a be likely to cause evasion of tax payable under may a ut ho rise in write any other officer of central tax to inspect any place of business of the taxable person or the person engage in the business of transport good or the own er or the operator of warehouse or godown or any other where the proper officer not below the rank of joint commissioner,53
520,520,SECTIONS,either pursuant to an inspection carried out under sub section or otherwise have reason to believe that any good to confiscation or any document or book or thing which in his opinion shall be useful for or relevant to any proceeding under this act be secrete in any place he may a ut ho rise in write any other officer of central tax to search and seize or may himself search and seize such good document or book or that where it be not practicable to seize any such good the proper officer or any,53
521,521,SECTIONS,by him may serve on the owner or the custodian of the good an order th at he shall not remove part with or otherwise deal with the good except with the previous permission of such officer provided far that the document or book or thing so seize shall be retain by such officer only for so long a may be necessary for their examination and for any inquiry or proceeding under this the document book or thing refer to in sub section or any other document book produce by a taxable,53
522,522,SECTIONS,person or any other person which have not be rely upon for the issue of notice under this act or the rule make thereunder shall be return to such person within a period not exceeding thirty day of the issue of the say the officer a ut ho rise under sub section shall have the power to seal or break open the door of or to break open any almirah electronic device box receptacle in which any good or document of the person be suspect to be conceal where access to such premise,53
523,523,SECTIONS,almirah electron device box or receptacle be the person from whose custody any document be seize under sub section shall be entitle to make copy thereof or take extract therefrom in the presence of an a ut ho rise officer at such place and time a such officer may indicate in this behalf except where make such copy or take such in the opinion of the proper officer prejudicially affect the the good so seize under sub section shall be release on a provisional basis,53
524,524,SECTIONS,upon execution of a bond and furnish of a security in such manner and of such quantum respectively as may be or on payment of applicable tax interest and penalty payable a the case may where any good be seize under sub section and no notice in respect thereof be give within six month of the seizure of the good the good shall be return to the person from whose possession they be that the period of six month may on sufficient cause be show be extend by the proper officer for a,53
525,525,SECTIONS,far period not exceed six the government may have regard to the perishable or hazardous nature of any goods depreciation in the value of the good with the passage of time constraint of storage space for the goods or any other relevant consideration by notification specify the good or class of good which shall as soon a may be after it seizure under sub section be dispose of by the officer in such manner as may be where any good be good specify under sub section have,53
526,526,SECTIONS,be seize by a proper officer or any officer a ut ho rise by him under sub section he shall prepare an inventory of such goods in such manner a may be the provision of the code of criminal procedure of relate to search and seizure shall so far a may be apply to search and seizure under this section subject to the modification that sub section of section of the say code shall have effect a if for the word magistrate wherever the word commissioner be,53
527,527,SECTIONS,where the proper officer have reason to believe that any person have evade or be attempt to evade the payment of any tax he may for reason to be record in write seize the account register of such person produce before him and shall grant a receipt for the same and shall retain the so long a may be necessary in ti on with any proceeding under this act or the rule made thereunder for the commissioner or an officer a ut ho rise by him may cause purchase of any good or both,53
528,528,SECTIONS,by any person a ut ho rise by him from the business premise of a taxable person to check the issue of tax invoice or bill of supply by such taxable person and on return of good so purchase by such officer such taxable person or any person in charge of the business premise shall refund the amount so pa id to war d the good after cancel any tax invoice or bill of supply issue ear lier,53
529,529,SECTIONS,inspection of good in movement the government may require the person in charge of a conveyance carry any consignment of good of value exceed such amount a ma y be specify to carry with him such document and such device a may be the detail of document require to be carry under sub section shall be validate in such manner a may be where any conveyance refer to in subsection be intercept by the proper officer at anyplace he may require the person in charge of the say,55
530,530,SECTIONS,conveyance to produce the document prescribe dunder the say sub section and device for verification and the say person shall be liable to produce and device and also allow the inspection of good,55
531,531,SECTIONS,power to arrest where the commissioner have reason to believe that a person any of fence specify in clause a or clause b or clause c or clause d of sub section of section which be punishable under clause i or of sub section or sub section of the said section he may by order a ut ho rise any officer of central tax to arrest such where a person be arrest under subsection for an of fence specify under sub section of section the officer a ut ho rise to,55
532,532,SECTIONS,arrest the person shall inform such person of the ground of arrest and produce him before a magistrate within twenty four subject to the p of the code of criminal procedure of a where a person be arrest under sub section for any of fence specify under subsection of section he shall be admit to bail or in default of bail forward to the custody of the in the case of a non cognizable and bailable of fence the deputy commissioner or the assistant commissioner shall,55
533,533,SECTIONS,for the purpose of release an arrest person on bail or otherwise have the same pow ers a be subject to the same provision a an officer in charge of a police station,55
534,534,SECTIONS,power to summon person to give evidence and produce document the proper officer under this act shall have power to summon any person whose attendance he necessary either to give evidence or to produce a document or any other thing in any inquiry in the same manner a provide din the case of a civil court under the provision of the code of civil procedure of every such inquiry refer re d to in sub section shall be deem to be a judicial proceeding swith in the meaning of section and section of the in dian penal code of,55
535,535,SECTIONS,access to business premise any officer under this act a ut ho rise by the proper officer not below the rank of joint commissioner shall have access to any place of business of a register person to inspect book of account document computer computer program computer soft ware whether in st al computer or her wise and such other thing a he may require and which may be available at such place for the purpose of carry out any audit scrutiny verification and check a may be necessary to safeguard the interest of,55
536,536,SECTIONS,every person in charge of place refer to in sub section shall on demand make available to the officer a ut ho rise under sub section or the audit party depute by the proper officer or a cost accountant or charter accountant nominate under section i such record a prepared or maintain by the register person and declare to the proper officer in such manner a may be trial balance or it statement of annual financial account duly audit wherever require div cost,55
537,537,SECTIONS,audit report if any under section of the company act of the income tax audit report if any under section of the income tax act of any other relevant record for the scrutiny by t he officer or audit party or the charter accountant or cost accountant within a period not exceed fifteen work day from the day when such demand be make or such far period as may be allow by the say officer or the audit party or the char te red accountant or cost accountant,55
538,538,SECTIONS,officer to assist proper officer all officer of police railway custom and engage in the collection of land revenue include village officer officer of state tax of union territory tax shall assist the proper officer in the implementation of this the government may by notification empower and require any other class of officer to assist the proper officer in the implementation of this act when call upon to do so by the commissioner chapter and recovery,56
539,539,SECTIONS,determination of tax not pa id or short pa id or erroneously refund or input tax credit wrongly avail or for any reason other than fraud or any misstatement or suppression of fact where it appear to the proper officer that any tax have not be pa id or short pa id or erroneously refund or where input tax credit have be wrongly avail or for any reason other than the reason of fraud or any misstate men t or suppression of fact to evade tax he shall serve notice on the person chargeable with tax,56
540,540,SECTIONS,which have not be so pa id or which have be so short pa id or to whom the refund have erroneously be make or who have wrongly avail or input tax dit require him to show cause a to why he should not pay the amount specify in the notice along with interest payable thereon under section and a penalty leviable under the provision of this act or the rule the proper officer shall issue the notice under sub section at least three month prior to the time limit specify in sub section for,56
541,541,SECTIONS,issuance of where a notice have be issue for any period under sub section the proper officer may statement contain the detail of tax not pa id or short pa id or erroneously refund or input tax credit wrongly avail or for such period other than those cover under sub section on the person chargeable with the service of s statement shall be deem to be service of notice on such person under subsection subject to the condition that the ground rely upon for such tax period,56
542,542,SECTIONS,other than those covered under sub section be the same a be mention in the ear lier the person chargeable with tax may before service of notice under sub section or a the case may be the statement under sub section pay the amount of tax along with interest payable thereon under section on the ba be of his own ascertainment of such tax or the tax a ascertain by the proper officer and inform the proper officer in write of such the proper officer on receipt of such information shall not,56
543,543,SECTIONS,serve any notice under sub section a the case may be the statement under sub section in respect of the tax so pa id or any penalty payable under the provision of this act or the rule make where the proper officer be of the opinion that the amount pa id under sub sect io n fall short of the amount actually payable he shall proceed to issue the notice a provide for in sub section in respect of such amount which fall short of the amount actually where any person chargeable with tax under,56
544,544,SECTIONS,sub section or sub section pay the say tax along with interest payable under section within thirty day of issue of show cause notice no penalty shall be payable and all proceeding in respect of the say notice shall be deem to be the proper officer shall after consider the representation if any make by person chargeable with tax determine the amount of tax interest and a penalty equivalent to ten per cent of tax or ten thousand rupee whichever be high due from such person and issue an,56
545,545,SECTIONS,the proper officer shall issue the order under sub section within three year from the due date for furnish of annual return for the financial year to which the tax not pa id or short pa id or input tax credit wrongly avail or rel ates to or within three year from the date of erroneous notwithstanding anything contain in sub section or sub section penalty under subsection shall be payable where any amount of self assess tax or any amount collect a tax ha snot be pa id within a period of thirty day from the due date of payment of such tax,56
546,546,SECTIONS,determination of tax not pa id or short pa id or erroneously refund or input tax credit wrongly avail or by reason of fra or any misstatement or suppression of fact it appear to the proper officer that any tax have not be pa id or short pa id or erroneously refund or where input tax credit have be wrongly avail or by reason of fraud or any misstatement or suppression of fact to evade tax he shall serve notice on the person chargeable with tax which have not been so pa id or which have,57
547,547,SECTIONS,be so short pa id or to whom the refund have erroneously be make or who avail or input tax credit require him to show cause a to why he should not pay the amount specify in the notice along with interest payable thereon under section and a penalty equivalent to the tax specify in the the proper officer shall issue the notice under sub section at least six mon th prior to the time limit specify in sub section for issuance of where a notice have be issue for any period,57
548,548,SECTIONS,under sub section the proper officer may statement contain the detail of tax not pa id or short pa id or neo us ly refund or input tax credit wrongly avail or for such period other than those cover under sub section on the person chargeable with the service of statement under sub section shall be deem to be service of notice under subsection of section subject to the condition that the ground rely upon in the say statement except the ground of fraud or any,57
549,549,SECTIONS,misstatement or suppression of fact to evade tax for period sot her than those cover u sub section be the same a be mention in the ear lier the person chargeable with tax may before service of notice under sub section pay the amount of tax along with interest payable under section and a penalty equivalent to fifteen per cent of such tax on the basis of his own ascertainment of such tax or the tax a ascertain by the proper office rand inform the proper officer in write of such the proper,57
550,550,SECTIONS,officer on receipt of such information shall not ser any notice under subsection in respect of the tax so pa id or any penalty payable under the provision of this act or make where the proper officer be of the opinion that the amount pa id under subsection fall short of the amount actually payable he shall proceed to issue the notice a provide for in sub section in respect of such amount which fall short of the amount actually where any person chargeable with tax under s,57
551,551,SECTIONS,pay the say tax along with interest payable under section and a penalty equivalent to twenty five per cent of such tax within thirty days of issue of the notice all proceeding in respect of the say notice shall be deem to be the proper officer shall after consider the representation if any make by the person chargeable with tax determine the amount of tax interest and penalty due from such person and issue the proper officer shall issue the er under sub section within a period of,57
552,552,SECTIONS,five year from the due date for furnish of annual return for the financial year to which the tax not pa id or short pa id or input tax credit wrongly avail or rel ates to or within five year from the date of where any person serve with an order issue under sub section pay the tax along with interest payable thereon under section and a penalty equivalent to fifty per cent of such tax day of communication of the order all proceeding in respect of the say notice shall be deem,57
553,553,SECTIONS,tobe the purpose of section and this section i the expression all proceeding in respect of the say notice shall not include proceeding sunder section where the notice under the same proceeding be issue to the main person liable to pay tax and some other person and such proceeding against the main person have be conclude under or section the proceeding a g ai all the person liable to pay penalty under section and be deem to be,57
554,554,SECTIONS,the purpose of this act the expression suppression shall mean non declaration of fact or information which a taxable person be require to declare in the return statement report or any other document furnish under this act or the rule make thereunder or failure to furnish any information on be ask for in write by the proper officer,57
555,555,SECTIONS,general provision re la tin g to determination of tax where the service of notice or issuance of order be stayed by an order of a court or appellate tribunal the period of such stay shall in compute the period specify in sub section and of section o r sub section of section a the case may where any appellate authority or appellate tribunal or court that the notice issue dunder sub section of section be not sustainable for the reason that the charge of fraud,58
556,556,SECTIONS,or any willful misstatement or suppression of fact to evade tax have not be establish against the person to whom the notice be issue the proper officer shall determine the tax payable by such person dee min gas if the notice be issue under sub section of section where any order be require to be issue in pursuance of the direction of the appellate authority or appellate tribunal or a court such order shall be issue within two year from the date of communication of the say di recti an opportunity of hearing shall,58
557,557,SECTIONS,be grant where a request be receive in write from the person chargeable with tax or penalty or where any adverse decision be contemplate against such the proper officer shall if sufficient cause i s show by the person chargeable with tax grant time to the say person and adjourn the hearing for reason to be record in writing provided that no such adjournment shall be grant for more than three time to a person during the proper officer in his order shall set out the relevant fact and the basis of,58
