,Unnamed: 0,Title,Paragraph Text,Page No
242,242,SECTIONS,special knowledge of the subject of the library science or library administration nominate by the executive one person not in the service of the university nominate by the executive council principal of college or by the university three person not in the service of t he university of whom two shall be nominate by the executive and one by the academic council for their special knowledge of or interest in a subject in which instruction be be provide by the college or institution note,26
243,243,SECTIONS,where the appointment be be make for an inter disciplinary project the head of the project shall be deem to be the head of the department concerned note the professor to be nominate by th e vice chancellor shall be a professor concerned with the speciality for which the selection be be make and the vice chancellor shall consult the head of the department and the dean of school before nominate the the vice chancellor or in his absence the pro vice chancellor shall convene and preside at the meeting of the,26
244,244,SECTIONS,selection committee provided that the meeting of the selection committee shall be fix after prior consultation with and subject to the convenience of visitor no mi nee and the expert in a ted by the executive council provide far that the proceeding of the selection shall not be valid unless a where the number of visitor nominee and the person nominate by the executive council is four in all at least three of them attend the meeting where the number of visitor nominee and the person nominate by the,26
245,245,SECTIONS,executive council is three in all at least two of them attend the the procedure to be follow by the selection committee shall be laid down in the if the executive council be unable to accept the recommendation make by the selection committee it shall record it reason and submit the case to the visitor for final appointment to temp orary post shall be make in the manner indicate below i if the temporary vacancy be for duration longer than one academic session it shall be fill on the advice,26
246,246,SECTIONS,of the on committee in accordance with the procedure in di cat in the that if the vice chancellor be satisfied that in the interest of work it be necessary to fill the vacancy the appointment may be make on a purely temporary basis on the advice of a local selection committee refer to in subclause for a period not exceed six if the temporary vacancy be for a period less than a year an appointment to such vacancy shall be make on the recommendation of a local selection committee,26
247,247,SECTIONS,consist of the dean of the school concerned the head of the department and a nominee of the vice chancellor provided that if the same person hold the office of the dean and the head of the department the selection committee may contain two nominee of the vice chancellor provided far that in th e case of sudden casual vacancy of teach post cause by death or any other reason th e dean may in consultation wit h the head of the department concerned make a temporary appointment for a month and report to the vice chancellor and,26
248,248,SECTIONS,the registrar a bout no teacher appoint temporarily shall if he be not recommend by a regular selection committee for a p pointment under the statute be continued in service on such temporary employment unless he be subsequently select by a local selection committee or a regular selection committee for a temporary or permanent appointment a the case may be,26
249,249,SECTIONS,special mo de of appointment not wi th standing anything contain in statute the executive council may invite a person of high academic distinction and professional attainment to accept a post of professor or associate professor or any other equivalent academic post in the university on such term and condition a it fit and on the person agree to do so appoint him to the post provided that the executive council may also create supernumerary post for a specify period for appointment of such per sons provided far that,28
250,250,SECTIONS,the number of supernumerary post so create should not exceed five per cent of the total post in the the executive council may appoint a teacher or any other academic staff work in any other university or organist ion for undertaking a joint project in accordance with the manner laid down in,28
251,251,SECTIONS,appointment for fix tenure the executive council may appoint a person select inaccordance with the procedure laid down in statute for a fix tenure on such term and condition a sit fit,28
252,252,SECTIONS,committee an authority of the university may appoint a many stand or special commit te es a it may deem fit and may appoint to such committee person who be not member of such a committee appoint under clause may deal with any subject delegate to it subject to subsequent confirmation by the authority a p point it,28
253,253,SECTIONS,term and condition of service and code of conduct of teacher all the teacher and other a cade staff of the university shall in the absence of any agreement to the contrary be the term and condition of service and code of conduct a be specify in the statute the ordinance sand the the emolument of member of the academic staff shall be such a may b e by every teacher and member of the academic staff of the university shall be appoint on a,28
254,254,SECTIONS,written contract the form of which shall b e by the a copy of every contract refer to in clause shall be deposit with the registrar,28
255,255,SECTIONS,term and condition of service and code of conduct of other employee all of the university other than the teacher and other academic staff shall in the absence of any contract to the contrary be govern by the term and condition of service and code of conduct a in the statute the ordinance and the the manner of appointment and emolument of employee other than the teacher and other academic staff shall be such a may b e by the ordinance,29
256,256,SECTIONS,seniority list whenever in accordance with the statute any person be to hold an office or be a member of an authority of the university by rotation accord to seniority such seniority shall be determined accord to the length of continuous service of such person in his grade and in accordance with such other principle a the executive council may from time to time it shall be the duty of the registrar to prepare and maintain in respect of each class of person to whom the provision of these tut es apply a,29
257,257,SECTIONS,complete and up to date seniority list in accordance w provision of clause if two or more person have equal length of continuous service in a particular grade or the relative seniority of any person or person in otherwise in doubt the registrar may on his own motion and shall at the request of any such person submit the matter to the executive council whose decision thereon shall be final,29
258,258,SECTIONS,removal of employee s of university where there be an allegation of misconduct against a teacher a member of the academic staff or other employee of the university the vice chancellor in the case of the teacher or a member of the academic staff and the authority competent to appoint herein a f to a the appoint authority in the case of other employee may by order in writ ing place such teacher member of the academic staff or other employee a the case may be under suspension and shall forthwith report to the,29
259,259,SECTIONS,executive council the circumstance in which the order be made provided that the executive council may if it be of the opinion that the circumstance of the case do not warrant the suspension of the teacher or a member of the academic staff rev such notwithstanding anything contain in the term of the contract of appointment or of any and condition s of service of the employee the executive council in respect of teacher and other academic staff and the appoint authority in respect of other employee shall,29
260,260,SECTIONS,have the power to remove a teacher or a member of the academic staff or o th er employee a the case ma y be on ground save a aforesaid the executive council or a the case may be the appoint authority shall not be entitle to remove any teacher member of the academic staff or other employee except f or a good cause and after give three month notice or on payment of three month salary in lieu no teacher member of the academic staff or other employee shall be remove under clause or clause,29
261,261,SECTIONS,unless he have be give a e opportunity of show cause against the action propose be take in regard to the removal of a teacher member of the academic staff or other employee shall take effect from the date on h the order of removal be made provided that where the teacher member of the academic staff or other employee be under suspension at the time o f his removal such removal shall take effect from the date on which he be place notwithstanding anything contain in the forego pro,29
262,262,SECTIONS,vision of this statute a teacher member of the academic or other employee may resign a if he be permanent employee only after give three month notice in write to the executive council or the appoint authority a the case may be or b y pay three month salar yin lieu if he be not a permanent employ only after give one month notice in write to the executive council or a the case may be the appoint authority or by pay one month salary in lieu thereof provide t hat such resignation shall take effect only on the date on which the resignation be accepted by the executive council or the appoint authority a the case may be,29
263,263,SECTIONS,honorary degree the executive council may on the recommendation of th e academic council and by a resolution pass by a majority of not less than two third of the member present and voting make proposal to the visitor for the conferment of honorary deg re es provided that in case of emergency the executive council may on it o motion make the executive council may by a resolution pass by a majority of not less than two third of present and voting withdraw with the previous sanction of the visitor any honorary by the university,30
264,264,SECTIONS,withdrawal of degree the executive council may by a resolution pass by a majority of not less than two third of the member present and voting withdraw a degree or academic on or any certificate or diploma grant to any person by the university for good and sufficient cause provided that no such resolution shall be pass until a notice in write have be give to that person calling upon him to show cause within such time a may be specify in the notice a to why such a resolution should not be pass and until his object ion if any and any evidence he may produce in support of them have be consider by the executive council,30
265,265,SECTIONS,maintenance of discipline amongst student s of university all power relate to the maintenance of discipline and disciplinary action in relation to the student of the university shall vest in the vice there shall be a proctor of the university to assist the vice chancellor in the exercise of the pow ers refer to in clause who shall be appoint by the executive council from amongst and associate professor in the manner by the the vice chancellor may delegate all or,30
266,266,SECTIONS,any of the power refer to in c la use a he to the proctor and to such other officer a he may specify in this without prejudice to the generality of his power relate to the maintenance of discipline and taking such action a may seem to him e for the maintenance of discipline the vice chancellor may in exercise of such power by order direct that any student or student be expel or rusticate forum specify period or be not ad to a course or course of study in a college,30
267,267,SECTIONS,institution or department or a school of the university for a state period or be punish with fine for an amount to in the order or be debar from take an examination or examination conduct by the university institution or department or a school for one or more year or that the result of the student or student concerned in the examination or examination in which he or they have appear be withheld or the principal of college in st dean of school of study and head of,30
268,268,SECTIONS,in the university shall have the authority to exercise all such disciplinary power over in their respective college institution school and teach department in th e university as may be necessary for the proper conduct of such college institution s school and without prejudice to the power of the vice chancellor and the principal and other in clause detailed of discipline and proper conduct shall be make by the university and the principal,30
269,269,SECTIONS,of college institution dean of school of study and head of teach department sin the university may also make such supplementary rule a they deem necessary for the purpose at the time of admission every student shall be require to sign a declaration to the effect that himself to the in ary jurisdiction of the vice chancellor and other authority of the university,30
270,270,SECTIONS,convocation convocation of the university for the of degree or for other pur po sess hall be in such manner a may b e by the ordinance,31
271,271,SECTIONS,act chairman of meeting where no provision be make for a president or chairman to preside over a meeting of any authority of the university or any committee of such authority or when the president or chairman so provide for be absent the member present shall elect one from a mo f to preside at such meeting,31
272,272,SECTIONS,resignation any member other than an ex member of the court the executive council the academic council or any other authority of the university or any committee of such authority may resign by letter address to the registrar and the resignation shall take effect a soon a such letter is received by t he registrar,31
273,273,SECTIONS,dis qua li fi ca a person shall be disqualify for be chosen a and for be a member of any of the authority or for be appoint a and for be an officer of the university if i he be of unsound mind he be an un dis cha insolvent he have be convict by a court of law of an of fence involve moral turpitude in respect thereof to imprison men t for not less than six if any question ar is es a to whether a person be or have be subject to any of the dis qua li fi ca ti ons,31
274,274,SECTIONS,mention in clause the question shall be refer to the visitor and his decision shall be final and no suit or other proceed shall lie in any court against such decision,31
275,275,SECTIONS,residence condition for membership and office notwithstanding anything contain in th es ta tut es a person who be not ordinarily resident in shall not be eligible to be an officer of the university or a member of a authority of the university,31
276,276,SECTIONS,membership of authority by virtue of membership of other body notwithstanding anything contain in the statute a person who hold any post in the university or be a member of any authority or body of the university in his capacity a a member of a particular authority or body or a the holder of a particular appointment shall hold such office or membership only for so long a he con ti nu es to be a member of that particular authority or body or the holder of that particular appointment a the case ma y be,31
277,277,SECTIONS,alumnus association there shall be an alumnus association for the the subscription for membership of the alumnus association shall be by no member of the alumnus association shall be entitle to vote or stand for election unless he a member of the association for at least one year prior to the date of election and be a degree holder of the university o f at least five year standing provided that the condition relate to the completion o f one year membership shall not apply in the case of the first election,31
278,278,SECTIONS,student council there shall be constitute in the university a student council for ever ya cad em year consist of i the dean of student welfare who shall be the cha of the student twenty student to be nominate by the academic council on the basis of merit in and e activity twenty student to be elect by the dent a their that any student of the university shall have the right to bring up any matter concern,31
279,279,SECTIONS,the university before the student council if so permit by the chairman and he shall have the right ate in the discussion at any meeting when the matter be take up for the function of the student council shall be to make suggestion to the appropriate the university in regard to the pro gramme of study student welfare and other matter of importance in regard to the work of the university in general and such suggestion shall be make on the basis of consensus of the,31
280,280,SECTIONS,student council shall meet at least twice in every a cad year and the first meeting of the council be in the beg inning of the academic session,31
281,281,SECTIONS,ordinance how to be make the first ordinance make under sub section of section be amend repeal or add to at any time by the council in the manner spec if ie d in the follow sub no ordinance in respect of the matter enumerate in sub section of section of this act shall be make by the executive council unless a draft of such ordinance have be propose by the academic the executive council shall not have power to amend any draft of any ordinance propose by the,32
282,282,SECTIONS,academic council under clause but may reject the proposal or return the draft to the academic council for re consideration either in whole or in part together with any amendment which the executive council may where the executive council have reject or return the draft of an ordinance propose by the academic council the academic council may consider the stion afresh and in case the original draft is reaffirm by a majority of not less than two third of the member present and voting and more than half the total,32
283,283,SECTIONS,number of member of the academic council the draft may be sent back to the l which shall either adopt it or refer it to the visitor whose decision shall be every ordinance s make by the executive council sh al l come into effect every ordinance make by the executive council shall be submit to the visitor within from the date of it the visitor shall have the power to direct the university to suspend the operation of the visitor shall inform the executive,32
284,284,SECTIONS,council about his objection to the ordinance refer to in clause and may after receive the comment of the university either withdraw the order suspend ing the ordinance or disallow the ordinance a his decision shall be final,32
285,285,SECTIONS,regulation the authority of the university may m ake regulation s consistent with this act the st a tu te and the ordinance for the follow matter namely i lay down the procedure to be observe at their meeting s and the number of mem to form a provide for all matter which be require by this act the statute or the ordinance to by regulation provide for all other matter solely concern such authority or committee appoint by them and not provide for by,32
286,286,SECTIONS,this act the st a tu te or the every authority of the university shall make regulation provide for the give of notice to t of such authority of the date of meeting and of the business to be consider at meeting and for the keep of a record of the proceeding of me the executive council may direct the amendment in such manner a it may specify of any regulation make under the statute or the an of any such regulation,32
287,287,SECTIONS,delegation of power subject to the provision of this act and the statute any officer or authority of the university may delegate his or it power to any other officer or authority or person under his or it respective control and subject to the condition that overall responsibility for the exercise of the power so delegate shall continue to vest in the officer or authority delegate such pow er,33
