,Unnamed: 0,Title,Paragraph Text,Page No
186,186,SECTIONS,vice chancellor the vice chancellor shall be appoint by the visitor from out of a by a committee a constitute under clause that if the visitor do not approve any of the person include in the panel he may ca for an extend fresh the committee refer to in clause shall consist of five person out of whom three shall be nominated by the executive council and two by the visitor and one of the no mi ne es of the visitor shall be the convener of the committee provided that none of,19
187,187,SECTIONS,the member of the committee shall be an employee of the university or a college or an institution maintain by the university or a member of a authority of the university the vice chancellor shall be a whole time salaried officer of the the vice chancellor shall hold office for a term of five year from the date on which he enter sup on his office or until he the age of seventy year whichever be ear lier and he shall not be eligible for re appointment provided that notwithstanding the expiry of the say,19
188,188,SECTIONS,period of five year he shall continue in office until his successor in a p po in ted and upon his office provided far that the tor may direct any vice chancellor after his term h a expire to continue in office for such period not exceed a total period of one ye ar a may be specify by notwithstanding anything contain in clause the visitor may at any time after the vice chancellor have enter upon his office by er in write remove the vice chancellor from office on ground of incapacity,19
189,189,SECTIONS,misconduct or lation of statutory that no such er shall be make by the visitor unless the vice chancellor have be give a reasonable opportunity of show cause against the action propose to be take against him provided far that the visitor shall consult the chancellor also before make such order provided also that the visitor may at any time before make such order place the vice chancellor under suspension pending the emolument and other condition of service of the vice chancellor,19
190,190,SECTIONS,shall be a follow i the vice chancellor shall be pa id a monthly salary and allowance other than house rent allowance at the rate fix by the central government from time to time and he shall be en titled without payment of rent to use a furnish residence throughout his te of office and no charge shall fall on the vice chancellor in respect of the maintenance of such the vice chancellor shall be entitle to such terminal benefit and allowance a may be fixed by the centrum l government from time to,19
191,191,SECTIONS,that where an employee of the university or a college or an institution maintain by the university or of any other university or any college or institution maintain by or admit to the privilege of such other university be appoint a t he vice chancellor he may be allow to continue to contribute to any provident fund of which he be a member and the university shall contribute to the account of such person in that provident fund at the same rate at which the person had be con tri bu tin g immediately before his a p po,19
192,192,SECTIONS,a the vice chancellor provided far that where such employee have be a member of any pension scheme the university shall make the contribution to such the vice chancellor shall be entitle to travel allowance at such rate a may be fix by the executive the vice chancellor shall be entitle to leave on full pay at the rate of thirty day in a calendar year and the leave shall be credit to his account in advance in two half yearly fifteen day each on the first day of,19
193,193,SECTIONS,and every year provided that if the vice chancellor as sum es or relinquish es charge of the office of the vice chancellor during the currency of a half year the leave shall be credit proportionately at the rate of two and a half day for each complete month of in addition to the leave refer to in sub clause the vice chancellor shall also be en titled to half pay leave at the rate of twenty day for each complete year of service and half pay leave may also be avail of a commute leave on f ull pay on,19
194,194,SECTIONS,medical certificate provided that when such commute leave be avail of twice the amount of half pay leave shall be ted against half pay l eave if the office of the vice chancellor becomes vacant due to death resignation or otherwise or if he is unable to perform his duty due to ill health or any other cause the chancellor shall perform the duty of the vice chancellor provide that if the pro vice chancellor be not available the senior most professor shall perform of the vice chancellor until a new vice chancellor as sum e office or the exist vice chancellor re sum es the duty of his office a the case may be,19
195,195,SECTIONS,power and duty of vice chancellor the vice chancellor shall be ex chairman of the executive council the academic council and the finance committee and shall in the absence of the chancellor preside at the convocation for degree and at meeting of the the vice chancellor shall be entitle to be present at and address any meeting of any authority or other body of the university but shall not be entitle to vote thereat unless he be a me of such authority or it shall be the duty,20
196,196,SECTIONS,of the vice chancellor to see that this act the statute the ordinance and the regula ti ons be duly observe and he shall have all the power necessary to ensure such the vice chancellor shall have all the power necessary for the proper maintenance of discipline in the university and he may delegate any such power to such person or person a he the vice chancellor shall have the power to convene or cause to be convene the ting of the executive council the academic council and the finance committee,20
197,197,SECTIONS,pro vice chancellor the pro vice chancellor shall be appoint by the executive council on the of the vice chancellor provided that where the ti on of the vice chancellor be not accepted by the executive council the matter shall be refer to the visitor who may either appoint the person recommend by the vice chancellor or ask the vice chancellor to recommend another person to the executive c far that the executive council may on the recommendation of the vice chancellor appoint a,20
198,198,SECTIONS,professor to dis cha the duty of the pro vice chancellor in addition to his own duty a the term of office of the pro vice chancellor shall be such a may be decide by the executive council but it shall not in any case exceed five year or until the expiration of the term of office of the vice ell or whichever be tha t the pro vice chancellor whose term of office have expire shall be eligible for reappointment provided far t hat in any case the pro vice chancellor shall retire on,20
199,199,SECTIONS,atta in ing the age of also that the pro vice chancellor shall while discharge the duty of the vice chancellor under clause of statute continue in office notwithstanding the expiration of his term of office as pro vice chancellor until the vice chancellor resume office or a new vice chancellor a ssu me office as the case may the emolument and other term and con di ti ons of service of the pro vice chancellor shall be such a may be by the the pro vice chancellor,20
200,200,SECTIONS,shall assist the vice chancellor in respect of such matter a may by the vice chancellor in this behalf from time to time and shall also exercise such power sand perform such duty a may be assign or delegate to him by the vice chancellor,20
201,201,SECTIONS,dean of school every dean of school shall be appoint by the vice chancellor from amongst the professor in the school by rotation in order of for a period of three that in case there be only one professor or no professor in a school the dean sh all be a p pointed for the time be from amongst the professor if any and the associate professor in the school by rotation in the order of seniority provided far that a dean on attain the age of sixty five year sh al l cease to hold office a,21
202,202,SECTIONS,when the office of the dean be vacant or when the dean be by reason of illness absence or any other cause unable to perform duty of his office the duty of the office sh all be perform by the senior most professor or associate professor a the case may be in the the dean shall be the head of the school and shall be responsible for the conduct and maintenance of the standard of teach and research in the school and shall have such other may b e by the the dean shall have the right,21
203,203,SECTIONS,to be present and to speak at any meeting of the board of committee of the school a the case may be but shall not have the right to vote thereat unless he be a member thereof,21
204,204,SECTIONS,registrar the registrar shall be appoint by the executive council on the recommendation of a selection committee constitute for the purpose and shall be whole time salaried officer of he shall be appoint for a term of five year s and shall b e eligible for re the emolument and other term and condition of service of the registrar shall be such a maybe by the council from time to time provided that the registrar shall retire on attain the age of six,21
205,205,SECTIONS,when the office of the registrar be vacant or when the registrar be by reason of illness absence or any other cause unable to perform the duty of his office the duty of the office shall be perform by such person a the vice cell or may appoint for the a the registrar shall have power to take disciplinary action against such of the teacher and other academic staff a may be specify in the order of the executive council and to suspend them pending inquiry to administer warning to them or to,21
206,206,SECTIONS,impose on them the penalty of censure or the with holding of increment provided that no such penalty shall be impose unless the person have be give a reasonable opportunity of show cause against the action propose d to be take in regard to an appeal shall lie to the vice chancellor against any order of the registrar impose any of the penal ti es specify in sub clause in a case where the inquiry that a punishment be yon d the power of the registrar be cal led for the registrar shall upon the conclusion of the,21
207,207,SECTIONS,inquiry make a report to the vice chancellor along with his recommendation that an appeal shall lie to the executive l against an order of the any the registrar shall be ex secretary of the executive council and the academic council but shall not be deem to be member of either of these authority and he shall be ex secretary of the it shall b e the duty of the registrar a to be the custodian of the record the common seal and such other,21
208,208,SECTIONS,property of the university as the executive council shall commit to his to issue all notice convene meeting of the court the executive council the academic council and of any committee appoint by those to keep the minute of all the meeting of the court the executive council the academic council and of any committee appoint by those to conduct the official correspondence of the court the executive and the to supply to visitor copy of the agenda of the,21
209,209,SECTIONS,meeting of the authority of the university as soon a they be issue and the minute of such to represent the university in suit or proceeding by or against the university sign power of attorney and verify pleading or depute his representative for the purpose to perform such other duty a may be specify in the statute the ordinance or the regula ti ons or a may be require from time to time by the executive council or vice chancellor,21
210,210,SECTIONS,finance officer the finance officer shall be appoint by the executive council on the recommend a ti ons of selection committee con for the purpose and he shall be a whole time salaried officer of the the finance officer shall be appoint for a term of five year and shall be eligible the emolument and other term and con dit ion of service of the finance officer shall be such as may be by the executive council f time to time provided that the finance officer shall retire on,22
211,211,SECTIONS,attain the age of six tyt wo when the office of the finance officer be vacant or when the finance officer be by reason of illness absence or any other cause unable to perform the duty of his office the duty of the office shall be perform by such person a the vice or may appoint for the the finance officer shall be ex secretary of the finance committee but shall not to be a member of such the finance officer shall a exercise general supervision over the fund of,22
212,212,SECTIONS,the university and shall advise it a s regard its financial policy perform such other financial function a may be assign to him by the executive council or as may be by the statute or the subject to the control of the executive l the finance of shall a hold and manage the property and investment of the university ing trust and ensure that the limit fix by the executive council for recur and nonrecurring expenditure for a year be not exceed and that,22
213,213,SECTIONS,all money be expend on the purpose for which they be grant or be responsible for the preparation of annual account and the budget of the university and for their present at ion to the executive council d keep a constant watch on the state of the cash and bank balance a on the state of investment se watch the progress of the collection of revenue and advise on the method of ensure that the register of building land furniture and equipment be maintain up to date and that stock,22
214,214,SECTIONS,check be conduct of equipment and other consumable material in all cent re s and bring to the notice of the vice chancellor expenditure and other and suggest disciplinary act io n against person at fault call for from any office department cent re laboratory college or institution maintain by the university any information or return that he may consider necessary for the performance of any receipt give by the finance,22
215,215,SECTIONS,officer or the person or person duly a ut ho rise in this behalf by the executive council for any money payable to the university shall be sufficient discharge for payment of such money,22
216,216,SECTIONS,controller of examination the controller of examination shall be appoint by council on the ti ons of a selection committee constitute for the purpose an d he shall be a whole time salaried officer of the the controller of examination shall be appoint for a term of five year and shall b e eligible the emolument and other term and condition of service of the controller of examination shall be such a may be by the executive council from time to,23
217,217,SECTIONS,time provided that the controller of examination shall e on attain the age of sixty two when the office of the controller of examination be vacant or when the controller of ex a mina ti ons be by reason of illness absence or any other cause unable to perform the duty of his office the duty of the office shall be perform by such person a the vice or may appoint the controller of examination shall arrange for and superintend the examination of the university in the manner by the ordinance,23
218,218,SECTIONS,librarian the librarian shall be appoint by the executive council on the recommend a ti ons of the selection committee constitute for the purpose and he shall be a whole time salaried officer of the librarian shall exercise such power and perform such duty a may be assign to him by the executive council,23
219,219,SECTIONS,meeting s of court an annual meeting of the court shall be on a date to be fix by the executive council unless some other date have be fix by the court in respect of any at an annual meeting of the court a report on the work in g of the university during the previous year together with a statement of the t and expenditure the balance sheet a audit and financial es ti mat es for the next year shall be a copy of the statement of receipt s and expenditure the balance sheet and the financial,23
220,220,SECTIONS,es ti mat es refer red to in clause shall be sent to every member of the court at least seven day before the date of the annual special meeting of the court may be convene by the executive council or the vice chancellor or if there be no vice chancellor the pro vice chancel or if there be no pro vice chancellor by eleven member of the court shall form a quorum for a meeting of the court,23
221,221,SECTIONS,quorum for meeting o f executive council seven member of the executive council shall for ma quorum for a meeting of the executive council,24
222,222,SECTIONS,power and function of executive council the executive council shall have the power of management and administration of the revenue and property of the university and the conduct of all administrative affair of the university not otherwise provide subject to the provision of this act the statute and the ordinance the executive council shall in addition to all other power i n it e the follow power namely i to create teach and other academic post include chair to determine the number,24
223,223,SECTIONS,of such post and to define the duty and condition of service of professor assis ta pro fe and other academic staff provided that no action shall be take by the executive council in respect of the number and qua li fi ca ti ons of teacher and other academic staff otherwise than after consideration of the recommend a ti ons of the a cad em to appoint such professor associate professor assistant professor and other academic staff include chair a may be necessary on the,24
224,224,SECTIONS,recommendation of the selection for the purpose and to fill up temporary vacancy to promote inter facial research by make joint appointment of teach staff in department s and to create administrative ministerial and other necessary post and to define their d and con di ti ons of their service and to make appointment thereto in the man ne r by to grant leave of absence to any officer of the university other th an the chancellor and,24
225,225,SECTIONS,the vice chancellor and to make necessary arrangement for the discharge of the function of s during his to regulate and enforce discipline among employee in accordance with the statute and to manage and regulate the finance account investment property business and all other administrative affair of the university and for that purpose to appoint such agent a it may thin k to fix limit on the total recur and the total non recur expenditure for a year on the recommend,24
226,226,SECTIONS,at ion of the finance to invest any money belonging to the university include any unapplied income in such stocks fund share or security from time to time a it may think fit or in the purchase of immovable property in with the like power of vary such investment from time to to transfer or accept transfer of any movable or immovable property on behalf of the university xi to provide building premise furniture and apparatus and other mean need for carrying on the work of the,24
227,227,SECTIONS,to enter into vary carry out and cancel contra on behalf of the university to entertain adjudicate upon and if th ought fit to redress any grievance of the employee sand student of the university who may for any reason feel to appoint examiner and moderator and if necessary to remove them and to fix their and travel and other allowance after c the academic to select a common seal for the university and for the use of to make such,24
228,228,SECTIONS,special arrangement a may be necessary for the residence of to institute fellowship scholarship studentship medal and to provide for the appointment of visit professor emeritus professor consultant and determine the term and condition of such a to enter into partnership with industry and non government agency for the advancement of knowledge and establish a corpus of fund out of the profit of such partnership to exercise such other power and perform such other duty a may be or impose don it by this act or the statute,24
229,229,SECTIONS,quorum of meeting of academic member of the academic council shall f or ma quorum for a meeting of the academic council,25
230,230,SECTIONS,power and function of academic council subject to the provision of this act the statute sand the ordinance the academic council shall in addition to all other power in it e the following power namely a to exercise general supervision over the academic policy of the university and to give di recti ons regard method of instruction ordination of teach among the col leges and evaluation of research and imp of academic to bring a bo ut and promote inter school,25
231,231,SECTIONS,ordination and to establish or appoint such commit te es or board a may de necessary for the pur po sec to consider matter of general academic interest either on it own initiative or on a reference by a school or the executive council and to take appropriate action thereon to frame such regulation and rule consistent with the statute and the regarding the academic function of the university discipline residence admission award of fellowship sand studentship fee concession corporate life and attendance,25
232,232,SECTIONS,school of study and department the university shall have such school of study as may be specify in the every school shall have a school board and the member of the first school board shall be nominated by the executive for a period of three the composition power and ion of a school board shall b e by the the conduct of the meeting of a school board and the quorum require for such meeting shall be by the a every school shall,25
233,233,SECTIONS,consist of such department a may b e assign to it by the ordinance provide that the executive council may on the recommendation of the academic council of study to which may be assign such teacher of the university a the executive council may consider necessar each department shall consist of the follow member namely i teacher of the person conduct re search in the dean of the honorary professor if any attach to the department such other person a may be member of the department in accordance with t he provision of the ordinance,25
234,234,SECTIONS,board of study each shall have a board of the constitution of the board of study and the term of office of it member shall b e the subject to the overall control and supervision of the academic council the function of a board of study shall be to approve subject for research for various degree and other requirement of research deg re es and to recommend to the concerned school board in the er by the ordinance a course of study and appointment of,26
235,235,SECTIONS,examiner for course but exclude research appointment o f supervisor for research measure for the improvement of the st of teach and research provided that the above function of a board of study shall during the period of three after the commencement of this act be perform by the department,26
236,236,SECTIONS,fi nan ce committee the finance committee shall consist of the follow i the vice chancellor the pro vice one person to be no mina ted by the three person to be nominate by the executive council out of whom at least one shall be a mem be r of the executive council three person to be nominate by the visitor five member of the finance committee shall form a quorum for a me of the all the member of the finance committee other than,26
237,237,SECTIONS,ex member shall hold of fice for a term of three a member of the finance committee shall have the right to record a minute of dissent if he doe snot agree with any is ion of the finance the finance committee shall meet at least thrice every year to examine the account and proposal for all proposal relate to creation of post and those item which have not be include in the budget shall be examine by the finance committee before they be con si de red by the,26
238,238,SECTIONS,the annual account s and the financial estimate of the university prepared by the finance officer shall be laid before the fi na committee for consideration and comment and thereafter submit to the executive council for the finance committee shall recommend limit for the total recur expenditure and the total nonrecurring expenditure for the year base on the income and resource of the university which in the case of productive work may include the proceeds of loan,26
239,239,SECTIONS,se lection committee there shall be selection committee for make recommendation to the executive council for appointment to the post of professor associate professor assistant professor registrar finance officer controller of ex ami nat io n librarian and principal of college s maintain by the the selection committee for appointment to t he post specify in column of the table below shall consist of the vice chancellor a nominee of the visitor and the person specify in,26
240,240,SECTIONS,the corresponding entry in column of the say i the dean of the the head of the department if he be a three person not in the service of the university nominate by the executive council out of a panel of name recommend by the academic council for their special knowledge of or interest in the subject with which the professor will be concerned associate professor assistant professor i the head of the one professor nominate by the vice two person not,26
241,241,SECTIONS,in the service of the university nominate by the executive council out of a panel of name recommend by the academic council for their special knowledge of or interest in the subject with which the associate professor or assistant professor will be concerned registrar finance officer controller of ex a mina ti ons i two member of the executive council nominate by one person not in the service of the university nominate by the executive council librarian i two person s not in the service of the university who have,26
