,Unnamed: 0.1,Unnamed: 0,Title,Paragraph Text,Page No
53,53,53,,28. Annual report. —The Institute shall prepare for every year areport of its activities during that year and submit the report to the Central Government in such form and on or before such date as maybe provided by the Statutes and acopy of this report shall be laid before both Houses of Parliament within one month of its receipt.,9
54,54,54,,"29. Pension, provident fund, etc. —(1)) The Institute shall constitute for the benefit of itsemployees, including the Director, such pension, insurance and provident fund scheme as it deems fit,in such manner and subject to such conditions as may be provided by the Statutes.(2)) Where any such provident fund has been so constituted, the Central Government may declare that the provisions of the Provident Funds Act, 1925 (19 of 1925) shall apply to such fund as if it were aGovernment provident fund.",9
55,55,55,,30. Authentication of orders and instruments of Institute. —All orders and decisions of the Institute shall be authenticated by the Director or any other member authorised by the Institute in this behalf and all other instruments shall be authenticated by the signature of the Director or such officers as may be authorised by the Institute.,9
56,56,56,,"31. Appointment. —All appointments of the staff of the Institute, except that of the Director shall be made in accordance with the procedure laid down in the Statutes,—(a)) by the Board, if the appointment is made on the academic staff in the post of Assistant Professor or above or if the appointment is made on the non-academic staff in any cadre, the maximum of the pay scale for which is the same or higher than that of Assistant Professor; and(b)) by the Director, in any other case.",9
57,57,57,,"32. Statutes. —Subject to the provisions of this Act, the Statutes may provide for all or any of the following matters, namely:—(a)) the formation of departments of teaching and other academic units;(b)) the institution of fellowships, scholarships, exhibitions, medals and prizes;(c)) the classification of posts, term of office, method of appointment, powers and duties and other terms and conditions of service of the officers of the Institute including the President, theDirector, the Registrar, and such other officers as may be declared as officers",9
58,58,58,,"of the Institute by theStatutes;(d)) the classification, the method of appointment and the determination of the terms and conditions of service of officers, teachers and other staff of the Institute;(e)) the reservation of posts for the Scheduled Castes, the Scheduled Tribes and other categories of persons as may be determined by the Central Government;(f)) the form in which and the time at which the budget and reports shall be prepared by theInstitute;(g)) the form of annual report;10 (h)) the constitution of pension, insurance and provident funds",9
59,59,59,,"for the benefit of the officers,teachers and other staff of the Institute;(i)) the constitution, powers and duties of the other authorities of the Institute referred to in clause ( d)) of section 14;(j)) the delegation of powers;(k)) the code of conduct, disciplinary actions thereto for misconduct including removal from service of employees on account of misconduct and the procedure for appeal against the actions ofan officer or authority of the Institute;(l)) the conferment of honorary degrees;(m)) the establishment and maintenance of halls,",9
60,60,60,,"residences and hostels;(n)) he authentication of the orders and decisions of the Board; and(o)) any other matter which by this Act is to be, or may be, provided by the Statutes.",9
61,61,61,,"33. Statutes how made. —(1)) The first Statutes of the Institute shall be framed by the Central Government and acopy of the same shall be laid, as soon as may be after it is made, before each House of Parliament.(2)) The Board may, from time to time, make new or additional Statutes or may amend or repeal the Statutes in the manner hereafter in this section provided.(3)) Anew Statute or addition to the Statutes or any amendment or repeal of aStatute shall require the previous approval of the General Council who may assent thereto or withhold assent",10
62,62,62,,or remit it to the Board for consideration.(4)) Anew Statute or aStatute amending or repealing an existing Statute shall have no validity unless it has been assented to by the General Council.,10
63,63,63,,"34. Ordinances. —Subject to the provisions of this Act and the Statutes, the Ordinances may provide for all or any of the following matters, namely:—(a)) the admission of the students to the Institute;(b)) the reservation for the Scheduled Castes, the Scheduled Tribes and other categories ofpersons;(c)) the courses of study to be laid down for all degrees, diplomas and certificates of theInstitute;(d)) the conditions under which students shall be admitted to the degree, diploma and certificate courses and to the examinations of the Institute and the",10
64,64,64,,"eligibility conditions for awarding thesame;(e)) the conditions of award of the fellowships, scholarships, exhibitions, medals and prizes;(f)) the conditions and manner of appointment and duties of examining bodies, examiners andmoderators;(g)) the conduct of examinations;(h)) the maintenance of discipline among the students of the Institute;(i)) the fees to be charged for courses of study at the Institute and for admission to theexaminations;(j)) the conditions of residence of students of the Institute and the levying of the fees for residence in",10
65,65,65,,"the halls and hostels and of other charges; and(k)) any other matter which by this Act or the Statutes is to be, or may be, provided for by theOrdinances.",10
66,66,66,,"35. Ordinances how made. —(1)) The First Ordinance of the Institute shall be framed by the CentralGovernment.(2)) Save as otherwise provided in this section, Ordinances shall be made by the Senate.11 (3)) All Ordinances made by the Senate shall have effect from such date as it may direct, but every Ordinance so made shall be submitted, as soon as may be, to the Board and shall be considered by the Board at its next succeeding meeting.(4)) The Board shall have power by resolution to modify or cancel any such Ordinance and such Ordinance shall from the date of such resolution stand modified accordingly or cancelled, as the case may be.",10
67,67,67,,"36. Conduct of business by authorities of Institute. —The authorities of the Institute may have their own rules of procedure, consistent with the provisions of this Act, the Statutes and the Ordinances for the conduct of their own business and that of the committees, if any, appointed by them and not provided for by this Act, the Statutes or the Ordinances.",11
68,68,68,,"37. Tribunal of Arbitration. —(1)) Any dispute arising out of acontract between the Institute and any of its employees shall, at the request of the employee concerned or at the instance of the Institute, be referred to aTribunal of Arbitration consisting of one member appointed by the Institute, one member nominated by the employee, and an umpire appointed by the Visitor.(2)) The decision of the Tribunal of Arbitration shall be final.(3)) No suit or proceeding shall lie in any court in respect of any matter which is required bysub-section ( 1)) to",11
69,69,69,,be referred to the Tribunal of Arbitration.(4)) The Tribunal of Arbitration shall have power to regulate its own procedure.(5)) Nothing in any law for the time being in force relating to arbitration shall apply to arbitration sunder this section.,11
70,70,70,,"38. Acts and proceedings not to be invalidated by vacancies. —No act of the Institute or the General Council or Board or Senate or any other body set-up under this Act or the Statutes, shall be invalid merely by reasons of—(a)) any vacancy in, or defect in the constitution thereof, or(b)) any defect in the election, nomination or appointment of aperson acting as amemberthereof, or(c)) any irregularity in its procedure not affecting the merits of the case.",11
71,71,71,,"39. Grant of degrees, etc., by Institute. —Notwithstanding anything in the University Grants Commission Act, 1956 (3of 1956) or in any other law for the time being in force, the Institute shall have power to grant degrees and other academic distinctions and titles under this Act.",11
72,72,72,,"40. Sponsored schemes. —Notwithstanding anything in this Act, whenever the Institute receives funds from any Government, the University Grants Commission or any other agency including industry sponsoring aresearch scheme, aconsultancy assignment, ateaching program me or achaired professorship or ascholarship, to be executed or endowed at the Institute,—(a)) the amount received shall be kept by the Institute separately from the fund of the Institute and utilised only for the purpose of the scheme; and(b)) the staff required to execute the same",11
73,73,73,,shall be recruited in accordance with the terms and conditions stipulated by the sponsoring organisation:Provided that any money remaining unutilised under clause ( a)) shall be transferred to the endowment fund created under section 25.,11
74,74,74,,41. Control by Central Government. —The Institute shall carry out such directions as may be issued to it from time to time by the Central Government for the efficient administration of this Act.,11
75,75,75,,"42. Resolution of differences. —If in, or in connection with, the exercise of its powers and discharge of its functions by the Institute under this Act, any dispute or difference arises between the Institute and the Central Government, the decision of the Central Government thereon shall be final.",11
76,76,76,,"43. Power to remove difficulties. —(1)) If any difficulty arises in giving effect to the provisions of this Act, the Central Government may, by order, published in the Official Gazette, make such provisions12 or give such directions not inconsistent with the provisions of this Act, as appears to it to be necessary or expedient for removing the difficulty:Provided that no such order shall be made after the expiry of two years from the appointed day.(2)) Every order made under this section shall be laid, as soon as may be after it is made, before each House of Parliament.",11
77,77,77,,"44. Transitional provisions. —Notwithstanding anything contained in this Act,—(a)) the Board of Governors of the Society functioning as such immediately before the commencement of this Act shall continue to so function until anew Board is constituted for the Institute under this Act, but on the constitution of anew Board under this Act, the members of the Board holding office before such constitution shall cease to hold office; and(b)) until the first Statutes and the Ordinances are made under this Act, the Statutes and the Ordinances of the",12
78,78,78,,"India nInstitute of Petroleum and Energy Society, as in force, immediately before the commencement of this Act, shall continue to apply to the Institute insofar as they are not inconsistent with the provisions of this Act.",12
79,79,79,,"45. Statutes, Ordinances and notifications to be published in the Official Gazette and to be laid before Parliament. —(1)) Every Statute and every Ordinance made or notification issued under this Act shall be published in the Official Gazette.(2)) Every Statute and every Ordinance made or notification issued under this Act shall be laid, as soon as may be after it is made, before each House of Parliament, while it is in session, for atotal period of thirty days which may be comprised in one session or in two or more successive sessions,and if, before the expiry of the session immediately following the session or the successive sessionsaforesaid, both Houses agree in making any modification in the Statute, Ordinance or notification or both Houses agree that the Statute, Ordinance or notification should not be made or issued, theStatute, Ordinance or notification shall thereafter have effect only in such modified form or be of noeffect, as the case may be; so, however, that any such modification or annulment shall be without prejudice to the validity of anything previously done under that Statute, Ordinance or notification.(3)) The power to make the Statutes, Ordinances or notifications shall include the power to give retrospective effect from adate not earlier than the date of commencement of this Act, to the Statutes,Ordinances, notifications or any of them but no retrospective effect shall be given to any Statute,Ordinance or notification so as to prejudicially affect the interests of any person to whom suchStatute, Ordinance or notification may be applicable.",12
