,Unnamed: 0,Title,Paragraph Text,Page No
165,165,SECTIONS,power of state government to make rule the state government may by no ti fi cation and after consultation with the central government make rule to carry out the provision of this in particular and without prejudice to the generality of the forego power such rule may provide for all or any of the follow matter namely a the time within which the weight or measure may be get verify under so to subsection of section register and record to be maintain by person refer to under sub,17
166,166,SECTIONS,section of section the form manner condition period area of jurisdiction and fee for issuance of sub section of section fee for verification and stamp of any weight or measure under subsection of section manner of notify government approve test cent re term and condition and fee to bepaid under sub section of section fee for compound of of fence under sub section of section in make an y rule under this section the state government may provide that,17
167,167,SECTIONS,a breach thereof shall be punishable with fine which may extend to five thousand the power to make rule under this section shall be subject to the condition of the rule being made after previous publication in official every rule make under this section shall a soon a may be after it be make be laid before each house of state legislature where there be two house and where there be one house of state legislature before that house,17
168,168,SECTIONS,delegation of power the central government may in consultation with the state government and by notification direct that any power exercisable by it under this act or any rule made thereunder not be a power c by section relate to appeal or section relate to power to make rule in relation to such matter and subject to such condition a may be specify may also by such officer subordinate to it a may be specify in the no ti subject to any general or special direction or condition,17
169,169,SECTIONS,impose by the state government any person a ut ho rise by the central government to exercise any power may exercise those power in the same manner and to the same extent a if they ha d be on that person directly by this act and not by way of delegation,17
170,170,SECTIONS,a c t not to apply in certain case the provision of this act in so far a they relate to verification and stamp of weight and measure shall not apply to any or measure a use in any factory exclusively engage in the manufacture of any arm ammunition or both for the use of the arm force of the use for scientific investigation or for manufacture exclusively for export,17
171,171,SECTIONS,exist director controller and legal metrology officer not to be affected by the new qualification to be every director controller and legal metrology officer appointe dim mediately before the commencement of the rule make under this act shall be deem to have bee nap pointed under sub section of section and notwithstanding any rule prescribe the rule make by a state government under the standard of weight and measure sen forcement act of which be in force immediately before the commencement of this act shall remain in force until the state government make rule in that behalf,17
172,172,SECTIONS,repeal of the standard of weight and measure act and standard of weight and me a sures enforcement act the standard of weight and measure act of and the standard of weight and measure enforcement act of be without prejudice to the provision contain in the general clause act of with respect to repeal any notification rule or order make under the standard of weight and measure of and the standard of weight and measure enforcement act of shall if in force at the commencement of this act continue to be in force and have effect a if it was made under the correspond provision of this notwithstanding such repeal any appointment notification rule order registration notice decision approval author is at ion or consent make issue or give under such law shall if in force at the commencement of this act continue to be in force and have effect a if it be or give un the correspond provision of this act,18
