,Unnamed: 0.1,Unnamed: 0,Title,Paragraph Text,Page No
0,0,0,,"1.. Short title and commencement .—(1)) This Act may be called the India nInstitute of Petroleum and Energy Act, 2017.(2)) It shall come into force on such date1 as the Central Government may, by notification in the Official Gazette, appoint, and different dates may be appointed for different provisions of this Act.",2
1,1,1,,"2.. Declaration of India Institute of Petroleum and Energy as an institution of nationalimportance. —Whereas the objects of the institution known as the India nInstitute of Petroleum andEnergy, Vishakhapatnam, Andhra Pradesh are such as to make the institution one of nationalimportance, it is hereby declared that the institution known as the India nInstitute of Petroleum and Energy is an institution of national importance.",2
2,2,2,,"3.. Definitions. —In this Act, unless the context otherwise requires,—(a)) “appointed day” means the date appointed under sub-section ( 2)) of section 1for coming into force of this Act;(b)) “Board” means the Board of Governors of the Institute constituted under sub-section ( 1)) of section 5;;(c)) “Chairperson” means the Chairperson of the General Council;(d)) “Director” means the Director of the Institute appointed under section 20;(e)) “fund” means the fund of the Institute to be maintained under section 24;(f)) “General Council” means the General",2
3,3,3,,"Council constituted under sub-section ( 1)) of section 15;(g)) “Institute” means the India nInstitute of Petroleum and Energy incorporated under section 4;;(h)) “President” means the President of the Board appointed under clause ( a)) of sub-section ( 1))of section 5;;(i)) “Registrar” means the Registrar of the Institute referred to in section 21;(j)) “Senate” means the Senate of the Institute referred to in section 17;(k)) “Society” means the India nInstitute of Petroleum and Energy Society, Vishakhapatnam,Andhra Pradesh registered under the Andhra",2
4,4,4,,"Pradesh Societies Registration Act, 2001 (AndhraPradesh Act 35 of 2001); and(l)) “Statutes” and “Ordinances” mean, respectively, the Statutes and the Ordinances of the Institute made under this Act.",2
5,5,5,,"4.. Incorporation of Institute. —The India nInstitute of Petroleum and Energy, Vishakhapatnam,Andhra Pradesh, an institution registered under the Andhra Pradesh Societies Registration Act, 2001,shall be abody corporate having perpetual succession and acommon seal with power, subject to the provisions of this Act, to acquire, hold and dispose of property and to contract, and shall, by thatname, sue and be sued.",2
6,6,6,,"1.. 22nd January, 2018, vide notification No. S..O.. 272(E)), dated 17th January, 2018, see Gazette of India, Extraordinary,Part II, sec. 3(( ii).35.. Constitution of Board of Governors. —(1)) With effect from such date as the Central Government may, by notification in the Official Gazette, appoint, there shall be constituted by the Central Government for the purposes of this Act, aBoard to be known as the Board of Governors consisting of the following members, namely:—(a)) the President to be appointed by the Central Government in such manner as may",2
7,7,7,,"be provided by the Statutes:Provided that the first President shall be appointed by the Central Government on such terms and conditions as it deems fit, for aperiod not exceeding six months from the date the first Statutes comes into force;(b)) the Director of the Institute, ex officio ;(c)) two persons from the Board of Directors of the promoting companies to be nominated by the Central Government.Explanation .—For the purposes of this clause, promoting companies mean those companies contributing to the endowment fund referred to in section 25;(d))",2
8,8,8,,"one Professor of the India nInstitute of Science, Ban galore to be nominated by the Director of that Institute;(e)) five eminent experts in the field of petroleum technology, renewable and non-renewable energy covering the entire hydrocarbon value chain having specialised knowledge or operational experience in respect of education, research, engineering and technology to be nominated by the GeneralCouncil, in consultation with the Director of the Institute;( f)) two Professors of the Institute to be nominated by the Senate of the Institute; and(g))",2
9,9,9,,one representative of the graduates of the Institute to be nominated by the Executive Committee of the Alumni Association.(2)) The Registrar of the Institute shall act as the Secretary of the Board.(3)) The Board shall ordinarily meet four times during acalendar year.,2
10,10,10,,"6.. Term of office of, vacancies among, and allowances payable to, members of Board. —(1))Save as otherwise provided in this section, the term of office of the President or any other member of the Board, other than ex officio members, shall be three years from the date of his appointment or nomination thereto.(2)) An ex officio member shall cease to be amember of the Board as soon as he vacates the office by virtue of which he is amember of the Board.(3)) The term of amember nominated to fill acasual vacancy shall continue for the remainder of the",3
11,11,11,,"term of the member in whose place he has been nominated.(4)) Notwithstanding anything contained in this section, an outgoing member shall, unless the Central Government otherwise directs, continue in office until another person is nominated as amember in his place.(5)) The members of the Board shall be entitled to such allowances, if any, from the Institute, as may be provided for in the Statutes, but no member other than the member referred to in clause ( f)) of section 5shall be entitled to any salary.",3
12,12,12,,"7.. Vesting of properties. —On and from the appointed day and subject to the other provisions of this Act, all properties which had vested in the Society immediately before that day, shall, on and from that day, vest in the Institute.",3
13,13,13,,"8.. Effect of incorporation of Institute. —On and from the appointed day,—(a)) any reference to the Society in any contract or other instrument shall be deemed as areference to the Institute;(b)) all the rights and liabilities of the Society shall be transferred to, and be the rights and liabilities of, the Institute.49.. Functions of Institute. —The Institute shall perform the following functions, namely:—(i)) nurture and promote quality and excellence in education and research in the area of petroleum and hydrocarbons and energy;(ii) provide for",3
14,14,14,,"program mes and courses of instruction and research leading to the award of theBachelors, Masters and Doctoral degrees in engineering and technology, management, science sand arts in the area of petroleum and hydrocarbons and energy;(iii) grant, subject to such conditions as the Institute may determine, degrees, diplomas, certificates or other academic distinctions or titles at various academic levels to candidates who have attained the prescribed standard of proficiency as judged on the basis of examination or on any other basis of testing and",3
15,15,15,,"evaluation and to withdraw any such degrees, diplomas, certificates or other academic distinctions or titles for good and sufficient reasons;(iv) confer honorary degrees or other distinctions and to institute and award fellowships,scholarships, exhibitions, prizes and medals;(v)) lay down standards of admission to the Institute through an examination or any other method of testing and evaluation;(vi) manage the content, quality, design and continuous evaluation of its academic and researchprogrammes in amanner that earns accreditation of an",3
16,16,16,,"international stature;(vii) promote research and development for the benefit of oil, gas and petrochemical industry and the energy sector through the integration of teaching and research;(viii) foster close educational and research interaction through networking with national,regional and international players in the oil, gas and petrochemical industry and the energy sector;(ix) co-operate with educational and research institutions in any part of the world having objects wholly or partly similar to those of the Institute by exchange of teachers",3
17,17,17,,"and scholars, conduct of joint research, undertaking sponsored research and consultancy projects, etc;(x)) organise national and international symposia, seminars and conferences in the area of petroleum and hydrocarbons and energy;(xi) establish, maintain and manage halls, residences and hostels for students and to lay down conditions for residing in the halls and hostels;(xii) supervise, control and regulate the discipline of all categories of employees of the Institute and to make arrangements for promoting their health and general",3
18,18,18,,"welfare;(xiii) supervise and regulate the discipline of students and to make arrangements for promoting their health, general welfare and cultural and corporate life;(xiv) frame Statutes and to alter, modify or rescind the same;(xv) deal with any property belonging to or vested in the Institute in such manner as the Institute may deem fit for advancing its objects;(xvi) receive gifts, grants, donations or benefactions from the Central Government and the State Governments and to receive bequests, donations, grants and transfers of movable or",3
19,19,19,,"immovable properties from testators, donors, transferors, alumni, industry or any other person;(xvii) borrow money for the purposes of the Institute with or without security of the property of the Institute;(xviii) integrate new technology in the classroom to encourage student-centric learning strategies and the development of an attitude for learning;(xix) develop and maintain an information resource cent re of print and non-print knowledge resources in the field of petroleum sector covering the entire hydrocarbon value chain as well as",3
20,20,20,,"other related areas of energy, science and technology;(xx) provide for further education to the working professionals and other employees of the Institute in the advanced areas of technology relating to oil, gas, complete hydrocarbon value chain and energy;5((xxi) offering customised program mes that serve the current and ongoing needs of working professionals for continuing education at the cutting-edge of petroleum and energy sector at the campus of the Institute or at company site;(xxii) encouraging industry to sponsor their staff to join the",3
21,21,21,,Institute for higher degrees and work on problems that interest the sponsoring industry thus helping develop deeper interaction sand aresearch environment in the industry;(xxiii) fostering the creation of new basic knowledge and applied technology and its active transmission to companies for the benefit of the nation and for this purpose establishing an Intellectual Property Rights cell to patent the new developments made at the Institute and to license them nationally and internationally;(xxiv) being proactive in supporting the skill development,3
22,22,22,,"program mes of the Government of India by training people in various related areas by way of certificate and diploma courses at the campus of the Institute or at other locations and involving industry in design and conduct ofcurricula;(xxv) giving broad focus to the functioning of the Institute in the area of petroleum and petroleum related technologies under the wide umbrella of energy; and(xxvi) doing all such things, not specifically covered above, as may be necessary, incidental or conducive to the attainment of all or any of the objects of the Institute.",3
23,23,23,,"10. Powers of Board. —(1)) Subject to the provisions of this Act, the Board shall be responsible for the general superintendence, direction and control of the affairs of the Institute and shall exercise all the powers not otherwise provided for by this Act, the Statutes and the Ordinances, and shall have the power to review the acts of the Senate.(2)) Without prejudice to the provisions of sub-section ( 1)), the Board shall—(a)) take decisions on questions of policy relating to the administration and working of theInstitute;(b)) lay down policy",5
24,24,24,,"regarding the duration of the courses, nomenclature of the degrees and other distinctions to be conferred by the Institute;(c)) institute courses of study and to lay down standards of proficiency and other academic distinctions in respect of the courses offered by the Institute;(d)) lay down policy regarding the cadre structure, qualification, the method of recruitment and conditions of service of the teaching and research faculty as well as other employees of theInstitute;(e)) guide resource mobilisation of the Institute and to lay down policies",5
25,25,25,,"for investment;(f)) consider and approve proposals for taking loans for purposes of the Institute with or without security of the property of the Institute;(g)) frame Statutes and to alter, modify or rescind the same;(h)) consider and pass resolutions on the annual report, the annual accounts and the budget estimates of the Institute for the next financial year as it thinks fit together with astatement of its development plans;(i)) create academic, administrative, technical and other posts and to make appointments thereto and to provide avenues for",5
26,26,26,,"their growth and development;(j)) examine and approve the development plans of the Institute and the financial implications of such plans;(k)) examine and approve the annual operation and capital budget estimates of Institute for the next financial year and to sanction expenditure within the limits of the approved budget;(l)) receive gifts, grants, bequests, donations or benefactions and transfer of movable or immovable properties from the Central Government and the State Governments and from testators,donors, or transferors, as the case may be,",5
27,27,27,,"and to have custody of the funds of the Institute;(m)) fix, demand and receive fees and other charges;6((n)) to sue and defend all legal proceedings on behalf of the Institute; and(o)) do all such things as may be necessary, incidental or conducive to the attainment of all or any of the aforesaid powers.(3)) The Board shall have the power to appoint such committees as it considers necessary for the exercise of its powers and the performance of its duties under this Act.(4)) The Board shall have the power to establish campus and academic centres at",5
28,28,28,,"any place within or outside India:Provided that no campus or academic cent re shall be established outside India without the prior approval of the Central Government.(5)) Notwithstanding anything contained in section 4,, the Board shall not dispose of in any manner,any immovable property of the Institute without prior approval of the Central Government.(6)) The Board may, through aspecific resolution to this effect, delegate any of its powers and duties to the President, Director, any officer or any authority of the Institute subject to reserving the right to review the action that may be taken under such delegated authority.",5
29,29,29,,"11. Institute to be open to all races, creeds and classes. —(1)) The Institute shall be open to persons of either sex and of whatever race, creed, caste or class, and no test or condition shall be imposed as to religious belief or profession in admitting students, appointing teachers or employees or in any other connection whatsoever.(2)) No bequest, donation or transfer of any property shall be accepted by the Institute which in the opinion of the Board involves conditions or obligations opposed to the spirit and object of thissection.",6
30,30,30,,12. Teaching at the Institute. —All teaching and other academic activities at the Institute shall be conducted by or in the name of the Institute in accordance with the Statutes and the Ordinances made in this behalf.,6
31,31,31,,"13. Visitor. —(1)) The President of India shall be the Visitor of the Institute.(2)) The Visitor may appoint one or more persons to review the work and progress of the Institute and to hold inquiries into the affairs thereof and to report thereon in such manner as the Visitor maydirect.(3)) Upon receipt of any such report, the Visitor may take such action and issue such directions ashe considers necessary in respect of any of the matters dealt with in the report and the Institute shall be bound to comply with such directions.",6
32,32,32,,"14. Authorities of Institute. —The following shall be the authorities of the Institute, namely:—(a)) the General Council;(b)) the Board of Governors;(c)) the Senate; and(d)) such other authorities as may be declared by the Statutes to be the authorities of theInstitute.",6
33,33,33,,"15. Constitution of General Council. —(1)) With effect from such date as the Central Governmentmay, by notification in the Official Gazette, appoint, there shall be constituted, for the purposes of thisAct, abody to be known as the General Council.(2)) The General Council shall consist of the following members, namely:—(a)) the Secretary, Ministry of Petroleum and Natural Gas in the Central Government, ex officio ,who shall be the Chairperson;(b)) the Chairman, India nOil Corporation Limited, ex officio ;(c)) the Chairman and Managing Director,",6
34,34,34,,"Hindustan Petroleum Corporation Limited, ex officio ;(d)) the Chairman and Managing Director, Oil and Natural Gas Corporation, ex officio ;7((e)) the Chairman and Managing Director, Gas Authority of India Limited, ex officio ;(f)) the Director General of Hydrocarbons, ex officio ;(g)) the Principal Advisor (Energy), NIT IAayog, ex officio ;(h)) the Executive Director, Oil Industry Safety Directorate, ex officio ;(i)) the Director, India nInstitute of Science, Bangalore, ex officio ;(j)) the Director, India nInstitute of Chemical Technology,",6
35,35,35,,"Hyderabad, ex officio ;(k))the Secretary, Oil Industry Development Board, ex officio ;(l)) the President of the Board, ex officio ;(m)) the Director of the Institute , ex officio ; and(n)) persons, not less than two but not exceeding four, representing the private entities in the field of petroleum sector operating in the country, to be nominated by the Chairperson.(3)) The Registrar of the Institute shall be the ex officio Secretary of the General Council.(4)) The Chairperson shall have the power to invite any person who is not amember of the General Council to attend its meeting but such invitee shall not be entitled to vote.",6
36,36,36,,"16. Powers and functions of General Council. —Subject to the provisions of this Act, the General Council shall have the following powers and functions, namely:—(a)) review from time to time the broad policies and program mes of the Institute and to suggest measures for the improvement, development and expansion of the Institute thereof;(b)) consider the annual statement of accounts including abalance-sheet together with the audit report thereto and the observations of the Board of Governors thereon and to suggest improvements in fiscal management of",7
37,37,37,,"the Institute;(c)) review and evaluate overall quality and effectiveness of the Institute and to advise measures for improvement of performance and for confidence-building between the Institute and itsstakeholders;(d)) provide credibility, aura, connectivity and contacts for the Institute especially with regard to student placement and resource mobilisation;(e)) advise the Institute and its Board in respect to new cutting edge areas of technology in the domain of energy and hydrocarbon development including oil, gas, renewable and",7
38,38,38,,"non-renewableenergy, etc., that the Institute needs to pursue, as well as in respect of any other matter referred to it by the Board for advice; and(f)) advise the Institute and its Board in respect of the advanced areas of technology in the field of petroleum sector covering the entire hydrocarbon value chain as well as in respect of any other matter that may be referred to it for advice by the Board.",7
39,39,39,,17. Senate.— The Senate of the Institute shall be the principal academic body and its composition shall be such as may be provided by the Statutes.,7
40,40,40,,"18. Functions of Senate. —Subject to the provisions of this Act, the Statutes and the Ordinances,the Senate shall have the control and general regulation, and be responsible for the maintenance of standards of instruction, education and examination in the Institute and shall exercise such other powers and perform such other duties as may be conferred or imposed upon it by the Statutes.",7
41,41,41,,19. President of Board. —(1)) The President shall ordinarily preside at the meetings of the Board and at the Convocations of the Institute.(2)) It shall be the duty of the President to ensure that the decisions taken by the Board areimplemented.(3)) The President shall exercise such other powers and perform such other duties as may be assigned to him by this Act or the Statutes.820. Director. —(1)) The Director of the Institute shall be appointed by the Central Government in such manner and on such terms and conditions as may be provided by the,7
42,42,42,,"Statutes:Provided that the first Director shall be appointed by the Central Government on such terms and conditions as it deems fit, for aperiod not exceeding one year from the date the first Statutes come into force.(2)) The Director shall be the principal academic and executive officer of the Institute and shall be responsible for the proper administration and academic performance of the Institute and for imparting of instruction and maintenance of discipline therein.(3)) The Director shall submit annual reports and accounts to the Board.(4)) The Director shall exercise such other powers and perform such other duties as may be assigned to him by this Act, the Statutes or the Ordinances.",7
43,43,43,,"21. Registrar. —(1)) The Registrar of the Institute shall be appointed in such manner and on such terms and conditions as may be provided by the Statutes and shall be the custodian of records, the common seal, the funds of the Institute and such other property of the Institute as the Board shall commit to his charge.(2)) The Registrar shall act as the Secretary of the General Council, the Board, the Senate and such committees as may be provided by the Statutes.(3)) The Registrar shall be responsible to the Director for the proper discharge of his",8
44,44,44,,"functions.(4)) The Registrar shall exercise such other powers and perform such other duties as may be assigned to him by this Act, the Statutes or by the Director.",8
45,45,45,,"22. Powers and duties of other authorities and officers. —The powers and duties of authorities and officers, other than those hereinbefore mentioned, shall be determined by the Statutes.",8
46,46,46,,"23. Grants by Central Government. —For the purpose of enabling the Institute to discharge its functions efficiently under this Act, the Central Government may, after due appropriation made by Parliament by law in this behalf, pay to the Institute such sums of money and in such manner as it may think fit.",8
47,47,47,,"24. Fund of Institute. —(1)) The Institute shall maintain afund to which shall be credited—(a)) all moneys provided by the Central Government;(b)) all fees and other charges;(c)) all moneys received by the Institute by way of grants, gifts, donations, benefactions,bequests or transfers; and(d)) all moneys received by the Institute in any other manner or from any other source.(2)) All moneys credited to the fund shall be deposited in such banks or invested in such manner as may be decided by the Board.(3)) The fund shall be applied towards meeting the expenses of the Institute including expenses incurred in the exercise of its powers and discharge of its duties under this Act.",8
48,48,48,,"25. Setting-up of endowment fund. —Notwithstanding anything contained in section 24, the Institute may,—(a)) set-up an endowment fund and any other fund for aspecified purpose; and(b)) transfer money from its fund to the endowment fund or any other fund.",8
49,49,49,,"26. Budget of Institute. —The Institute shall prepare, in such form and at such time every year, abudget in respect of the financial year next ensuing, showing the estimated receipts and expenditure of the Institute and shall forward to the Central Government such number of copies thereof as may be provided by the Statutes.",8
50,50,50,,"27. Accounts and audit. —(1)) The Institute shall maintain proper accounts and other relevant records and prepare an annual statement of accounts, including the balance-sheet, in such form as may9 be prescribed by the Central Government in consultation with the Comptroller and Auditor-General ofIndia.(2)) The accounts of the Institute shall be audited by the Comptroller and Auditor-General of India and any expenditure incurred by him in connection with such audit shall be payable by the Institute to the Comptroller and Auditor-General of India.(3))",8
51,51,51,,"The Comptroller and Auditor-General of India and any person appointed by him in connection with the audit of the accounts of the Institute shall have the same rights, privileges and authority in connection with such audit as the Comptroller and Auditor-General of India has in connection with the audit of the Government accounts, and, in particular, shall have the right to demand the production ofbooks, accounts, connected vouchers and other documents and papers and to inspect the offices of theInstitute.(4)) The accounts of the Institute as",8
52,52,52,,certified by the Comptroller and Auditor-General of India or any other person appointed by him in this behalf together with the audit report thereon shall be forwarded annually to the Central Government and that Government shall cause the same to be laid before each House of Parliament.,8
