,Unnamed: 0,Title,Paragraph Text,Page No
0,0,SECTIONS,short title extent and commencement,1
1,1,SECTIONS,declaration a to expediency of union action,1
2,2,SECTIONS,de fi ni ti ons chapter and allotment,1
3,3,SECTIONS,eligibility to participate in auction and payment of fee,1
4,4,SECTIONS,allotment of mine to government company or corporation,1
5,5,SECTIONS,central government to act through nominate authority,1
6,6,SECTIONS,power to certain schedule i coal mine by central government,1
7,7,SECTIONS,nominate authority to issue vest order or allotment order,1
8,8,SECTIONS,priority of dis bursal of proceeds chapter of right and obligation of prior allot te es,1
9,9,SECTIONS,of movable property use in coal mining operation,1
10,10,SECTIONS,discharge or adoption of t party contract with prior allot te es,1
11,11,SECTIONS,provision in relation to secure creditor,1
12,12,SECTIONS,void alienation a permit security interest,1
13,13,SECTIONS,liability of prior allot te es,1
14,14,SECTIONS,commissioner of payment to be appoint and his power,1
15,15,SECTIONS,valuation of compensation r payment to prior allottee chapter of the central government after the appoint date,1
16,16,SECTIONS,responsibility of central government after appoint date,1
17,17,SECTIONS,central government to appoint designate custodian,1
18,18,SECTIONS,power and function of designate custodian in respect of schedule coal ar ra,1
19,19,SECTIONS,power of central government to approve certain,2
20,20,SECTIONS,acquisition of land,2
21,21,SECTIONS,rea li sat ion of additional levy,2
22,22,SECTIONS,penalty for certain of fence,2
23,23,SECTIONS,penalty for failure to comply with direction of central government,2
24,24,SECTIONS,of fence by company,2
25,25,SECTIONS,cognizance of of fence,2
26,26,SECTIONS,dispute settlement and bar of jurisdiction of civil court,2
27,27,SECTIONS,protection of action take in good faith,2
28,28,SECTIONS,act to have override effect,2
29,29,SECTIONS,amendment of certain act contain in schedule,2
30,30,SECTIONS,power to make rule,2
31,31,SECTIONS,power to remove difficulty,2
32,32,SECTIONS,repeal and saving schedule coal mine special provision act no of march act to provide for allocation of coal mine and vest of the right title and interest in and over th eland and mine infrastructure together with mining lease to successful bidder and allot te es with a view to ensure continuity in coal mining operation and production of coal and for pro mo ting optimum of coal resource consistent with the requirement of the country in,2
33,33,SECTIONS,national interest and for matter connect t herewith or incidental thereto whereas the supreme court t date august read with it order date have cancel the allocation of coal block and issue direction with regard to such and the central government in pursuance of the say direction have to take immediate action to implement the say order and whereas it be expedient in public interest for the central government to take immediate action to allocate coal mine to successful bidder,2
34,34,SECTIONS,and allot te es keep in view the energy security of the country and to mi ni mise any impact on core sector such a steel cement and power utility which are vital for the development of the nation and whereas parliament be competent to legislate under entry of list i of the seventh schedule to the constitution for regulation of mine and mineral development to the extent to which such regulation and development under the control of union be declare by parliament by law to be ex the public interest be it enact by parliament in the sixty sixth year of the republic of a follow chapter i,2
35,35,SECTIONS,short title extent and commencement this act may be call the coal mine act it to the whole of it shall be deem to have come into force on the day of,3
36,36,SECTIONS,declaration a to of union action it be hereby declare that it be expedient in the public interest that union should take action for the development of schedule i coal mine and extraction of coal on continuous basis for optimum,3
37,37,SECTIONS,definition in this act unless t he context otherwise require a additional levy mean the additional levy a determine by the supreme court in writ petition criminal no of a two hundred and ninety five rupee per metric ton ne of allotment order mean the allot men t order issue under section appoint date in relation to i schedule i coal mine exclude schedule coal mine shall be the day of sept ember be the date on which the allocation of coal block to prior,3
38,38,SECTIONS,allot te es stood can celled schedule coal mine shall be the day of be the date on which the allocation of coal block to prior a shall stand can celled in pursuance of the order of the supreme court date the sept ember pass in writ petition criminal no of bank shall have the same meaning a assign to it in clause c of the se cur it is at ion and reconstruction of financial asset and enforcement of security interest act of e coal mining operation mean,3
39,39,SECTIONS,any operation under taken f or the purpose of win company shall have the same meaning a assign to it in clause of section of s act of g corporation shall have the same meaning a assign to i t in clause of sect io n of act of h financial institution shall have the same meaning a assign to it in clause m of section the se cur it is at ion and reconstruction of financial asset and enforcement of security interest act of,3
40,40,SECTIONS,i government company shall have the same meaning a assign to it in clause of sect io of the company act of j mine infrastructure include mining infrastructure such a tangible asset use for coal mining opera ti ons be civil work workshop immovable coal win equipment pavement electrical system communication system relief cent re site fix installation coal h and ling arrangement crush and convey system railway,3
41,41,SECTIONS,shaft incline underground transport system haul system except movable equipment unless the same be embed in land for permanent beneficial enjoyment thereof land de mar ca ted for afforestation and land for rehabilitation and resettlement of person affected by coal mining operation sunder the relevant lawk nominate authority mean the authority nominate by the cent government under section no ti fi ca ti on mean a notification pub li shed in the official mean prescribe d by,3
42,42,SECTIONS,rule make under this prior allottee mean prior allottee of schedule i coal mine a list therein who have been allot ted coal mine between and day of march whose allotment have been can celled pursuant to the judgment of the supreme court date the august and i t order da ted sept ember include those allotment which may have be de allocate prior to and during the pendency of the writ ti on criminal of in case a mining lease have be execute in of a,3
43,43,SECTIONS,third part y subsequent to such allocation of schedule i coal mine then the third party shall be d to be the schedule mean a schedule append to this schedule i coal mine mean i all the coal mine and coal block the allocation of which be cancel by the judgment da ted august and it order date sept ember pass in writ petition criminal of include those allotment which may have be de allocate prior to and during the pend of the say writ,3
44,44,SECTIONS,all the coal bearing land acquire by the prior allottee and land in or adjacent to the coal mines use for coal mining operation acquire by the prior any exist mine a define in a use schedule coal mine mean the forty two schedule i coal mine list in schedule be the coal mine in relation to which the order of the supreme court date d ay of sept ember be mad er schedule coal mine mean the thirty two schedule i coal mine list in,3
45,45,SECTIONS,schedule or any other schedule i coal mine a may be notify under sub section of section secure creditor shall have the same meaning a assign to it in clause of section of the se cur it is at ion and reconstruction of financial asset and enforcement of security interest of secure debt shall have the same meaning a assign to it in clause of section of these cur it is at ion and reconstruction of financial asset and enforcement of security interest of,3
46,46,SECTIONS,security interest shall have the same meaning a assign to it in clause of section of the se cur it is at ion and reconstruction of l asset and enforcement of security interest of v specify end use mean any of the follow end us and the expression shall with it grammatical vari a ti ons be construe accordingly i production of iron and generation of power include the gen er at ion of power for captive washin g of coal obtain from a,3
47,47,SECTIONS,such other end use a the central government may by notification vest order mean the vest in g order issue under section word and expression use herein and not define but define in the coal bearing are as acquisition and development act of the mine and mineral development and regulation a of and the coal mine national is at ion act of any rule or regulation make thereunder shall have the meaning respectively assign to them in those and allotment,3
48,48,SECTIONS,eligibility to participate in auction and payment of fee subject to the provision of schedule i coal mine shall be allocate by way of public auction in accordance with such rule and on the payment of such fee which shall not exceed five e e a may be subject to the provision in sub section of this section and section the central government may for the purpose of grant reconnaissance permit prospect or mining lease in respect of any area contain c select any of,5
49,49,SECTIONS,the follow company through auction by competitive bidding on such term and a may be a a government company or corporation or a joint venture company form by such company or corporation or between the c government or the state government a the case may be or any other incorporate in orb a company or a joint venture company form by two or more carry on coal mining operation in in any form either for own consumption sale or for any other purpose in accordance,5
50,50,SECTIONS,with the permit prospect or mining lease a the case may be and the state government shall grant such reconnaissance permit prospect or mining lease in respect of any ar ea contain coal to such company a select through auction by bidding under this subject to the provision of section the follow person who such norm a may shall be eligible to bid in an auction o f schedule coal mine and schedule coal mine sand to engage in coal mining operation in the,5
51,51,SECTIONS,event they ar e successful bidder namely a a company engage in specify end use include a company have a coal linkage which ha sma de such i a may be a company with a coal linkage include any such company whose application is pending with the central government on the da te of commencement of this a joint venture company form by two or more ani es have a common specify end use and be independently eligible to b id in accordance with this a government company or,5
52,52,SECTIONS,corporation or a joint venture company form by such company or corporation or with any other company have c om mon spec end use provided that nothing contain in sub section shall apply to this sub a prior allottee shall be eligible to participate in the auction process subject to payment of the additional levy within such period a may be prescribe d and if the prior allottee have not pa id such levy then the prior allottee it promoter or any of it company of such prior allottee shall not be eligible to,5
53,53,SECTIONS,bid either by its el f or by way of a joint venture any prior allottee who be convict for an of fence relate to coal block allocation and imprisonment for more than three year shall not be eligible to participate in the auction,5
54,54,SECTIONS,allotment of mine to government company or corporation notwithstanding contain in sub section and of section the central government may allot a schedule i coal mine to a government company or corporation or to a joint venture between two or more government company or corporation or to a company which have bee n award a power project on the basis of competitive bid for tariff include ultra me ga power project from specify schedule i coal mines by make an allotment order in accordance with,6
55,55,SECTIONS,such rule a may be and the state government shall grant a reconnaissance permit prospect or mining lease in respect of any area contain coal to such company or corporation provided that the government company or corporation may carry on coal mining in any form either for it own consumption sale or for any other purpose in accordance with the permit prospect mining lease a the case may be provide far that no company other than a government company or corporation shall hold more than twenty six,6
56,56,SECTIONS,per cent of the pa id up share capital in the government company or corporation or in the joint venture between a government company or corporation either directly or through any of its sub sidi ar y company or associate company provided also that a joint venture of any two or more government company or corporation shall from alienate or transfer any interest except the take of loan or advance from a ban kor financial institution in the joint venture of whatsoever nature include owner hip in of a,6
57,57,SECTIONS,no allotment under sub section shall be make to a prior allottee if that allottee have not made the payment of the additional levy within the s period,6
58,58,SECTIONS,central government to act through nominate authority the central government shall appoint an officer not below the rank of a joint secretary to the government of a the nominated authority who shall act for and on behalf of the central government for the purpose of this act and shall exercise power a may be the nominate authority may engage any expert have such qualification and experience and on such term and condition a may be to make recommendation to the authority for the conduct of,6
59,59,SECTIONS,auction and in draw up of the vest order or allotment order in rel at ion to schedule i the central government shall act through the nominate authority for t he follow a conduct the auction process and allotment with the assistance of execution of the vest order for transfer and vest of schedule i coal mine pursuant to execute the allotment order for any government company or corpus ti on in pursuance of section record and mutate in corp ore al right of,6
60,60,SECTIONS,whatsoever nature include consent sperm is si ons permit a p grant registration se collection of auction proceeds adjustment of preferential payment and transfer of amount to the respective state government where schedule i coal mine be locate in accordance w of this the nominate authority shall complete the auction or execute the allotment order of schedule mine within such time and in accordance with such rule a may be the central government may appoint such other,6
61,61,SECTIONS,officer and staff a it may think fit to assist the nominated the salary and allowance and other term and condition of service of the nominate authority and such other officer and staff appoint under this section sh al l be such a may be the nominate authority shall be bound by the write direction give by the central govern men ton the of policy,6
62,62,SECTIONS,power to certain schedule i coal mine by cent government the central government may before notify the particular of auction mine identify from schedule mine a earmark for the s ame class of specify end the central government may in public interest by notification modify schedule coal mines by add any other schedule i coal mine for the purpose of specify end use,7
63,63,SECTIONS,nominate authority to issue vest order or allotment order the nominate authority shall notify the prior allot te es of schedule i coal mine to enable them to furnish information require for notify ing the particular of schedule i coal mine to be auction in accordance with s rule a may the information require to be furnish under sub section shall be furnish within a period of fifteen day s from the date of such a successful bidder in an auction conduct on a competitive basis in,7
64,64,SECTIONS,accordance with such may be shall be entitle to the vest of schedule i c mine for which it bid pursuant toa vest order drawn up in accordance with such the vest order shall transfer and vest upon the successful bidder the follow namely a all the right title and interest of the prior allottee in schedule i coal mine con ce with the relevant entitlement to a mining lease to be g rant by the state any statutory permit permission approval or,7
65,65,SECTIONS,consent require to undertake coal mining operation in schedule i coal mine if al read y issue to the prior right appurtenant to the approve min ing plan of the prior any right entitlement or interest not specifically cover under c la us es a to the nominate authority shall in consultation with the central government determine the floor price or reserve price in accordance with s rule a may be the successful bidder shall prior to the issuance and execution of a vest order,7
66,66,SECTIONS,furnish a performance bank guarantee for an amount a notify in relation to schedule i coal mine auction to such bidder within such time form a manner a may be after the issuance of a vest order unde r this section and it filing with the central government and with the appropriate authority designate by the respective state government the successful bidder shall be entitle to take possession of the schedule i coal mine without let or upon the execution of the vest order the successful bidder of,7
67,67,SECTIONS,the schedule i coal mine shall beg ran ted a prospect or a mining lease a applicable by the concerned state government inaccordance with the mine and mineral development a regulation a of a government company or corporation or a joint venture company form by such company or corporation or between the central government or the state government a the case may be or any other company incorporate in allot a schedule i coal mine shall be grant a prospect or a mining lease a,7
68,68,SECTIONS,applicable by the concerned state government in accordance with the mine develop and regulation act of in rel at ion to schedule coal mine the successful bidder which be a prior allottee shall continue coal mining operation after the appoint date in term of the approve mining plan till the mining lease in term of sub section be grant upon the g rant of a vest order and to that extent the successful bidder shall be deem to have be grant a mining lease till the execution of,7
69,69,SECTIONS,the mining lease in term of the say sub in relation to schedule coal mine the government y or corporation which be a prior allottee can continue coal mining operation after the appoint date in term of the approve mining plan till the mining lease in term of sub section be grant upon execution of the allotment order and to that e the allottee shall be deem to have be grant a mining lease till the execution of the mining lease i n term of the say sub the provision of sub,7
70,70,SECTIONS,section and and sub section to both inclusive of this section a applicable to a vest order shall mu tat is mu tan dis be also applicable to an allotment order,7
71,71,SECTIONS,priority of dis bursal of proceeds the proceeds arise out of land and mine infrastructure in relation to a schedule i coal mine shall be disburse maintain inter the priority of payment inaccordance with the relevant law and s rule a may be a payment to sec creditor for any portion of the secure debt in relation to a schedule mine which be unpaid a on the date of the vest compensation payable to the prior allottee in of the schedule i coal mine chapter of r and obligation of prior allot te es,8
72,72,SECTIONS,of movable property use in coal mining operation a successful bidder or allottee in respect of schedule i coal mine may negotiate with prior allottee to own or such movable property use in coal mining operation on such term and condition a may be mutually agreed to by where a successful bidder or allottee be not with any movable property of a schedule i coal mine then he be not bound by any liability or ga ti ons arise out of such ownership or obligation or,8
73,73,SECTIONS,liability which shall continue to remain with the prior in the event that the successful bidder or allottee be unable to satisfactorily negotiate with the prior allottee or any third party who have a contract with the prior allottee for the movable property it shall be the obligation of the prior allottee or the third party to remove such movable property within a period not exceeding thirty day from the date of the vest order or the allotment order a the case may be and the successful bidder or allottee shall not be,8
74,74,SECTIONS,liable f or any damage to such a successful bidder or allottee which have elect not to purchase or transfer or continue to use the movable property refer to in sub section shall prior to the execution of the vest order or the allotment order a the case may be declare to the nominate authority that he intend to move and store such movable property of the prior allottee or such third party and after the date of the vest order or the allotment order a the case may be the successful bidder or allottee shall be,8
75,75,SECTIONS,entitle to move and store such movable property so a not to cause any for coal mining operation if a prior allottee or such third party which have contract with the prior allottee for it movable property to remove the movable property which the successful bidder or allottee have elect not to purchase or use in accordance with sub section then after the period of seventy five day from the vesting order or the allotment order a the case may be a successful bidder or allottee shall be entitle to dispose of,8
76,76,SECTIONS,such movable property which may be physically locate within schedule i coal mine the successful bidder or the allottee shall in such event be entitle to appropriate the sale proceeds of such movable property dispose of to pay for any cost incur by the successful bidder or allottee for the removal storage sale and disposal of such movable property a a first charge over the sale pro of such movable property provided that the remain sale proceeds after appropriation of cost shall be pa id by the successful bidder or allottee,8
77,77,SECTIONS,to the central government to war d any compensation that may be payable to the such movable property sell upon establishment of title to such movable property in accordance with such rule a m ay be far that if a third party contractor to the prior al lo own such movable property then such third party shall be entitle to prove it right to receive compensation from the sale proceeds of the movable property sell a per this sub section in accordance with s rule a may be,8
78,78,SECTIONS,dis cha or adoption of third party contract with prior allot te es notwithstanding anything contain in any other law for the time be in force a successful bidder or allottee a the case may be in respect of schedule i coal mine may elect to ado and continue such contract which maybe exist with any of the prior allot te es in relation to coal mining operation and the same shall constitute a novation for the residual term or residuum l performance of such contract provided that in such an eve the successful bidder,9
79,79,SECTIONS,or allottee or the prior allottee shall notify the nominated authority to include the vest of any contract ad opt by the successful in the event that a successful bidder or allottee elect not to adopt or continue with which have be enter into by the prior allot te es with third party in that case all which have not be adopt or continued shall cease to be enforceable against the successful bidder or allottee in relation to the schedule i coal mine and the remedy of such contract party shall be against the prior allot te es,9
80,80,SECTIONS,provision in relation to secure creditor the secure creditor of the prior allot te es which have any security interest in any part of the land or mine infrastructure of a schedule i c mine shall be entitle to a continue with such facility agreement and security interest with the prior allottee if such prior allottee be a bidder or allottee in the event that the prior allottee be not a successful bidder or allottee then the security interest of such secure creditor shall only be satisfied out of the,9
81,81,SECTIONS,compensation payable to such prior allottee to the extent determine in accordance with such rule a may be and the outstanding debt shall be er able from the prior the central government shall take into consideration the provision contain in section the manner in which the secure creditor shall be pa id out of the compensation in respect of any prior allottee,9
82,82,SECTIONS,void alienation and permit security interest any and all alienation of land and mine infrastructure and creation of any encumbrance of whatsoever nature thereon which relate to mine make by any prior allottee after the day of august shall be void save and except any register security interest and charge over the land and mine infrastructure a register by a bank os financial on or any her secure lender,9
83,83,SECTIONS,liability of prior allot te es notwithstanding anything contain in any other law for the time be in force no proceeding order of attachment distress receivership execution or the for the recovery of mon ey enforcement of a security or guarantee except a otherwise provide for under this act prior to the date of commencement of this act shall lie or be proceed far with and no remedy shall be available against the successful bidder or allot te e a the case may be or against th eland and mine,9
