,Unnamed: 0,Title,Paragraph Text,Page No
84,84,SECTIONS,infrastructure in respect of s i coal the proceeding a refer to in sub section shall continue a a personal remedy against the prior allottee but shall not be maintainable or c against the land or mine infrastructure of schedule i coal mine or the successful bidder or allottee pursuant to this every liability of any prior allottee in relation to a schedule i coal mine in respect of any period prior to the order or allotment order shall be the liability of such prior allottee and shall,9
85,85,SECTIONS,be enforceable against it and not against the successful bidder or al lo or the central all unsecured loan shall continue to remain the l of th e prior the additional levy impose against the prior allot te es of schedule coal mine shall continue to remain the liability of such prior allot te es and such additional levy shall be collect by the central government in manner a m ay be for the removal of t it be hereby declare that a no claim for wage bonus royalty,9
86,86,SECTIONS,rate rent tax provident fund pension gratuity or any other due in relation to a schedule i coal mine in respect of any period prior to the date of vesting order or allotment order a the case may be shall be enforceable against the central government or the successful bidder or th e allottee a the case may no award decree attachment or order of any court tribunal or r authority in relation to any schedule i coal mine pass prior to the date of commencement of this act in relation to the lan dand mine infrastructure of,9
87,87,SECTIONS,schedule i coal mine shall be enforceable against the central government or the successful bidder or the allottee a the case may no liability for the contravention of any provision of law for the time be in force relate to any act or omission prior to the date of vest order or allotment order a the case may be shall e against the successful bidder or al lo or the central government,9
88,88,SECTIONS,commissioner of payment to be appoint and his power for the purpose of dis bur sing the amount payable to the prior allot te es of schedule i coal mine the central government shall appoint an officer not below the rank of joint secretary to the government of to b e the commissioner of the central government may appoint such other officer and staff a it may think fit to assist the commissioner an d thereupon the commissioner may a ut ho rise one or more of such officer also to exercise all or any of the power,10
89,89,SECTIONS,by him under this any officer a ut ho rise by the commissioner to exercise any power may exercise those power in the same manner and with the same effect a if they have be on him directly by this act a by way of the salary and allowance and other term and condition of service of the commissioner and other officer and staff appointe d under this section sh al l be such a may be the central government shall within a period of thirty day from such date a may be,10
90,90,SECTIONS,notified pay to the commissioner for payment to the prior allottee an amount equal to the compensation determined by the nominate separate record shall be maintain by the commissioner in respect of each schedule i coal mine in relation to which payment have b make to him under this act,10
91,91,SECTIONS,valuation of compensation for payment to prior a the quantum of compensation for the land in relation to schedule i coal mine shall be a per the register sale deed lodge with the nominated authority in accordance with such rule a may be together with twelve per cent simple interest from the date of such purchase or acquisition till the date of the execution of the vesting order or the allotment order a the case may the quantum of compensation for the mine infrastructure in relation to schedule i,10
92,92,SECTIONS,coal mines shall be determine a per the write down value reflect in the statutorily audit balance sheet of the previous financial year in accordance with such rule and in such manner a may be if the successful bidder or allottee be a prior all of any of the schedule i coal mine then the compensation payable to such successful bidder or allottee shall be set off or adjust against the auction sum or the allotment sum payable by such successful bidder or allottee a the case may be for any of the schedule i coal,10
93,93,SECTIONS,the prior allottee shall not be entitle to compensation till the additional levy have be pa id chapter of the central government after the appoint date,10
94,94,SECTIONS,responsibility of central government after appoint date on and from the a p pointed date the central government or a company own by the central government shall be deem to have become the lessee or licensee of the state government in relation to each of the schedule coal mine in respect of which a mining lease or prospect have be grant prior to the date of commencement of this act a if a mining lease or prospect in relation to such coal mine grant to the central government or a company,10
95,95,SECTIONS,own by t he central government and the period of such lease or shall be the maximum period for which such lease or could have by the state government under the mineral concession rule and thereupon all the right sunder such mi ni lease include surface underground and other right shall be deem to have been transferred to and in the central government or a company own by the central on the expiry of the term of any lease or refer to i n sub section such,10
96,96,SECTIONS,lease shall be renew by the state government in consultation with the central government for the maximum period for which such lease or can be renew under the mineral concession a it be con side red expedient and necessary in the public interest and in view of the difficult situation which have arisen the power of the state government under the mine and and regulation act of to prematurely terminate a prospect or mining lease shall stand suspend in,10
97,97,SECTIONS,relation to schedule i coal mine for a period of one year from the date of commencement of this act or such other period a may be notify by the central government,10
98,98,SECTIONS,central government to appoint designate custodian on and from the appoint date if the auction or allotment of schedule i coal mine be not complete the central government shall appoint any person a a designate custodian to manage and operate such coal mine a may be no ti by the central the designate custodian shall act for and on behalf of the central government in respect of the notified coal mine under sub section to operate and manage such schedule i coal mine in such manner a may be notify till the completion of the auction of such coal mine or allotment under section and section read with section a the case may be,11
99,99,SECTIONS,power s and function of designate custodian in respect of schedule coal mine the desi gnat custodian appoint under sub section of section shall be entitle to take control and possession of all land in or adjacent to schedule coal mine and use for coal mining operation and the mine infrastructure in relation to schedule coal mine on be ha of the central the designate custodian may direct the prior allot te es or any other person in charge of the management of the schedule coal mine,11
100,100,SECTIONS,and coal mining operation immediately before the a p pointed date to p the requisite man power a may be necessary to ensure continuity in coal mining opera ti ons and production of the designate custodian shall receive to the exclusion of all other person any mo ni es due to schedule coal mine tan ding case where such receipt to a transaction make at any time before the appoint the designate custodian may call for any information record and document in relation to schedule coal mine and,11
101,101,SECTIONS,coal mining operation from an y or all such person who be in charge of the management and operation of such schedule coal mine prior to the appoint date and such per sons shall be bound to deliver to the designate custodian all such document in their custody re la ting coal the designate custodian may appoint such consultant or expert a may be necessary in relation to the management and opera ti on of schedule coal the designate custodian shall transfer the management and operation o f any,11
102,102,SECTIONS,schedule coal mines to such person in manner a may be the designate custodian shall have right liability and obligation a a prior allottee or a successful bidder in respect of coal mine entrust to it under section to be exercise and discharge din manner a may be the designate custodian shall have the power to perform such other function which may be consequential or incidental to the function s specify under this not with st an ding anything contain in any other law for,11
103,103,SECTIONS,the time be in force the design a ted custodian shall in exercise of it power or the performance of it function under this act be bound direction on question of policy a the central govern men t may give in write to it from time to time chapter arrangement,11
104,104,SECTIONS,power of central government to approve certain arrangement a successful bidder or allottee or coal linkage holder shall with the prior approval of the central government and in accordance with such rule a may be be entitle to enter into certain agreement or arrangement with other successful bidder or allottee or coal linkage holder a the case may be for optimum of coal mine for th e same end us in the public interest an d to achieve cost a successful bidder or allottee may also use,12
105,105,SECTIONS,the coal mine from a particular schedule i coal mine for any of it plant engage in common specify end us in accordance with s rule a may,12
106,106,SECTIONS,acquisition of land all exist land acquisition proceeding under the right to fair compensation and transparency in land acquisition rehabilitation and resettlement of in relation to schedule i coal mine shall continue in respect of such area of land inaccordance with the provision of the say all such area of land which be not subject matter of land acquisition in relation to the coal mine under the right to fair compensation and transparency in land acquisition rehabilitation,12
107,107,SECTIONS,and resettlement act of may be proceed with by the central government in term of the coal bearing area acquisition and development act of the state government which have initiate land acquisition proceeding under provision of the right to fair compensation and transparency in land acquisition rehabilitation and resettlement of and all such land which be also subject matter of the say act in respect of schedule i coal mine shall a not transfer any land to the prior,12
108,108,SECTIONS,allot te es which have be acquire er the say continue the land acquisition pro ce till the appoint da tec for such schedule i coal mine which have not in the successful bidder or the allottee as the case may be by the appoint date continue the land acquisition proceeding for and on be half of the central upon the vest or the allotment a the case may be after the appoint date continue such land acquisition proceeding on behalf of the bidder or the allottee,12
109,109,SECTIONS,rea li sat ion of additional levy if a prior allottee of schedule coal mine to deposit the additional levy with the central government within the specify time then such additional levy shall a the of land revenue,12
110,110,SECTIONS,penalty for certain of fence if any p er son a or cause any impediment in take possession or in the management and operation of the schedule i coal mine by the central government or the designate custodian orb to deliver to the designate custodian any book of register or any other document in his custody relate to schedule i coal mine and coal mining operation in respect of the management of which the designate c us to dian have be appoint orc or misuse any mine a structure,12
111,111,SECTIONS,or coal s tock any property of such coal mine or remove or it he and any officer in default of the company shall be punishable with imprisonment for a term which may extend to two year or with the minimum fine of one rupee per day and in the case failure with a maximum fine of two rupee f or every day during which the failure con ti nu es or with both depend upon the nature of the of fence,12
112,112,SECTIONS,penalty for failure to comply with direction of central government if any person to comply without reasonable cause with a direction give by the central government or nominated authority or the designate custodian he shall be punishable with a fine of one rupee and in the case of continue failure with a maximum fine of two rupee for every day during which the failure con ti nu es depend upon the nature of the of fence,13
113,113,SECTIONS,of fence by company where an of fence under this act have be commit by a company every person who at the time the o be commit be in charge of and be responsible to the company for the conduct of business of the company a well a the company shall be deem to be guilty of the of fence and shall be liable to be proceed a g a in st and punish accordingly provided that nothing contain in this sub section shall render any such person liable to any punishment if he prof that the of fence be commit without his,13
114,114,SECTIONS,knowledge and that he have due diligence to prevent the commission of such notwithstanding anything contain in sub section where any of fence under this act have been commit ted by a company and it be prove that the of fence have be commit with the consent or connivance of or be attributable to any neglect on the part of any director manager secretary or other officer of the company such director manager secretary or other officer shall be deem to be guilty of that of fence and shall be liable to be proceed a g a in st and punish accordingly,13
115,115,SECTIONS,cognizance of of fence no court shall take cognizance of any of fence punishable under this act or any rule make thereunder except upon complaint in write make by a person a ut ho rise in this behalf by the central government or nominate authority or the desi gnat custodian,13
116,116,SECTIONS,dispute settlement and bar of jurisdiction of civil court any dispute arise out of any action of the central government nominate authority or commissioner of payment or design a ted custodian or any dispute between the successful bidder or allottee and prior allottee arise out of any issue connect with the act shall be adjudicate by the tribunal constitute under the coal bearing are as ti on and development act of where the central be of the opinion that any dispute arise out of any,13
117,117,SECTIONS,issue connected with the act or be apprehend and th e dispute should be adjudicate by the tribunal refer red to in sub section then the central government may by order in write re the dispute or any matter appear to be connect with or relevant to the dispute to the tribunal for the tribunal refer to in sub section shall after hearing the party to the dispute make an award in write within a period of ninety day from the on or reference of the on and from the,13
118,118,SECTIONS,commencement of the act no court or other authority except the supreme court and a high court shall have or be entitle to exercise any jurisdiction power or authority in relation connect with the act,13
119,119,SECTIONS,protection of action take in good faith no suit prosecution or other legal proceed shall lie against the central government nominate authority commissioner of payment or design a ted custodian or any person act on their behalf in respect of anything which be do or intend to be don good faith under this act,13
120,120,SECTIONS,act to have override effect the provision of this act shall have effect notwithstanding anything in consist en t therewith contain in any other law for the time be in force or in any instrument have by virtue of any such law,13
121,121,SECTIONS,amendment of certain act c in schedule on and from the date of commencement of this act the coal mine national is at ion act of and the mine de velo and regulation act of shall stand amend in the er provided in schedule,13
122,122,SECTIONS,power to make rule the central government may by no ti fi ca ti on in the official gazette and subject to the condition of previous publication make rule for carry out the provision of in particular and without prejudice the generality of the forego power such rule may provide for all or any of the follow matter namely a the manner of allocation of schedule i coal mine by way of public auction and detail of fee sunder sub section of section the term and condition for grant,13
123,123,SECTIONS,reconnaissance permit prospect or mining lease and the manner and condition of competitive bidding under sub section of section norm to become eligible to bid in an auction and the amount of investment in respect of a company have a coal linkage under sub section of s the period within which the payment of additional levy by the prior allottee under subsection of section the allotment order to make allocation to a government company or corporation under subsection of section,13
124,124,SECTIONS,the power of the nominate authority under sub section of section the manner of auction or allotment of schedule i coal mine and execution of the vest or allotment order under sub section of section the salary and allowance and other term and condition of service of the nominated authority and other officer and staff under sub section of section the manner of notify the particular of schedule i coal mine to be auction and furnishing of require information by the prior allot te es under sub,13
125,125,SECTIONS,section of section the manner of conduct auction and draw of a vest order under sub section of section determination of floor price by the nominate authority under sub section of section the form and manner of furnish of bank guarantee and the time within which such furnishing of bank guarantee under sub section of section the manner of of payment under section the manner of establish title of movable property by the prior allottee or third party,13
126,126,SECTIONS,a contract with the prior allottee for the movable property under the first proviso to subsection of section the manner of receive compensation from the sale proceeds of the movable property under the second proviso to sub section of section the manner in which the secure creditor pa id out of the compensation in r of any prior allottee under sub section of section the manner of collection of additional levy by the central government from the prior allot te es of schedule coal mine under,13
127,127,SECTIONS,sub section of s the salary and al lowan ce and other term and condition of service of the commissioner and other officer and staff under sub section of section the manner of determination of compensation payable to prior allottee and the lodge of registered sale de with the nominate authority under sub section of section the method of determination of compensation for mine infrastructure in relation to schedule it reflection in the statutorily audit balance sheet,13
128,128,SECTIONS,under sub section of sec ti on the manner of transfer of the management and operation of any schedule coal mine by the design a ted custodian under sub section of section the manner of exercise and discharge the right liability and obligation by the design a ted custodian under sub section of section the manner of provide agreement or arrangement for optimum of coal mine end us under sub section of section the manner of usage of coal mine by a,13
129,129,SECTIONS,bidder or allottee for any of it plant under subsection of section any other matter which be require d to be or may be every rule make and every notification issue by the central government under this act shall be laid a soon a may be after it be make before each house of parliament while it be in session for a total period of thirty day which may be comprise in one session or in two or more successive session and if before the expiry of the session ate ly follow the session or the,13
130,130,SECTIONS,successive session aforesaid both house agree in make any modification in the rule or notification or both house agree that the rule or notification should not be make the rule or notification shall thereafter e effect only in form or be of no effect a the case may be so however that any such modification or annulment shall be without prejudice to the validity of anything previously do under that rule or notification,13
131,131,SECTIONS,power to remove difficulty if any difficulty ar is es in give effect to the provision of this act the central government may by order publish in the official gazette make such provision snot inconsistent with the provision of this act a appear to it to be necessary or expedient for removing the d that no such order shall be make after the expiry of a period of two year from the da te of commencement of this every order make under this section shall a soon a may be after it be make be laid b each house of parliament,15
132,132,SECTIONS,repeal and save the coal mine special provision second or di of be hereby notwithstanding such repeal anything do or any action take under the say ordinance shall without prejudice to the judgment of the supreme court date august and it order date pass in writ petition criminal no of be deem to have be do or taken under th e pon ding provision of this section name of coal mine block name of,15
133,133,SECTIONS,prior allottee state where ta dich er la i power generation a nest ti pali power generation pun kula chil ka power generation power generation aru na chal mineral dev trading corporation aru na chal sa yang aes energy raj ga mar dip side de a v na ra a pi is pat power tech,15
134,134,SECTIONS,sponge ma nu fact ur ers consortium coal field tar ai mar aluminium company da ti ma bin ani cement tara mineral development corporation limited gare palma sector i mineral development corporation limited shank ar pur mineral development corporation limited sond hia mineral development corporation limited par sa,15
135,135,SECTIONS,state electricity board central coal limited is pat power state electricity board patu ria state electricity board sar ya power electro therm industry west of um aria sai ni k finance and industry ear lier morga mineral development corporation,15
136,136,SECTIONS,gare palma sector goa industrial development corporation ma dan pur south hin dust an zinc ak sh ya investment steel power electricity corporation steel power coal mining consortium of five i is pat go da vari synergy nako dais pat van da na global shree power is pat is pat go da vari synergy na koda,15
137,137,SECTIONS,is pat van da na global shree power is pat gare palma gare palma gare palma power now steel power gare palma power now steel power gare palma strip limited now steel power gare palma steel power sponge iron fat eh pur east,15
138,138,SECTIONS,ya vat mal energy power gen power green infrastructure morga i state mining corporation limited morga state mineral corporation limited morga state mineral corporation limited gare palma sector maha rash tra state mining ta mil state electricity board gare palma mo net is pat raj ga mar dip side sou thof,15
139,139,SECTIONS,na la mon net is pat and energy top worth steel ta lai pali national thermal power industry gare palma alloy steel now sar da energy and mineral limited par sa east raj as than raj ya ut pa dan ni gam north rat hi kan ta ba san raj as than raj ya ut pa dan ni gam shree rad he industry,15
140,140,SECTIONS,fat eh pur is pat and power industry ma dan pur north ultra tech singh al enterprise van da na energy steel industry steel captive coal mining consortium of five brin da infrastructure sa sai infrastructure infrastructure sere gar ha arc el or mitt al,15
141,141,SECTIONS,power pa tal east power and steel sa ria koi yat and raj ya ni gam pat na sponge iron technology mahua gar hi cal cut ta electricity supply corporation infrastructure capital chi tar pur corporate is pat alloy sa harp ur jam ar pa ni da mo dar valley corporation north smokeless fuel,15
142,142,SECTIONS,par bat pur central electrosteel casting es sar power central es sar power mineral development corporation north power sahib tu bed hind alco industry ta ta power company moit ra north is pat pavan jay steel power casting alloy power,15
143,143,SECTIONS,state electricity board close mine state mineral development corporation ra uta close mine state mineral development corporation bur ak hap small patch state mineral development corporation pind ra state mineral development corporation lat eh ar state mineral development corporation pa tra tu state mineral development corporation,15
144,144,SECTIONS,state mineral development corporation jo ge sh war state mineral development corporation steel power amar kon da murga dan gal steel and power sponge iron ur ma state electricity board state mineral development corporation steel power steel metal and mineral,15
145,145,SECTIONS,trading corporation raj ha ra north central eastern iron steel limited ni la chal iron power is pat national thermal power baria tu national thermal power baria tu south national thermal power national thermal power coal limited pat simal national thermal power coal limited,15
146,146,SECTIONS,central pun jab state electricity board rash tri ya is pat ni gam limited te nu ghat rash tri ya is pat ni gam limited rung ta mine limited rung ta mine limited ko hi no or steel p cho rit and ti li a ya rung ta mine limited sun flag iron steel si tan ala steel authority of ga nesh pur ta ta steel thermal energy ba dam te nu ghat ni gam limited raj bar te nu ghat,15
