,Unnamed: 0,Title,Paragraph Text,Page No
108,108,SECTIONS,penalty for manufacture or sale of non standard weight or measure every person who ma nu fact ur es or cause to be manufacture or sell or offer ex po e or posse for sal e any weight or measure which a do not conform to the standard of weight or measure specify by or under this act orb which bear thereon any inscription of weight measure or number which do not conform to the standard of weight measure or numeration specify by or under this act except where he is permitted to do so under this act shall be punish,10
109,109,SECTIONS,with a fine which may extend to twenty thou san drupe es and for the second or subsequent of fence with imprison for a term which may extend to three year or with fine or with both,10
110,110,SECTIONS,penalty for make any transaction deal or contract in contravention of the whoever make any transaction deal or contract in contravention of the st anda and measure specify under section shall be punish with fine which may extend to ten thousand rupee and for the second or subsequent of fence with imprisonment for a term which may extend to one year or with fine or with both,10
111,111,SECTIONS,penalty for quote or publish ing of non standard unit whoever viol ates section be punish with fine which may extend to ten thousand rupee and for the second or subsequent of fence with imprisonment for a term which may extend to one year or with fine or with both,10
112,112,SECTIONS,penalty for transaction in contravention of standard weight or measure who eve ra in sell any article or thing by weight measure or number or cause to be de livered to the purchaser any quantity or nu of that article or thing less than the quantity or number contracted for or pa id for orb in render any service by weight measure or number render that service less than the service contract for or pa id for orc in buy ing any article or thing by weight measure or number fraudulently or ca us es to be,10
113,113,SECTIONS,receive any quantity or number of that article or thing in excess of the quantity or number contracted for or pa id for in obtain any service by weight measure or number that service in excess of the service contract for or pa id for shall be punish with fine which may extend to ten thousand rupee and for the second or subsequent of fence with imprisonment for a term which may extend to one year or with fine or with both,10
114,114,SECTIONS,penalty for non production of document whoever be require by or under this actor the rule make thereunder to submit return maintain any record or register or be require by the director or the controller or any legal metrology officer to produce before him for inspection any weigh tor re or any document register or other record relate thereto om its or without any reasonable excuse so to do shall be punish with fine which may extend to five thousand rupee and for the second or subsequent of fence with imprisonment for a te which may extend to one year and also with fine,10
115,115,SECTIONS,penalty for failure to get model approve whoever or om its to submit model of any weight or measure for approval shall be punish with fine which may extend to twenty thousand rupee sand for the second or subsequent of fence with imprisonment for a term which may extend to one yea rand also with fine,10
116,116,SECTIONS,penalty for use of unverified weight or measure whoever sell dis tri but es or otherwise transfer or us any unverified weight or measure shall be punish with fine which shall not be less than two thousand rupee but which may extend to ten thousand rupee and for the second or subsequent of fence with imprisonment for a term which may extend to one year and also with fine,10
117,117,SECTIONS,penalty for sale or delivery of commodity by non standard weight or measure whoever sell or cause to be sell or cause to be deliver any commodity article or thing by any mean other than the standard weight or measure or r shall be punish with fine which be less than two thousand rupee but which may extend to five thousand rupee and for the second or subsequent of fence with imprisonment for a term which shall not be less than three month but which may end to one year or with fine or with both,10
118,118,SECTIONS,penalty for render service by non standard weight measure or number whoever rend ers or cause to be render any service through mean other than the weight or measure or numeration or in term of any weight measure or number other than the standard weight or measure shall be punish with fine which shall not be less than two thousand rupee but which may extend to five thousand rupee and for the second or subsequent of fence with imprisonment for a term which shall not be less than three month but which may extend to one year or with fine or with both,11
119,119,SECTIONS,penalty for sell of non standard package whoever manufacture sell dis tri but es or otherwise offer expose or posse for sale or ca us es to be sell distribute deliver or otherwise transfer offer expose for sale any pack aged commodity which do not conform to the declaration on the package a provide in this act sha be pu ni shed with fine which may extend to twenty five thousand rupee for the second of fence with fine which may extend to fifty thousand,11
120,120,SECTIONS,rupee and for the subsequent of fence with fine which shall not be less than fifty thousand rupee but which may extend to one rupee or with imprisonment for a term which may e to one year or with whoever manufacture or pack or import or cause to be manufacture or pac ked or imp or ted any package commodity with error in net quantity a may be shall be punish with fine which shall not be less than ten thousand rupee but which may extend to fifty thousand rupee and for the second and subsequent of fence with fine which may extend to one rupee or with imprisonment for a term which may extend to one year or with both,11
121,121,SECTIONS,penalty for contravention by government approve test cent re where any government approve test cent re any of the provision of this act or the rule made thereunder or the condition of the it shall be punish with fine which may extend to one where any owner or employee of a gove approve test cent re perform duty inaccordance with the provision of this act or the rule make thereunder veri fi es or stamp any weight or measure in contravention of the provision of this act,11
122,122,SECTIONS,or the rule make thereunder he sh al l for every such contravention be punishable with imprisonment for a term which may extend to one year or with fine which may extend to ten thousand rupee or with both,11
123,123,SECTIONS,penalty for non registration by importer of weight or measure whoever import a or measure without be register under this act shall be punish with fine which may extend to twenty five thousand rupee and for the second or subsequent of fence with imprisonment for a term which may extend to six month or with fine or with both,11
124,124,SECTIONS,penalty for import of non standard weight or measure whoever import any non standard weight or measure shall be punish with fine which may extend to fifty thousand rupee and for the second or subsequent of fence with imprisonment for a term which may extend to one year and also with fine,11
125,125,SECTIONS,penalty for obstruct director controller or legal metrology officer whoever obstruct st he director the controller or any legal metrology officer with intent to prevent or deter the director or the controller or any legal metrology officer from exercise his power or discharge his function or in consequence of anything do or attempt to be do by the director or the controller or any legal metrology officer in the lawful exercise of his power or discharge of his function a such or the entry of the director,11
126,126,SECTIONS,or the controller or any legal metrology officer into any premise for inspection and verification of any weight or measure or any document or record relate thereto or the net contents of any package commodity or for any other purpose shall be punish with imprisonment for a term which may extend to two year and for the second or subsequent of fence with imprisonment for a term which may extend to five year,11
127,127,SECTIONS,penalty for give false information or false return whoever give any information to the director the controller or any legal metrology officer which he may require or ask for in the course of his duty and which such person either know or have reason to believe to be false shall be pu ni shed with fine which may extend to five thousand rupee and for the second or subsequent of fence with imprisonment for a term which may extend to six month and also with whoever be require by or under this act so to do a,12
128,128,SECTIONS,return or any record or register which be false in material particular shall be punish with fine which may extend to five thousand rupee and for the second or subsequent of fence with imprisonment for a term which may extend to one year and also with fine,12
129,129,SECTIONS,vexatious search the director the controller or any legal metrology officer under this act or any rule make thereunder who know that there be no reasonable ground for so do and yet a search or cause to be search any house conveyance or place orb search any person orc any weight measure or other movable property shall for every such of fence be punish with imprisonment for a term which m ay extend to one year or with fine which may extend to ten thousand rupee or with both,12
130,130,SECTIONS,penalty for verification in contravention of act and rule where the controller or any legal metrology officer exercise power under this act or any rule make thereunder veri fi es any weight or measure in contravention of the provision of this act or of any rule made thereunder he shall for every such of fence be punish with imprisonment for a term which may extend to one year or with f which may extend to ten thousand rupee or with both,12
131,131,SECTIONS,penalty for counterfeit of seal whoever i counterfeit any seal specify by or under this act o r the rule make thereunder sell or otherwise of any counterfeit seal posse any counterfeit seal counterfeit or remove or tamper with any stamp specify by or under this a or rule sma de thereunder affix the stamp so remove on or insert the same o any other weight or measure shall be punish with imprisonment for a term which shall not be less than six month but,12
132,132,SECTIONS,which may extend to one year and for the second or subsequent of fence with imprison for a term which shall not be less than six month but which may extend to five year sex planation in this sub section counterfeit shall have the meaning assign to it in section of the in dian penal code of whoever by u mean any seal specify by or under this act or the rule made thereunder and us or cause to be use any such seal for make any stamp on any weight or measure with a view to represent that,12
133,133,SECTIONS,the stamp make by such seal be a ut ho rise by or under this act or make thereunder shall be punish with imprisonment for a term which shall not be less than but which may extend to one year and for the second or subsequent of fence with imprisonment for a term which shall not be l es than six month but which may extend to five whoever be in lawful possession of a seal specify by or under this act or the rule made thereunder us or cause to be use such seal without any lawful authority for such use,12
134,134,SECTIONS,shall be pu ni shed with imprisonment for a term which shall not be less than six month but which may extend to one year and for the second or subsequent of fence with imprisonment for a term which shall not be less than six month but which may extend to five year whoever sell or offer or expose for sale or otherwise of any weight or measure which he know or have reason to believe bear thereon a counterfeit stamp shall be punish with imprisonment for a term which shall not be less than six m but which may extend to,12
135,135,SECTIONS,one year and for the second or subsequent of fence with imprisonment for a term which shall not be less than six month but which may extend to five year,12
136,136,SECTIONS,penalty for manufacture of weight and measure without who ever be require to obtain a under this act or the rule make thereunder manufacture without be in possession valid any weight or measure shall be punish with fine which may extend to twenty thou san drupe es and for the se cond or subsequent of fence with imprisonment for a term which may extend to one year or with fine or with both,13
137,137,SECTIONS,penalty for repair sale of weight and measure without whoever to obtain a under this act or the rule make thereunder repair or sell or offer posse for repair or sale any weight or measure without be in possession of a valid shall be punish with fine which may extend to five thousand rupee and for the second or sub sequent of fence with imprisonment for a term which may extend to one year or with fine or with both,13
138,138,SECTIONS,penalty for tamper with whoever alt ers or otherwise tamper with any or renew under this act or rule make thereunder otherwise than in accordance with any author is at ion make by the controller in this behalf shall be punish with fine which may extend to twenty thousand rupee or with imprisonment for a term which may extend to one year or with both,13
139,139,SECTIONS,compound o f of fence any of fence punishable under section section to to or any rule make under sub section of section may either before or after the institution of the prosecution be compound on payment for credit to the government of such sum as may be the director or legal metrology officer a may be specially a ut ho rise by him in this behalf may compound of fence punishable under section section to or any rule make under sub section section the,13
140,140,SECTIONS,controller or legal metrology officer specially a ut ho rise by him may compound under section section to section to section to and any rule made under sub section of section d that such sum shall not in any case exceed the maximum amount of the fine which may under this act for the of fence so nothing in sub section shall apply to person who the same or similar of fence wit hi na period of three year from the date on which the first,13
141,141,SECTIONS,of fence commit by him be for the purpose of this sub section any second or subsequent of fence commit ted after the expiry of a period of three year from the date on which the of fence be shall be deem to be a first where an of fence have be pound under sub section no proceed or further proceeding a the case may be shall be take against the offender in respect of the of fence no of fence under this act shall be compound except a provide by this section,13
142,142,SECTIONS,o by company and power of court to publish name place of business convict where an of fence under this act have be it ted by a company a i the person if any who have be nominate under sub section to be in charge of and responsible to the company for the conduct of the business of the company hereinafter in this section refer red to a a person responsible where no person have be nominate every person who at the time the of fence be in charge of and be,13
143,143,SECTIONS,responsible to the company for the conduct of t he business of the company the company shall be deem to be guilty of the of fence and shall be liable to be proceed against and pu ni shed accordingly provided that no thing contain in this sub section shall render any such person liable to any punishment provide in this act if he prof that the of fence be commit without his knowledge and that he exercise all due diligence to prevent the commission of such of fen any company may by order in write a ut ho rise any of it,13
144,144,SECTIONS,director to exercise all such power sand take all such step a may be necessary or expedient to prevent the commission by the company of any of fence under this act and may give notice to the director or the concerned controller or any legal metrology officer a ut ho rise in this behalf by such controller hereinafter in this section refer to a officer in such form and in such manner a may be that it have no min a ted such director a the person responsible along with the write consent of such director for be so,13
145,145,SECTIONS,nominated explanation where a company have different establishment or branch or different unit in any establishment or branch different person may be nominate under this sub section in relation to or branch or unit and the person nominate in relation to any establishment branch or unit shall be deem to be the person responsible in respect of such establishment b ranch or the person nominate er sub section shall until i far notice cancel such nomination be receive from,13
146,146,SECTIONS,the company by the director or the concerned controller or the a ut ho rise officer he cease to be a director of the company he make a request in write to the director or the concerned controller or the legal metrology officer under intimation to the company to cancel the nomination which request shall with by the director or the controller or the legal metrology officer whichever be the early con ti nu e to be the person responsible provided that where such person cease to be a director of the,13
147,147,SECTIONS,company he shall intimate the fact of such cessation to the director or the con or the a ut ho rise officer provided far that where such person make a request under clause the director or the concerned controller or the a ut ho rise officer shall not cancel such nomination with effect from a date ear lier than the date on which the request be notwithstanding anything contain in the forego sub section where an of fence under this act have be commit by a company and it be prove that the of fence have,13
148,148,SECTIONS,be commit with the consent or e of or be attributable to the neglect on the part of any director manager secretary or other officer not be a person nominate under sub section such director manager secretary or other officer shall also be deem to be guilty of that of fe and shall be liable to be proceed againstand punish where any company be convict under this act for contravention of any of the provision thereof it shall be competent for the court convict the company to cause the,13
149,149,SECTIONS,name and place of business of the company nature of the contravention the fact that the company have be so convict and such a the court may consider to be appropriate in the circumstance of the case to be publish at the expense of the c in such newspaper or in such other manner a the court may no publication under sub section shall be make until the period for prefer an appeal against the order of the court have expire without any appeal have be prefer or such an,13
150,150,SECTIONS,be prefer have be dispose the expense of any publication under sub section shall be recoverable from the company a if it be a fine impose by the for the purpose of this section a company mean any body corporate and include a firm or other association of director in relation to a firm mean a partner in the firm but nominate director sh on orary director government nominate director,13
151,151,SECTIONS,a subject to the provision of sub section an appeal shall lie a from every decision or order under section to section section section to or any rule make under sub section of section by the legal metrology office rap pointed under section to the direct orb from every decision or order make by the director of legal metrology under section section section section to section or any rule make under sub section of section to the,15
152,152,SECTIONS,central government or any officer specially a ut ho rise in this behalf by from every decision give by the controller of legal metrology under delegate power of director legal metrology to the central from every decision give or order make under section to section to to section to or any rule make under sub section of section by any legal metrology officer appoint under section to the controller an de from every decision give or order make by the,15
153,153,SECTIONS,controller under section to section section to section to or any rule make under sub section of section not being an order make in appeal under use d to the state government or any officer in this behalf by that every such appeal shall be prefer within sixty day from the date on which the impugn order was made provided that the appellate authority may if it be satisfied that the appellant be prevent by sufficient cause from prefer the appeal,15
154,154,SECTIONS,within the say period of sixty day permit the appellant to prefer the appeal within a far period of sixty on receipt of any such appeal t he appellate authority shall after give the party to the appeal a reasonable opportunity of be and after make such inquiry a it proper make such order as it may think fit confirm modify or reverse the decision or order a against or may send back the case with such direction a it may think fit for a fresh decision or order after take,15
155,155,SECTIONS,additional evidence if every appeal shall be prefer on payment of such fee a may be the central government or the state government a the case may be may on it own motion or otherwise call for and examine the record of any proceed include a proceed in appeal in which any decision or order have be make for the purpose of itself a to the correctness legality or propriety of such decision or order and may such order thereon a it may think fit provided that no decision or order,15
156,156,SECTIONS,shall be varied under this sub section so a to prejudicially affect any person unless such person have be give a reasonable opportunity of show cause against action,15
157,157,SECTIONS,provision of in dian penal code and code of criminal procedure not to apply of the in dian penal code of and section of the code of criminal of in so far a such provision relate to of fence with regard to weight or measure shall not apply to any of fence which be punishable under this act,15
158,158,SECTIONS,power of the central government to make rule the government may by notification make rule for carry out the provision of this in particular and without prejudice to the generality of the forego power such rule may provide for all or any of the follow matter namely a the specification of the base unit of measure and base unit of mass under sub section of section the manner of preparation of object and equipment under sub section of section physical characteristic,15
159,159,SECTIONS,configuration construct io na l detail material equipment performance tolerance period of re verification method or procedure of test under subsection of section reference standard secondary standard and work standard of weight and measure sunder sub section of section reference standard secondary standard and work standard shall be verify and stam ped and the fee under sub section of section the weight or measure or number in which any transaction ling or contract in respect,15
160,160,SECTIONS,of any good class of good or undertaking shall be make under section the qualification of the director and legal metrology officer under sub section of section the qualification of the controller and legal metrology officer under sub section of section the manner of disposal of good under sub section of section the standard quantity or number and the manner in which the package shall r and the particular under sub section of section the manner and,15
161,161,SECTIONS,registration and the fee under section the management and control of the institute the teach staff and other employee and curriculum for training thereat the qualification which a person shall posse in order tobe eligible for admission thereto under sub section of section the manner fee and authority for approval of model under section the kind of weight or measure under sub section of section the manner in which term and condition on which and fee on payment which the,15
162,162,SECTIONS,central government shall notify the government approve test cent re under sub section of section the qualification and experience of person appoint or engage and the fee and term and con di ti ons on which government approve test cent re shall verify the weight or measure under subsection of section the error in net under sub section of section fee for compound of of fence under sub section of section form and manner in which notice to the director or the controller or any other,15
163,163,SECTIONS,by him shall be give under sub sect io n of section in make any rule under this section the central government may provide that a breach thereof shall be punishable with fine which may extend to five thousand every rule make by the central government under this act sh all be laid a soon a may be after it is make before each house of parliament while it be in session for a total period of thirty day which may be comprise in one session or in two or more successive session and if before the,15
164,164,SECTIONS,expiry of the sess io n immediately follow the session or the successive session aforesaid both house agree in making any modification in the rule or both house agree that the rule should not be make the rule shall thereafter have effect only in such modify form or be of no effect a the case may be so however such modification or annulment shall be without prejudice to the validity of anything previously done under that rule,15
