,Unnamed: 0,Title,Paragraph Text,Page No
0,0,SECTIONS,short title application and commencement,1
1,1,SECTIONS,de fi ni ti ons chapter national council for clinical es tab li,1
2,2,SECTIONS,establishment of national council,1
3,3,SECTIONS,disqualification for appointment a member,1
4,4,SECTIONS,function of national council,1
5,5,SECTIONS,power to seek advice or assistance,1
6,6,SECTIONS,national council to follow consultative process chapter and st anda for clinical establishment,1
7,7,SECTIONS,state council of clinical establishment,1
8,8,SECTIONS,provide information to national council,1
9,9,SECTIONS,authority for registration,1
10,10,SECTIONS,registration for clinical establishment s,1
11,11,SECTIONS,condition for registration,1
12,12,SECTIONS,classification of clinical establishment for registration,1
13,13,SECTIONS,application for provisional certificate of registration,1
14,14,SECTIONS,provisional certificate,1
15,15,SECTIONS,no inquiry to provisional registration,1
16,16,SECTIONS,validity of provisional registration,1
17,17,SECTIONS,display of certificate of registration,1
18,18,SECTIONS,duplicate certificate,1
19,19,SECTIONS,certificate to be non transferable,1
20,20,SECTIONS,publication of expiry of registration,1
21,21,SECTIONS,renewal of registration,1
22,22,SECTIONS,time limit for provisional,1
23,23,SECTIONS,application for permanent registration,2
24,24,SECTIONS,verification of application,2
25,25,SECTIONS,display of information for filing objection,2
26,26,SECTIONS,communication of objection,2
27,27,SECTIONS,standard for permanent registration,2
28,28,SECTIONS,allow or disallow of registration,2
29,29,SECTIONS,certificate of permanent registration,2
30,30,SECTIONS,fresh application for permanent registration,2
31,31,SECTIONS,cancellation of registration,2
32,32,SECTIONS,inspection of register clinical establishment,2
33,33,SECTIONS,power to enter,2
34,34,SECTIONS,levy of fee by state government al,2
35,35,SECTIONS,appeal chapter of clinical establishment s,2
36,36,SECTIONS,register of clinical establishment s,2
37,37,SECTIONS,maintenance of state register of clinical establishment s,2
38,38,SECTIONS,maintenance of national register of clinical establishment,2
39,39,SECTIONS,penalty,2
40,40,SECTIONS,monetary penalty for non registration,2
41,41,SECTIONS,disobedience of direction obstruction and refusal of information,2
42,42,SECTIONS,penalty for minor deficiency,2
43,43,SECTIONS,contravention by company,2
44,44,SECTIONS,of fence by government department,2
45,45,SECTIONS,recovery of fine chapter,2
46,46,SECTIONS,protection of action take in good faith,2
47,47,SECTIONS,furnish of return,2
48,48,SECTIONS,power to give direction,2
49,49,SECTIONS,employee of the authority to be public servant,2
50,50,SECTIONS,power to remove difficulty,2
51,51,SECTIONS,power of central government to make rule,2
52,52,SECTIONS,lay of rule,2
53,53,SECTIONS,power of state government to make rule,2
54,54,SECTIONS,lay of rule,2
55,55,SECTIONS,clinical establishment registration and regulation act no of august act to provide for the registration and regulation of clinical establishment in the country and for matter connect therewith or incidental thereto whereas it be consider expedient to provide for the registration and regulation of with a view to prescribe minimum standard of facility and service which may be provided by them so that mandate of article of the constitution for improvement in,2
56,56,SECTIONS,public health maybe achieve dand whereas parliament have no power to make law for the state with respect to any of the matter sa foresaid except a provide in article and of the constitution and whereas in pursuance of clause of article of the constitution resolution have by all the house of the legislature of the state of aru na chal hi ma chal and to the effect that the matter aforesaid should be regulate in those state by parliament by law be it enact by parliament in the sixty first year of th e republic of a follow chapter i,2
57,57,SECTIONS,short title ion and commencement this act may be call the registration and regulation act it a p plies in the first instance to the whole of the state of aru na chal hi ma chal and and the union territory and it shall apply to such other state which this act by resolution pass in that behalf under clause of article of the it shall come into force at once in the state of aru na chal hi ma chal mi zo ra mand,3
58,58,SECTIONS,and the union territory on such date a the central government may by notification appoint and in any other state which this act under clause of article of the constitution on the date of such adoption and any reference in this act to the commencement of this act shall in relation to any state or union territory mean the date on which this act come into force in such state or union territory provided that different date may be appoint for different category of clinical establishment and for different re cog ni se system of medicine,3
59,59,SECTIONS,definition in this act unless the context otherwise require a authority mean the district register authority set up under section certificate mean certificate of registration issue under section clinical establishment mean si a hospital maternity home nursing home dispensary clinic um or an institution by whatever name call that offer service facility require diagnosis treatment or care for illness injury deformity abnormality or pregnancy in any re cog ni se system of,3
60,60,SECTIONS,medicine established and administer or maintain by any person or body of person whether incorporated or not a place establish a an independent entity or part of an establishment refer to in subclause i in connection with the diagnosis or treatment of disease where genetic radiological chemical biological investigation or other diagnostic or investigative service with the aid of laboratory or other medical equipment be usually carried on establish and administer or maintain by,3
61,61,SECTIONS,a person or body of person whether incorporated or not and shall include a clinical establishment own or manage by a the government or a department of the a trust whether public or a corporation include a society register under a central provincial or state act whether or not own by the a local authority an de a single doctor but do not include the clinical establishment own control or manage by the arm for the purpose of this clause,3
62,62,SECTIONS,arm force mean the force constitute under the army act of the air force act of and the navy act of d emergency medical condition mean a medical condition manifest itself by of sufficient severity include severe pain of such a nature that the absence of immediate medical attention could re as on ably be expect to result in i place the of the individual or with respect to a pregnant woman the health of the woman or her unborn child in serious,3
63,63,SECTIONS,jeopardy serious impairment to bodily function serious dysfunction of any organ or part of a bo dye national council mean the national council for clinical establishment establish under section notification mean a notification publish in the official mean by rule make under this act by the central government or as the case may be the state govern me nth re cog ni se system of medicine mean allopathy yoga naturopathy and un ani,3
64,64,SECTIONS,system of medicine or any other system of medicine a may by the central govern men ti register mean the register maintain by the authority state government and the central government under section and respectively of this act contain the number of registration mean to register u section and the expression registration or registered shall be construe rule mean rule make under this schedule mean the schedule append to this,3
65,65,SECTIONS,standard mean the condition that the central may prescribe under for the registration of clinical state government in relation to a union territory mean the administrator thereof a p pointed under article of the constitution an do to with it grammatical variation and cognate expression mean with respect to an emergency medical condition specify in clause d to provide such medical treatment of the condition a may be necessary to assure within reasonable,3
66,66,SECTIONS,medical probability that no material deterioration of the condition be likely to result from or occur during the transfer of the individual from a clinical establishment chapter national council for clinical establishment,3
67,67,SECTIONS,establish me of national council with t from such date a the central government may by notification appoint in this behalf there shall be establish for the purpose of this act a council to be call the national council for clinical the na ti on al council shall consist director general of health service ministry of health and family welfare ex who shall be the four representative out of h one each to be elect by the i dental council of constitute,5
68,68,SECTIONS,under section of the dentist act of medical council of constitute under section of the in dian medical council of nursing council of constitute under section of the in dian nursing council of pharmacy council of constitute under section of the pharmacy act of c three representative to be elect by the central council of in dian medicine represent and un ani system of medicine constitute under,5
69,69,SECTIONS,section of the in dian medicine central council act of d one representative to be elect by the central council of homoeopathy constitute under section of the homoeopathy central council act of e one representative to be elect by the central council of the in dian medical one representative of bureau of the in dian constitute under section of the bureau of in dian standard act of g two representative from the zonal council set up under section of,5
70,70,SECTIONS,the st ates re organ is at ion act of h two representative from the north eastern council set up under section of the north eastern council act of i one representative from the line of para medical system exclude system that have been given representation under clause two representative from national level consumer group to be nominate by the one representative from the association of in dian system of medicine relate and un ani to be nominate by,5
71,71,SECTIONS,the central the secretary general of the quality council of ex the nominate member of the na ti on al council shall hold office for three year but shall be eligible for re nomination for maximum of one more term of three the elect member of the national council shall hold office for three year but shall be eligible for re election provided that the person nominate or elect a the case may be shall hold office for such period till he hold appointment of the office by virtue of which he,5
72,72,SECTIONS,be nominate or elect to the the member of the national council shall be it led for such allowance a may be the central the national council may subject to the previous approval of the central government fix a quorum and regulate it own procedure and the conduct of all busine s to bet ran sac ted by the national council shall meet at least once in three the national council may constitute sub committee and may appoint to such sub committee a sit,5
73,73,SECTIONS,fit person who be not member of the national l for such period not exceed for the consideration of particular the function of the national council may be exercise notwithstanding any vacancy the central government shall appoint such person to be the secret ary of the national council as the central government may prescribe and may provide the national council with such other secretarial and other staff a the central government necessary,5
74,74,SECTIONS,dis qua li fi ca ti ons for appointment a member a person shall be disqualify for be in gap pointed a a member of the national council if he a have be convict and sentence to imprisonment for an of fence which in the opinion of the central government moral turpitude orb be an undischarged in solvent orc be of unsound mind and stand so declare by a competent court have be remove or dismiss from the service of the government or a corporation own or control led by the government ore have in the opinion of,6
75,75,SECTIONS,the central government such financial or other interest in the council a sis likely to affect prejudicially the discharge by him of his function a a member,6
76,76,SECTIONS,n of national council the national council shall a compile and publish a national register of clinical establishment within two year from the date of the commencement of this the clinical establishment into different develop the minimum standard and their periodic determine within a period of two year from it establishment the first set of standard for en sur ing proper health care by the clinical establishment se collect the statistic in respect of clinical perform any other function determine by the central government om time to time,6
77,77,SECTIONS,power to seek advice or assistance the national council may associate with itself any person or body whose assistance or advice it may desire in carry out any of the provision of this act,7
78,78,SECTIONS,national council to follow consultative process the national council shall follow a consultative process for determine the standard and for classification of clinical establishment inaccordance with such procedure a may be and standard for clinical e,7
79,79,SECTIONS,state of clinical establishment every state government shall by notification constitute a state council for clinical establishment or the union territory council for a the case may the state council or the union territory council a the case may be shall consist of the following member namely a secretary health ex who shall be the director of health service ex member director of different stream s of in dian system of medicine ex,7
80,80,SECTIONS,one representative each to be d by the executive committee of i state medical council of state dental council of state nursing council of state pharmacy council of in di ae three representative to be elect by the executive of the state council or the union territory council a the case may be of in dian medicine represent the and of one r to be elect by the state council of the in dian medical one,7
81,81,SECTIONS,representative from the line of para medical system sh two representative from state level consumer group or repute non governmental organ is a ti ons work in t he field of the nominate member of the state council or the union territory council a the case may be shall hold office for a term of three year but shall be eligible for re nomination for maximum of one more term of three year the elect member of the state council or the union territory council a the case may be shall hold office for three year but,7
82,82,SECTIONS,shall be eligible for re election provided that the person nominate or elect a the case may be shall hold office for so l a the appointment of the office by virtue of which he be nominate or elect to the state council or the union territory council a the case may the state council or the union territory council shall perform the follow function na mel ya compile and update the state register of clinical send monthly return for update the national represent,7
83,83,SECTIONS,the state in the national hearing of appeal against the order of the author an de publication on annual basis a report on the state of implementation of standard within the irrespective state,7
84,84,SECTIONS,provide information to national council it shall be the responsibility of the state council for clinical establishment to c om pile and update the state register of clinical establishment of the state and far to send monthly return in digital format for update the national register,8
85,85,SECTIONS,authority for registration the state government shall by notification set up an authority to be call the district register authority for each district for registration of clinical establishment swith the follow member namely a district collector district health officer three member with such qualification and on such term and condition a may by the central notwithstanding anything contain in sub section for the purpose of provisional,8
86,86,SECTIONS,registration of clinical establishment under section t he district health officer or the chief medical officer by whatever name call shall exercise the power of the authority a per procedure that may be,8
87,87,SECTIONS,registration for clinical establishment no person shall run a clinical establishment unless be duly register in accordance with the provision of this act,8
88,88,SECTIONS,condition for registration for registration and continuation every clinical establishment shall th e follow condition namely i the minimum standard of facility and service a may be the minimum requirement of personnel a may be provision for maintenance of record and report ing a may be prescribe div such other condition a may be the clinical establishment shall undertake to provide within the staff and facility available such medical examination and treatment a may be require to the emergency medical condition of any individual who come or be brought to such clinical e stablishment,8
89,89,SECTIONS,classification of clinical establishment clinical establishment of different system shall be into such category a may be by the central government from time to different standard may be bed for classification of different category refer to in subsection that in prescribe the standard for clinical establishment the central government shall have regard to the local for registration,8
90,90,SECTIONS,application for provisional certificate of registration for the purpose of registration of the clinical establishment under section an application in the pro for ma along with fee shall be make to the the application shall be file in person or by post or the application shall be make in such form and shall be accompany by such detail a may under this act or rule make if any clinical es tab lis be in existence at the time of the commencement of,9
91,91,SECTIONS,this act an application for it registration shall be make within one year from the date of the commencement of this act and a clinical establishment which come into existence after commencement of this act shall apply for permanent registration within a period of six month from the date of it if any clinical establishment be already register under any exist law require registration of such establishment even then it s hall apply for registration a refer to in sub section,9
92,92,SECTIONS,provisional certificate the authority shall within a period of ten day from the date of receipt of such application grant to the applicant a certificate of provisional registration in s form and contain ing such particular and such information a may be,9
93,93,SECTIONS,no inquiry to provisional registration the authority shall not conduct any inquiry prior to the grant of provisional notwithstanding the grant of the provisional certificate of registration the authority shall within a period of forty five day from the grant of provisional registration cause to be publish in such manner as may be all particular of the clinical so register provisionally,9
94,94,SECTIONS,valid of provisional registration subject to the provision of section every provisional registration shall be valid to the last day of the twelfth month from the date of issue of the certificate of registration and such registration shall be renewable,9
95,95,SECTIONS,display of certificate of registration the certificate shall be kept a f fixed in a conspicuous place in the clinical establishment in such manner so a to be visible to every one visit such establishment,9
96,96,SECTIONS,duplicate certificate in case the certificate be lose mutilate or damage the authority shall issue a duplicate certificate on the request of the clinical establishment and on the payment of such fee a may be,9
97,97,SECTIONS,ti fi cate to be non transferable the certificate of registration shall be non in the event of change of ownership or management the clinical establishment shall inform the authority of such change in such manner a may be in the event of change of category or location or on cease to function a a clinical establishment the certificate of registration in respect of such clinical establishment shall be the authority and the clinical establishment shall apply afresh for grant of certificate of registration,9
98,98,SECTIONS,public at ion of expiry of registration the authority shall cause to be publish within such time and in such manner a may be the name of clinical establishment whose,9
99,99,SECTIONS,renewal of registration the application for renewal of registration shall be make thirty days before the expiry of the validity of the certificate of provisional registration and in case the renewal be make after the expiry of t he provisional registration the authority shall allow renewal of registration on payment of such enhance fee a may be,9
100,100,SECTIONS,time limit for provisional registration where the clinical establishment in respect of have be no by the central government provisional registration shall no t be grant or re ne wed beyond i the period of two year from the date of notification of the standard in case of which come into existence before the of this the period of two year from the date of notification of the standard for which come into existence after the commencement of,10
101,101,SECTIONS,this act but before the notification of the standard the period of six month from the date of notification of standard for clinical come into existence after standard have be notify,10
102,102,SECTIONS,application for permanent registration application for permanent registration by a clinical establishment shall be make to the authority in such form and be accompany by such fee a may,10
103,103,SECTIONS,verification of application the clinical establishment shall submit evidence of with the minimum standard in such manner a may be,10
104,104,SECTIONS,display of in formation for filing objection a soon a the establishment evidence of have comply with the minimum standard the authority shall cause tobe displayed for information of the public at large and for filing objection if any in such manner a maybe all evidence submit by the clinical establishment of have comply with the standard for a period of thirty day before process ing for grant o f permanent registration,10
105,105,SECTIONS,communication of objection if objection be receive within the period refer to in the preceding section such objection shall be communicate to the clinical establishment for response within a period of forty five day s,10
106,106,SECTIONS,standard for permanent registration permanent registration shall be grant only when a clinical establishment the standard for registration by the central government,10
107,107,SECTIONS,allow or disallow of registration the authority shall an order immediately after the expiry of the period and within the next thirty day thereafter era allow the application for permanent registration orb disallow the application provided that the authority shall it reason if it an application for permanent registration,10
108,108,SECTIONS,certificate of permanent registration the authority shall if it an application of the clinical establishment issue a certificate of permanent registration in h form and contain a may be the certificate shall be valid for a period of five year from the date of for the purpose of sub section the provision of section and shall also the application for renewal of permanent registration shall be make within six month before the expiry of the,10
109,109,SECTIONS,validity of the certificate of permanent registration and in case the application of renewal is not submit within the stipulate period the authority may allow renewal of registration on payment of such enhance fee and penalty a may be,10
110,110,SECTIONS,fresh a p plica ti on for permanent registration the disallow of an application for permanent registration shall not debar a clinical es ta from apply afresh for permanent registration under section and after provide such evidence a may be require of have rectified the on which ground the ear lier application be di sal lo wed,11
111,111,SECTIONS,cancellation of registration if at any time after any clinical establishment have been registered t he authority be satisfied that a the condition of the registration be not be comply with orb the person entrust with the management of the clinical establishment have be convict of an of fence punishable under this act it may issue a notice to the clinical establishment to show cause within three month time a to why its registration under this act should not be cancel for the reason to be mention in the,11
112,112,SECTIONS,if after give a reasonable opportunity to the clinical es tab lis the authority be satisfied that there have be a breach of any of the provision of this act o r the rule make thereunder it may by an order without prejudice to any other action that it may take against such clinical establishment cancel every order make under sub section shall take effect a where no appeal have bee n prefer against such order immediately on the expiry of the for such appeal where,11
113,113,SECTIONS,such appeal have be prefer and it have be dismiss from the date of the order of such dismissal provided that the authority after can ce of registration for reason to be record in writing may restrain immediately the clinical establishment from carry on if there be imminent danger to the health and safety of patient,11
