,Unnamed: 0,Title,Paragraph Text,Page No
226,226,SECTIONS,shall either adopt it or refer it to the visitor whose decision shall be ever y ordinance make by the board shall come into effect every ordinance make by the board shall be submit to the visitor within two week from the date of it adoption the visitor shall have the power to direct the university within four week of the receipt of the ordinance to suspend the operation of any such ordinance and he shall a s soon as possible inform the board about his objection to the propose ordinance the visitor may,26
227,227,SECTIONS,the comment of the university either withdraw the order suspend the ordinance or disallow the ordinance and his decision shall be final regula ti ons,26
228,228,SECTIONS,the authority of the university may make regulation consistent with the act the statute sand the ordinance for the follow matter namely i lay down the procedure to be observe at their meeting and the number of to form a provide for all matter which be require by the act the statute or the ordinance to by the re gul at provide for all other matter concern such authority or committee appoint by the mand not provide for by the act the statute or the,27
229,229,SECTIONS,every authority of the university shall make regulation provide for the give of notice to the member of such authority of the date of meeting and of the business to be consider and for the keep of a record of the proceeding of the board may direct the amendment in such manner a it may specify of any regulation made under the statute or the annulment of any such regulation delegation of power,27
230,230,SECTIONS,subject to the provision of the act and the statute any officer or authority of the university may delegate his or it power to any other office r or authority or person under his or it respective control and subject to the condition that overall responsibility for the exercise of the power so dele gated shall continue to vest in the officer or authority delegate such pow ers collaboration with other institution and organ is at ion,27
231,231,SECTIONS,the university shall have the authority to enter into an agreement through a memorandum of understanding with any research an dor academic institution of high learn to conduct collaborative post graduate re se arc h pro gramme to the partial requirement for the award of master and of the university constitution and function of research council,27
232,232,SECTIONS,there shall be a research council of the university to exercise general supervision over the research policy and pro gramme of the university in the area of agriculture and allied discipline the research council shall consist of the follow member namely i the vice chancellor director of extension education director of education all dean of the college of the university nominee of the state government not below the rank of director all,27
233,233,SECTIONS,of the research team of the university two eminent agricultural scientist to be nominate by the vice chancellor for director of research member the research council shall meet at least once in a one third member of the research council shall form a quorum for the meeting of the research if a vacancy due to resignation or otherwise the same shall be fill up for the remain ing period constitution and function of the extension education council,27
234,234,SECTIONS,there shall be an extension education council of the university to exercise general supervision over the extension education policy and pro gramme of the university in the area of agriculture and allied discipline the extension education council shall con si st of the namely i the vice chancellor director of research director of education all dean of the college of the university nominee of the state government not below the rank of director,28
235,235,SECTIONS,farmer representative from bund elk hand and one woman social worker to be nominated by the vice chancellor for a term of three year two eminent scientist from outside the university to be nominate by the vice chancellor for two year director of extension education member the extension education council shall meet at least once in a one third member of the extension education council shall form a quorum for the meeting of the extension education council application of the central civil service pension rule,28
236,236,SECTIONS,all regular employee of the university shall be govern by the provision of the central civil service pension rule and general provident fund central service rule in respect of grant of pension and gratuity and general provident any amendment make by the government of in the central civil service pension and the general provident fund central service rule shall also be applicable of the in respect of commutation of pension the provision of the central civil service commutation of pension rule shall the vice chancellor shall be the pension sanction authority and the pension pension payment shall be cent ra li se and control by comptroller office,28
